question,QID,answer,answer_OID
"Arnold Schwarzenegger and Danny De Vito played together in this movie. Their characters were brothers, raised separately at different locations, not knowing about each other.",CELEBRITIES_e5ff_1671,"Twins (1988)",CELEBRITIES_OPT_2f0f_000B
"Schwarzenegger has been a Republican ever since he came to the US. In 2003 he became the Governor of California, serving the remainder of this mans term.",CELEBRITIES_7634_1672,"Gray Davis",CELEBRITIES_OPT_0c84_000B
"In 1992, Arnold Schwarzenegger became the first owner of a Hummer vehicle manufactured for civilian use (this is true). The original Hummer was so large, that it was classified as a large truck.",CELEBRITIES_0478_1673,True,CELEBRITIES_OPT_8e07_000B
"When was actor Tom Hanks born?",CELEBRITIES_cadd_1674,"July 9, 1956",CELEBRITIES_OPT_43a7_000B
"Where was Tom Hanks born?",CELEBRITIES_0fe2_1675,"Concord, California USA",CELEBRITIES_OPT_9b66_000D
"What city did Tom Hanks move to in 1978?",CELEBRITIES_4c36_1676,"New York City, New York",CELEBRITIES_OPT_0935_000B
"What real life detective did Tom Hanks portray in the 2002 film Catch Me If You Can?",CELEBRITIES_5568_1677,"Carl Hanratty",CELEBRITIES_OPT_7613_000A
"In the movie Forrest Gump, how many presidents does Forrest meet?",CELEBRITIES_2b34_1678,3,CELEBRITIES_OPT_3002_000B
"In which of these movie pairs did Gart Sinise co-star with Tom Hanks?",CELEBRITIES_bf91_1679,"Forrest Gump and Apollo 13",CELEBRITIES_OPT_5338_000A
"When did Tom Hanks win back-to-back Academy Awards for best actor?",CELEBRITIES_4f02_1680,"1993 and 1994",CELEBRITIES_OPT_29be_000A
"Who was Tom Hanks running partner for The Bad Haircut Party?",CELEBRITIES_f084_1681,"Conan OBrien",CELEBRITIES_OPT_ad5d_000A
"How is actor Tom Hanks probably related to Abraham Lincoln?",CELEBRITIES_d0f3_1682,"third cousin, four times removed",CELEBRITIES_OPT_48fa_000A
"Who did Tom Hanks portray in the 1995 film Apollo 13?",CELEBRITIES_592c_1683,"Jim Lovell",CELEBRITIES_OPT_7d5f_000C
"American comedian, actor and writer, Steve Martin was born in Waco, Texas in what year?",CELEBRITIES_71e3_1684,1945,CELEBRITIES_OPT_46ed_000B
"Actor and comedian Steve Martin attended which two educational institutions?",CELEBRITIES_1996_1685,"Santa Ana College and California State University, Long Beach",CELEBRITIES_OPT_f16a_000A
"In 1969, Steve Martin received an Emmy Award in what category?",CELEBRITIES_6dcd_1686,Writing,CELEBRITIES_OPT_f4d8_000D
"Steve Martins film debut, in the short movie The Absent-Minded Waiter was in what year?",CELEBRITIES_c3ba_1687,1977,CELEBRITIES_OPT_a616_000D
"In 1979, Steve Martin wrote and starred in his first full-length movie, named what?",CELEBRITIES_3d5f_1688,"The Jerk",CELEBRITIES_OPT_2cd7_000C
"Steve Martin made his first appearance on The Tonight Show, hosted by Johny Carson, in what year?",CELEBRITIES_9044_1689,1972,CELEBRITIES_OPT_2c03_000A
"This album, which in 1977 won the Grammy Award for Best Comedy Album, was Steve Martins first.",CELEBRITIES_de84_1690,"Lets Get Small",CELEBRITIES_OPT_bbfd_000A
"This 1986 comedy western file was written by Steve Martin and Lorne Michaels.",CELEBRITIES_c81e_1691,"Three Amigos!",CELEBRITIES_OPT_5a3d_000C
"This 1991 movie, directed by Mick Jackson, tells the story of weatherman Harris K. Telemacher, portrayed by Steve Martin.",CELEBRITIES_bd83_1692,"L.A. Story",CELEBRITIES_OPT_779f_000A
"This play, set on October 8, 1904, was written by Steve Martin in 1994.",CELEBRITIES_808f_1693,"Picasso at the Lapin Agile",CELEBRITIES_OPT_726b_000A
"Jack Nicholsons first academy award nomination came for portraying a southern lawyer in the film Easy Rider.",CELEBRITIES_6156_1694,True,CELEBRITIES_OPT_9f92_000A
"Jack Nicholson holds the record for number of acting academy award nominations received in the history of cinema.",CELEBRITIES_1602_1695,False,CELEBRITIES_OPT_2c78_000A
"Which actress did not appear with Jack Nicholson in the film The Witches of Eastwick?",CELEBRITIES_d252_1696,"Jessica Lange",CELEBRITIES_OPT_a1f6_000B
"Which of the following is not an academy award winning character portrayed by Jack Nicholson?",CELEBRITIES_d819_1697,"Jack Torrance",CELEBRITIES_OPT_e5d1_000D
"What kind of character did Jack Nicholson portray in the movie Terms of Endearment?",CELEBRITIES_0d32_1698,"A retired astronaut",CELEBRITIES_OPT_bddb_000B
"In the film The Last Detail Jack Nicholsons character works in the oil fields, but is really an accomplished pianist.",CELEBRITIES_4bc7_1699,False,CELEBRITIES_OPT_8fc4_000B
"With 3 of Jack Nicholson Oscar wins, his female costar in the respective movie has also won an Oscar.",CELEBRITIES_f737_1700,True,CELEBRITIES_OPT_30b8_000B
"Which of these performers has Jack Nicholson not appeared in a movie with?",CELEBRITIES_0de6_1701,"Paul Newman",CELEBRITIES_OPT_ef9b_000D
"You cant handle the truth. is a famous Jack Nicholson quote from what movie?",CELEBRITIES_130a_1702,"A Few Good Men",CELEBRITIES_OPT_7c33_000A
"Which of these movies did Jack Nicholson not appear in?",CELEBRITIES_4820_1703,"The Score",CELEBRITIES_OPT_924d_000B
"Where does he get all those wonderful toys? is a quote from what Jack Nicholson film?",CELEBRITIES_2e8c_1704,Batman,CELEBRITIES_OPT_6fd1_000C
"In The Raven, Jack Nicholson gets to perform with Boris Karloff and Vincent Price, and Peter Lorre.",CELEBRITIES_096b_1705,True,CELEBRITIES_OPT_310e_000A
"What 1958 movie marked Jack Nicholsons debut as an actor?",CELEBRITIES_c4d0_1706,"The Cry Baby Killer",CELEBRITIES_OPT_56c2_000D
"On July 2nd 1986, Lindsay Morgan Lohan was born to  Dina and Michael Lohan in New York City, New York. She was then raised in this town.",CELEBRITIES_7121_1707,"Cold Spring Harbor, New York",CELEBRITIES_OPT_a020_000D
"Lindsay began her career at this age, as a model of Ford Academy. Finding work as a child model was rather difficult at first, because her auburn hair and freckled face werent very popular.",CELEBRITIES_8468_1708,3,CELEBRITIES_OPT_0a75_000B
"In a 2004 movie, Lindsay Lohan played a girl who lived in Africa for her first 15 years. Suddenly, she has to learn what high school in the U.S. means and how to survive it (this is true). The movie was a Disney production.",CELEBRITIES_5e5c_1709,False,CELEBRITIES_OPT_d8bb_000A
"In this non-musical MTV show, a practical joke was played on Lindsay Lohan- the show crew made her believe that a vehicle had been stolen. Can you remember the name of the show?",CELEBRITIES_9736_1710,Punkd,CELEBRITIES_OPT_715e_000A
"Lindsay entered the world of pop music when she signed a five-album production deal with Emilio Estefan in 2002. In 2003, she performed this song for the Freaky Friday soundtrack.",CELEBRITIES_4d41_1711,Ultimate,CELEBRITIES_OPT_682e_000B
"In 2004 Lindsay Lohan dated the actor Wilmer Valderrama.",CELEBRITIES_c788_1712,True,CELEBRITIES_OPT_5eb5_000B
"Lohan signed a recording contract with Casablanca Records in 2004, and her debut album was released on 7th of December of the same year.  What was the name of the album?",CELEBRITIES_4daf_1713,Speak,CELEBRITIES_OPT_8578_000A
"Lindsay Lohan has played in one of the movies in the Herbie series- Herbie: Fully Loaded. What was the name of her character in the movie?",CELEBRITIES_2111_1714,"Maggie Peyton",CELEBRITIES_OPT_4bd4_000B
"Lindsay is involved in many charity organisations and projects, such as The Carol M. Baldwin Breast Cancer Foundation, Save the Children and The United Cerebral Palsy Association. She also has her own charity organisation, called this.",CELEBRITIES_84db_1715,"Dream Come True",CELEBRITIES_OPT_16dc_000A
"Lindsay has three younger siblings- Michael, Dakota and this girl.",CELEBRITIES_6cb9_1716,Aliana,CELEBRITIES_OPT_293f_000A
"They called her this, because her body shape bears resemblance to it.",CELEBRITIES_a50e_1717,"La Guitarra",CELEBRITIES_OPT_96eb_000A
"She started taking dancing and singing lessons at this age.",CELEBRITIES_1b08_1718,5,CELEBRITIES_OPT_5385_000C
"Before becoming a star Jennifer did work with this celebrity.",CELEBRITIES_0a72_1719,"Janet Jackson",CELEBRITIES_OPT_2051_000C
"For her part in Selena Jennifer was paid this sum.",CELEBRITIES_ee48_1720,"$1 million",CELEBRITIES_OPT_39c7_000A
"Jennifer Lopez was born there.",CELEBRITIES_cbca_1721,"Bronx, New York",CELEBRITIES_OPT_009f_000A
"This is the name of Jennifers own line of perfume.",CELEBRITIES_67b2_1722,Glow,CELEBRITIES_OPT_8b2a_000D
"She does not drink this.",CELEBRITIES_1dc7_1723,Alcohol,CELEBRITIES_OPT_c721_000C
"For her role in Gigli Jennifer won Razie for this.",CELEBRITIES_e32f_1724,"Worst actress",CELEBRITIES_OPT_8208_000C
"Lopez attended this kind of high-school.",CELEBRITIES_fbb8_1725,"All-girl high school",CELEBRITIES_OPT_ff3b_000D
"In 2001 Jennifer Lopez was ranked this in FHMs 100 Sexiest Women list.",CELEBRITIES_ae56_1726,"# 1",CELEBRITIES_OPT_e8fc_000B
"What is the name of Tom Hanks character in the movie The Green Mile?",CELEBRITIES_0f18_1727,"Paul Edgecomb",CELEBRITIES_OPT_2488_000A
"What is the name of Tom Hanks character is the movie The Burbs?",CELEBRITIES_61c1_1728,"Ray Petersen",CELEBRITIES_OPT_28b5_000B
"What is the name of the character played by Tom Hanks in the movie Castaway?",CELEBRITIES_fd76_1729,"Chuck Noland",CELEBRITIES_OPT_d362_000C
"What is the name of Tom Hanks character in the movie Sleepless in Seattle?",CELEBRITIES_f487_1730,"Sam Baldwin",CELEBRITIES_OPT_a152_000B
"What is the name of the character portrayed by Tom Hanks in the movie Splash?",CELEBRITIES_9009_1731,"Allen Bauer",CELEBRITIES_OPT_4947_000A
"What is the name of Tom Hanks character in the movie A League of Their Own?",CELEBRITIES_7472_1732,"Jimmy Dugan",CELEBRITIES_OPT_ef7c_000D
"What is the name of the character played by Tom Hanks in the movie Bachelor Party?",CELEBRITIES_c8a9_1733,"Rick Gasko",CELEBRITIES_OPT_b759_000D
"What is the name of Tom Hanks character in the movie The Money Pit?",CELEBRITIES_7eb3_1734,"Walter Fielding Jr.",CELEBRITIES_OPT_47d5_000D
"What is the name of Tom Hanks character in the movie Catch Me If You Can?",CELEBRITIES_30df_1735,"Carl Hanratty",CELEBRITIES_OPT_71f1_000B
"What is the name of the character played by Tom Hanks in the movie Joe Versus the Volcano?",CELEBRITIES_7477_1736,"Joe Banks",CELEBRITIES_OPT_0fef_000A
"Which American actress was banned from The Philippines in September 1998?",CELEBRITIES_8371_1737,"Claire Danes",CELEBRITIES_OPT_9032_000A
"Which actress played the younger sister in 1999s 10 Things I Hate About You?",CELEBRITIES_c57a_1738,"Larisa  Oleynik",CELEBRITIES_OPT_a8b0_000C
"Which actress was the first choice for “Rose from the 1997 hit “Titanic?",CELEBRITIES_7af6_1739,"Claire Danes",CELEBRITIES_OPT_82bf_000B
"In 1991 Sarah Jessica Parker appearred in “L.A.Story. Who was the male star of the movie?",CELEBRITIES_d0ef_1740,"Steve Martin",CELEBRITIES_OPT_bab2_000D
"Which of these actresses won an Oscar for portraying a male character?",CELEBRITIES_1543_1741,"Linda Hunt",CELEBRITIES_OPT_0ac1_000B
"Which actress has had at least four songs written about her?",CELEBRITIES_2135_1742,"Claire Danes",CELEBRITIES_OPT_adfe_000A
"Which of these actresses did not appear in the 2002 film Adaptation?",CELEBRITIES_cb8b_1743,"Kate Winslet",CELEBRITIES_OPT_6878_000B
"Which of these actresses was born in Florence, Italy?",CELEBRITIES_a987_1744,"Rose McGowan",CELEBRITIES_OPT_d0dd_000B
"Elizabeth Taylor campaigned hard for her new husband John Warner who became a senator from Virginia in 1978.",CELEBRITIES_0354_1745,False,CELEBRITIES_OPT_d0ba_000B
"Fireworks were expected when Madonna married this intense, actors actor. The dismal reception to their movie Shanghai Express couldnt have helped the marriage.",CELEBRITIES_de2c_1746,"Sean Penn",CELEBRITIES_OPT_5e6d_000C
"This is Pariss nickname.",CELEBRITIES_5492_1747,Princess,CELEBRITIES_OPT_4672_000A
"In 2001 Paris was engaged to him.",CELEBRITIES_c750_1748,"Jason Shaw",CELEBRITIES_OPT_bf1c_000B
"Her popularity rose significantly after this appeared on the internet in 2003.",CELEBRITIES_c2d4_1749,"An explicit home-made video",CELEBRITIES_OPT_69f3_000D
"This is Paris trademark quote.",CELEBRITIES_ef67_1750,"Thats Hot",CELEBRITIES_OPT_7a9d_000D
"Fashion critic Mr. Blackwell chose her as such.",CELEBRITIES_1969_1751,"The worst-dressed celebrity",CELEBRITIES_OPT_1436_000C
"This is the number of parties Paris Hilton threw for her 21st birthday.",CELEBRITIES_454c_1752,5,CELEBRITIES_OPT_0ded_000A
"This actress is a good friend of Paris Hilton.",CELEBRITIES_e207_1753,"Tara Reid",CELEBRITIES_OPT_eb09_000A
"Paris wears this color contact lenses.",CELEBRITIES_a58d_1754,Blue,CELEBRITIES_OPT_629a_000B
"Paris has these kinds of dogs as pets.",CELEBRITIES_33a8_1755,"Pomeranians and Chihuahuas",CELEBRITIES_OPT_cd8f_000A
"Paris Hilton is related to this star.",CELEBRITIES_d09a_1756,"Zsa Zsa Gabor",CELEBRITIES_OPT_80ab_000C
"The author of these words -- American actor, writer, and stand-up comedian, is known for his ironic, witty, and sometimes confusing jokes and lines. I have a large seashell collection, which I keep scattered on beaches all over the world.",CELEBRITIES_9ab9_1757,"Steven Wright",CELEBRITIES_OPT_826f_000B
"This great comedian, whose career spanned vaudeville, film, radio, and television, was especially popular for the team performances with his wife - the well-known comedienne Gracie Allen. The most important thing to succeed in show business is sincerity. And if you can fake that, youve got it made.",CELEBRITIES_2c7e_1758,"George Burns",CELEBRITIES_OPT_c1f3_000A
"Complete this popular line of comedian Ronnie Shakes: “After twelve years of therapy my psychiatrist said something that brought tears to my eyes. He said, _______. “",CELEBRITIES_3264_1759,"No hablo ingles.",CELEBRITIES_OPT_6cb1_000A
"Which famous American comedian made this ironic statement about marriage? I love being married. I was single for a long time and I just got so sick of finishing my own sentences.",CELEBRITIES_3e75_1760,"Brian Kiley",CELEBRITIES_OPT_067b_000C
"This famous one-liners author starred along Roberto Benigni in 2003s, Coffee and Cigarettes. I was coming back from Canada, driving through Customs, and the guy asked Do you have any firearms with you? I said: What do you need?",CELEBRITIES_8385_1761,"Steven Wright",CELEBRITIES_OPT_58ef_000A
"Although this comedian initially considered becoming a lawyer, he eventually got into comedy. My father heard the story of the Menendez brothers. He quit playing the lottery. He said ‘Screw it, I’ve got twelve kids. Any one of them could snap.",CELEBRITIES_95cf_1762,"Paul Rodriguez",CELEBRITIES_OPT_066a_000D
"Finish this old joke by famous comedian Steven Wright: I went to a restaurant with a sign that said they served breakfast at any time. So I ordered French toast ____",CELEBRITIES_c3c7_1763,"during the Renaissance",CELEBRITIES_OPT_784f_000C
"A grandmother is watching her grandchild playing on the beach when a huge wave comes and takes him out to sea. She pleads, please God, save my only grandson. I beg of you, bring him back. And a big wave comes and washes the boy back onto the beach, good as new. She looks up to heaven and says: He had a hat! The author of this joke was a popular American comedian, storyteller, and nightclub entertainer famous for his imitations of foreign accents.",CELEBRITIES_f140_1764,"Myron Cohen",CELEBRITIES_OPT_da7f_000A
"This English-born American comedian, who was also a violinist, is well known for his “one-liners, which were short and simple but at the same time very effective. Two cars collide. The paramedic asks one of the victims, an elderly Jewish man: Are you comfortable? The man answers: I make a good living.",CELEBRITIES_d096_1765,"Henny Youngman",CELEBRITIES_OPT_7387_000B
"This comedian dropped out of high school to pursue a show business career and became one of the most popular stand-up comedians in the United States, due to the casual, razor-sharp wit of her performances. Here is a line delivered by her. “Adults are always asking little kids what they want to be when they grow up because theyre looking for ideas�?",CELEBRITIES_4593_1766,"Paula Poundstone",CELEBRITIES_OPT_3863_000A
"Morgan Freeman portrayed this character in two films, based on the novels of James Patterson and released in 1997 and in 2001.",CELEBRITIES_1319_1767,"Dr. Alex Cross",CELEBRITIES_OPT_73fe_000D
"For which movie did Morgan Freeman receive an Academy Award for best supporting actor?",CELEBRITIES_dea7_1768,"Million Dollar Baby",CELEBRITIES_OPT_27e9_000A
"Morgan Freeman has starred with Clint Eastwood in more than one movie.",CELEBRITIES_543a_1769,True,CELEBRITIES_OPT_aeb4_000B
"Morgan Freeman is an advocate for Black History Month.",CELEBRITIES_d1ae_1770,False,CELEBRITIES_OPT_311d_000A
"What childrens show was Morgan Freeman on in the 1970s?",CELEBRITIES_ce5c_1771,"The Electric Company",CELEBRITIES_OPT_407d_000B
"Morgan Freeman starred in this 2002 movie based on a Tom Clancy novel.",CELEBRITIES_f697_1772,"The Sum of All Fears",CELEBRITIES_OPT_6304_000A
"Morgan Freeman co-starred with Anthony Hopkins in this 1997 movie based on an actual event in U.S. history.",CELEBRITIES_5df9_1773,Amistad,CELEBRITIES_OPT_7f6f_000D
"Actor Alfredo James Pacino was born in The Bronx, New York on what date?",CELEBRITIES_da27_1774,"April 25,1940",CELEBRITIES_OPT_94ff_000C
"Al Pacino attended which Middle School in The Bronx?",CELEBRITIES_9e76_1775,"Hermann Ridder Junior High School",CELEBRITIES_OPT_a28c_000A
"Which two famous actors were acting teachers of Al Pacino?",CELEBRITIES_aa98_1776,"Charles Laughton and Lee Strassberg",CELEBRITIES_OPT_7d33_000C
"In a Playboy magazine interview, Al Pacino claimed that he was fired from his job as a movie theater usher for what reason?",CELEBRITIES_28e8_1777,"He was caught admiring himself in a mirror",CELEBRITIES_OPT_b79c_000B
"Al Pacino won a Tony Award, a Drama Desk Award and a Theater World Award for his role in which play?",CELEBRITIES_88d3_1778,"Does the Tiger Wear a Necktie?",CELEBRITIES_OPT_3860_000D
"Paramount executives offered the role of Michael Corleone to Al Pacino, after seeing him play the role of a drug addict in which movie?",CELEBRITIES_2ac0_1779,"The Panic in Needle Park",CELEBRITIES_OPT_cfe3_000D
"In 2004, Al Pacino became the 18th performer to win the Triple Crown of Acting, which includes which three acting awards?",CELEBRITIES_f038_1780,"Oscar, Tony and Emmy",CELEBRITIES_OPT_552c_000D
"In 1993, Al Pacino received Academy Award nominations for Best Actor and Best Supporting Actor, for which two movies?",CELEBRITIES_d011_1781,"Scent of a Woman and Glengarry Glen Ross",CELEBRITIES_OPT_bc7e_000A
"In 2001, this award was given to Al Pacino for his outstanding contribution to the entertainment field.",CELEBRITIES_ca85_1782,"The Cecil B. DeMille Award",CELEBRITIES_OPT_f405_000C
"Antonio Banderas, who speaks English, sings in Spanish and plays in a many Latin American movies, was born in which country?",CELEBRITIES_82e3_1783,Spain,CELEBRITIES_OPT_dcde_000C
"World famous actor Antonio Banderas once had another dream concerning his career. What was the job of his dreams, when he was a child?",CELEBRITIES_88c2_1784,"a professional soccer-player",CELEBRITIES_OPT_3b31_000B
"Does actor Antonio Banderas have siblings?",CELEBRITIES_eb9e_1785,"He has a brother",CELEBRITIES_OPT_306e_000C
"Did Antonio Banderas receive a star on the Hollywood Walk of Fame in 2005?",CELEBRITIES_3b65_1786,Yes,CELEBRITIES_OPT_cec1_000B
"What does Antonio Banderas surname actually mean in Spanish?",CELEBRITIES_55ac_1787,flags,CELEBRITIES_OPT_87f1_000B
"Antonio Banderas starred in the movie Women on the Verge of a Nervous Breakdown, directed by Pedro Almodóvar.",CELEBRITIES_199e_1788,True,CELEBRITIES_OPT_59d9_000B
"Which character did Antonio Banderas voice in the 2004 movie Shrek 2?",CELEBRITIES_7a77_1789,"Puss in Boots",CELEBRITIES_OPT_c171_000A
"Antonio Banderas composed a song for the soundtrack of the 2003 movie Once Upon A Time In Mexico.",CELEBRITIES_12cf_1790,True,CELEBRITIES_OPT_83e7_000B
"When was actor Antonio Banderas born?",CELEBRITIES_79d5_1791,"August 10, 1960",CELEBRITIES_OPT_e364_000B
"In the movie Original Sin, Antonio Banderas portrayed Luis Vargas, a character obssessed with a femme fatale, played by which actress?",CELEBRITIES_c316_1792,"Angelina Jolie",CELEBRITIES_OPT_1f16_000A
"This line belongs to a renowned American comedian, known as “King of the One Liners�? because of his short and simple jokes, usually delivered rapid-fire:  My wife and I have the secret to making a marriage last. Two times a week, we go to a nice restaurant, a little wine, good food... She goes Tuesdays, I go Fridays.",CELEBRITIES_f653_1793,"Henny Youngman",CELEBRITIES_OPT_cd96_000C
"This American comedian and actor became best known for the line, I dont get no respect and his monologues on that subject. The following line was delivered by him, too:  When I was born I was so ugly that the doctor didnt know which end to slap!",CELEBRITIES_cf42_1794,"Rodney Dangerfield",CELEBRITIES_OPT_2db0_000C
"The following quote belongs to a comedian and storyteller, famous as a master imitator of the Jews in New York City:  Two women, who have known each other all their lives, meet. The first woman says, I dont know how to tell you this... Im having an affair! The second woman asks, So whos the caterer?",CELEBRITIES_c74a_1795,"Myron Cohen",CELEBRITIES_OPT_eb71_000B
"This American actor, writer, and comedian is famous for his observational humour - a type of comedy where jokes are based on trivial daily life matters.  He delivered the following line:  TV commercials now show you that they can take out bloodstains! I say, if youve got bloodstains on your t-shirt, maybe laundry is not your biggest problem!",CELEBRITIES_c186_1796,"Jerry Seinfeld",CELEBRITIES_OPT_c49e_000C
"The following line belongs to an American stand-up comedian, who made his debut on the Tonight Show with Johnny Carson on April 19th, 1989: I voted for the Democrats because I didnt like the way the Republicans were running the country. Which is turning out to be like shooting yourself in the head to stop your headache.",CELEBRITIES_eb19_1797,"Jack Mayberry",CELEBRITIES_OPT_69c5_000D
"The following words belong to what comedian and writer (The Bernie Mac Show, Moesha):  In elementary school, in case of fire you have to line up quietly in a single file line from smallest to tallest. What is the logic? Do tall people burn slower?",CELEBRITIES_7b2b_1798,"Warren Hutcherson",CELEBRITIES_OPT_89e0_000A
"This American stand-up comedian is an ordained rabbi and is known for his provocative and sometimes abusive language. He delivered the following words:  My grandfather always said, Dont watch your money; watch your health. So one day while I was watching my health, someone stole my money. It was my grandfather.",CELEBRITIES_a989_1799,"Jackie Mason",CELEBRITIES_OPT_f98b_000D
"This American comedian and writer became especially popular after her appearances on The Tonight Show with Johnny Carson. This is one of her jokes:  Waiters and waitresses are becoming nicer and much more caring. I used to pay my check, they would say Thank you. That’s now escalated into You take care of yourself, now. The other day I paid my check and the waiter said, Don’t put off that mammogram.",CELEBRITIES_b49c_1800,"Rita Rudner",CELEBRITIES_OPT_b8a7_000B
"The author of the following line is a Jewish American stand-up comedian and actor, noted for his grating voice and tendency to shout a lot during performances. Last night I was having dinner with Charles Manson, and in the middle of dinner he turned to me and said Is it hot in here, or am I crazy?",CELEBRITIES_4d7e_1801,"Gilbert Gottfried",CELEBRITIES_OPT_cd6b_000B
"This American stand-up comedian, actor, and writer has an innocent appearance that is in contrast with her comic material, in which she deals with many controversial topics such as racism, abortion, rape and child abuse. The following line was delivered by her:  “My sister was with two men one night. She could hardly walk after that. Can you imagine? Two dinners!�?",CELEBRITIES_99d6_1802,"Sarah Silverman",CELEBRITIES_OPT_5c8b_000C
"Which of these great guitarists did not play for The Yardbirds, the band that became Led Zeppelin?",CELEBRITIES_8c8a_1803,"Brian May",CELEBRITIES_OPT_c3e4_000C
"The movie Almost Famous was loosely based on Cameron Crowes adventures as a teenage journalist touring with Led Zeppelin.",CELEBRITIES_8071_1804,True,CELEBRITIES_OPT_7ede_000A
"The final Led Zep album that featured previously unreleased studio music was titled Coda.  What does Coda mean?",CELEBRITIES_c73d_1805,"The end of a song",CELEBRITIES_OPT_0de4_000A
"Led Zeppelins final concert took place in 1980, in what country?",CELEBRITIES_34c5_1806,England,CELEBRITIES_OPT_9405_000C
"Who came up with the name Led Zeppelin?",CELEBRITIES_26b1_1807,"Keith Moon",CELEBRITIES_OPT_286a_000A
"For years this was the theme song to the British music TV show, Tops of the Pops.",CELEBRITIES_b6e8_1808,"Whole Lotta Love",CELEBRITIES_OPT_9971_000A
"Who managed rock band Led Zeppelin?",CELEBRITIES_22d4_1809,"Peter Grant",CELEBRITIES_OPT_ed9c_000B
"Who produced all of Led Zeppelins albums?",CELEBRITIES_56da_1810,"Jimmy Page",CELEBRITIES_OPT_f4dc_000D
"Which artist was not ever a member of Led Zeppelin?",CELEBRITIES_9c89_1811,"Roger Daltry",CELEBRITIES_OPT_474e_000A
"What the real name of John Paul Jones of Led Zeppelin?",CELEBRITIES_93fe_1812,"John Baldwin",CELEBRITIES_OPT_78ca_000C
"Where was Richard Dreyfus born?",CELEBRITIES_f153_1813,Brooklyn,CELEBRITIES_OPT_b252_000C
"In 1986 Richard Dreyfuss appeared in Down and Out in Beverly Hills. Who played his wife in the movie?",CELEBRITIES_c34a_1814,"Bette Midler",CELEBRITIES_OPT_2ecc_000D
"Who played Jerry Baskin in the movie Down and Out in Beverly Hills?",CELEBRITIES_4711_1815,"Nick Nolte",CELEBRITIES_OPT_20cf_000A
