question,QID,answer,answer_OID
"Gary Cooper is referenced in an Irving Berlin song.",CELEBRITIES_1871_0834,True,CELEBRITIES_OPT_6a43_000B
"Gary Cooper starred in A Farewell to Arms and For Whom the Bell Tolls. What do these movies have  in common?",CELEBRITIES_4a9b_0835,"They are based on novels by Ernest  Hemingway.",CELEBRITIES_OPT_742b_000A
"1939 has often been described as a banner year for movies. Which of these 1939 movies starred Gary Cooper?",CELEBRITIES_db91_0836,"Beau Geste",CELEBRITIES_OPT_2865_000B
"Although John Wayne and Gary Cooper were good friends, John Wayne hated this Gary Cooper role.",CELEBRITIES_2883_0837,"Will Kane in High Noon",CELEBRITIES_OPT_bd2d_000B
"Gary Cooper is famous for his portrayal of this athlete.",CELEBRITIES_3249_0838,"Lou Gehrig",CELEBRITIES_OPT_6f44_000A
"Gary Cooper appeared at the House Un-American Activities Committee in the 1950s. Which best describes his testimony?",CELEBRITIES_8b7a_0839,"He said he feared Communism but did not mention any names.",CELEBRITIES_OPT_7679_000B
"Gary Cooper was a man of many hobbies. Which of these was one of them?",CELEBRITIES_b836_0840,taxidermy,CELEBRITIES_OPT_6ec7_000A
"Before becoming a star, Gary Cooper was a guide in this US Park.",CELEBRITIES_4916_0841,Yosemite,CELEBRITIES_OPT_9bd8_000C
"Find the incorrect statement concerning Gary Cooper.",CELEBRITIES_afdb_0842,"John Wayne learned to ride a horse from Gary Cooper.",CELEBRITIES_OPT_806a_000C
"By some quirk of  fate, Gary Cooper was distantly related to this actress.",CELEBRITIES_d5ac_0843,"Brooke Shields",CELEBRITIES_OPT_93ae_000A
"Five individuals were the regular hosts of this radio theatre program, that ran from 1979-1981. Richard Widmark was the Friday night adventure host.",CELEBRITIES_308f_0844,"Sears Radio Theatre",CELEBRITIES_OPT_dfd3_000D
"Actor Richard Widmark nearly lost an important part because his ears were too big.",CELEBRITIES_83de_0845,False,CELEBRITIES_OPT_29ac_000A
"Richard Widmarks daughter was married to this baseball great.",CELEBRITIES_c696_0846,"Sandy Koufax",CELEBRITIES_OPT_3771_000B
"When Richard Widmark married his second wife, he became the step-father to Amy. Amy was the daughter of Susan Blanchard and this actor legend.",CELEBRITIES_3cc2_0847,"Henry Fonda",CELEBRITIES_OPT_ab07_000B
"Why was Richard Widmark unable to serve in the military during WWII?",CELEBRITIES_d441_0848,"perforated eardrum",CELEBRITIES_OPT_9ce3_000B
"Richard Widmark starred in this movie in the 70s, that was an adaptation of a book by Agatha Christie.",CELEBRITIES_24b2_0849,"Murder on The Orient Express",CELEBRITIES_OPT_abe3_000D
"Richard Widmark appeared on I Love Lucy as himself, in an episode in which Lucy pretends to be infatuated with Widmark.",CELEBRITIES_7245_0850,True,CELEBRITIES_OPT_6f3e_000A
"In what eastern state was actor Ron Perlman born?",CELEBRITIES_5d4f_0851,"New York",CELEBRITIES_OPT_4ffa_000D
"Ron Perlman has done s a lot of voice over work in cartoons and games. Which of the following is not one of his projects?",CELEBRITIES_2d5d_0852,Superman,CELEBRITIES_OPT_54cf_000D
"In 2008, Ron Perlman became the oldest actor to play a main superhero.",CELEBRITIES_f7a6_0853,True,CELEBRITIES_OPT_0388_000B
"Ron Perlman played Bernie Marx back in the 70s on this daytime soap opera.",CELEBRITIES_e582_0854,"Ryans Hope",CELEBRITIES_OPT_b4c4_000D
"What movie starring Ron Perlman is this exchange from? X: [while stitching up  forearm] How long did he touch you? Y: I dont know? About 5 seconds? X: [pulls three eggs out of his forearm] Touched you five seconds, laid three eggs. Y: Didnt even buy me a drink.",CELEBRITIES_b63b_0855,Hellboy,CELEBRITIES_OPT_b8e3_000A
"Revolutions studio wanted someone like Vin Diesel to play the part of Hellboy, but it was eventually given to Ron Perlman.",CELEBRITIES_641e_0856,True,CELEBRITIES_OPT_c910_000B
"Ron Perlman did not win an Emmy for the TV series Beauty and the Beast.",CELEBRITIES_de42_0857,True,CELEBRITIES_OPT_9fe4_000A
"In which of these films did Ron Perlman co-star with Wesley Snipes?",CELEBRITIES_6af2_0858,"Blade II",CELEBRITIES_OPT_ac35_000A
"Microsoft co-founder William Henry Gates III, a.k.a. Bill Gates, was born on October 28, 1955 in this US state.",CELEBRITIES_a684_0859,Washington,CELEBRITIES_OPT_c1b5_000C
"TV host and actress Oprah Winfrey was born on January 29, 1954 in this US state.",CELEBRITIES_90ee_0860,Mississippi,CELEBRITIES_OPT_26c0_000C
"In what country was Academy Award winner Robert De Niro born on August 17, 1943?",CELEBRITIES_2fd4_0861,"the United States",CELEBRITIES_OPT_bb54_000B
"Writer Agatha Christie, who became the best-selling author of all time, was born in this country on September 15, 1890.",CELEBRITIES_b14b_0862,England,CELEBRITIES_OPT_9077_000C
"Soccer star David Beckham was born on May 2, 1975 in what English city?",CELEBRITIES_9583_0863,London,CELEBRITIES_OPT_f56c_000B
"Singer and songwriter Celine Dion was born on March 30, 1968 in this country.",CELEBRITIES_3bd8_0864,Canada,CELEBRITIES_OPT_4b15_000D
"The 44th President of the United States Barack Obama was born on August 4, 1961 in this US state.",CELEBRITIES_0adb_0865,Hawaii,CELEBRITIES_OPT_a433_000B
"Legendary actress Greta Garbo was born on September 18, 1905 in this European country.",CELEBRITIES_4a64_0866,Sweden,CELEBRITIES_OPT_5f62_000A
"In what US state was music legend Ray Charles born on September 23, 1930?",CELEBRITIES_f3f7_0867,Georgia,CELEBRITIES_OPT_bd13_000C
"Hollywood actor Omar Sharif was born on April 10, 1932 in this African country.",CELEBRITIES_6090_0868,Egypt,CELEBRITIES_OPT_1310_000A
"This Baldwin met his future wife on the set of The Marrying Man in 1991.",CELEBRITIES_82f2_0869,Alec,CELEBRITIES_OPT_89b4_000A
"Which Baldwin was born May 12, 1966, making him the youngest of the brothers?",CELEBRITIES_115a_0870,Stephen,CELEBRITIES_OPT_0bcf_000D
"In 1993 this Baldwin was cast in the Baltimore-based cop show Homicide: Life on the Street.",CELEBRITIES_0748_0871,Daniel,CELEBRITIES_OPT_6ea6_000D
"This Baldwin appeared in the 1990 movie Flatliners, as Joe Hurley.",CELEBRITIES_be25_0872,William,CELEBRITIES_OPT_c32b_000D
"Alec Baldwin starred in the 1995 movie The Usual Suspects.",CELEBRITIES_5b71_0873,False,CELEBRITIES_OPT_6879_000A
"Three of the four Baldwin brothers appeared in the 1989 movie Born On The Fourth of July.",CELEBRITIES_c1bd_0874,True,CELEBRITIES_OPT_cb76_000B
"Which Baldwin starred in the 1996 movie Mulholland Falls with Nick Nolte?",CELEBRITIES_45a2_0875,Daniel,CELEBRITIES_OPT_e1f1_000B
"There are no sisters to the Baldwin brothers.",CELEBRITIES_fd7d_0876,False,CELEBRITIES_OPT_97d4_000A
"In 1960s The Alamo, John Wayne played this famous frontiersman.",CELEBRITIES_00e8_0877,"Colonel Davy Crockett",CELEBRITIES_OPT_5dfe_000C
"Julia Roberts was the first actress to appear on the cover of this popular magazine.",CELEBRITIES_738d_0878,Vogue,CELEBRITIES_OPT_2c16_000D
"What was the occupation of Julia Roberts parents when they first met?",CELEBRITIES_21cf_0879,"Actors and playwrights",CELEBRITIES_OPT_21af_000A
"What musical instrument did Julia Roberts learn to play when she was a student?",CELEBRITIES_e83f_0880,Clarinet,CELEBRITIES_OPT_efa7_000C
"What was Julia Roberts dream job when she was a little girl?",CELEBRITIES_79be_0881,Veterinarian,CELEBRITIES_OPT_08d5_000D
"In what movie, released in 1989, did Julia Roberts make her acting debut?",CELEBRITIES_59a6_0882,"Blood Red",CELEBRITIES_OPT_3cee_000C
"What disease did Julia Roberts character have in the 1989 dramedy movie Steel Magnolias?",CELEBRITIES_70d6_0883,Diabetes,CELEBRITIES_OPT_c2a3_000A
"What name did Julia Roberts give to her first-born daughter who was born on November 28, 2004, together with her fraternal twin brother?",CELEBRITIES_e90c_0884,Hazel,CELEBRITIES_OPT_bf98_000B
"What famous actor did Julia Roberts date before she married cameraman Daniel Moder?",CELEBRITIES_196f_0885,"All of these",CELEBRITIES_OPT_8a77_000C
"What type of character did Julia Roberts voice in the 2006 computer-animated movie The Ant Bully?",CELEBRITIES_dd25_0886,"A nurse ant",CELEBRITIES_OPT_9d1e_000C
"What was the name of Julia Roberts character in the 1991 Steven Spielberg movie Hook?",CELEBRITIES_a747_0887,"Tinker Bell",CELEBRITIES_OPT_8be2_000C
"What is Christopher Walkens real first name?",CELEBRITIES_a892_0888,Ronald,CELEBRITIES_OPT_df21_000B
"What did Christopher Walken eat for an entire week in order to prepare for his role in the 1978 movie The Deer Hunter?",CELEBRITIES_f10b_0889,"Rice and bananas",CELEBRITIES_OPT_cdc8_000A
"In what Madonna video has actor Christopher Walken made an appearance?",CELEBRITIES_1628_0890,"Bad Girl",CELEBRITIES_OPT_91b8_000B
"What is the name of actor Christopher Walkens first-born child?",CELEBRITIES_691b_0891,"None of these",CELEBRITIES_OPT_83d8_000C
"Complete the following popular phrase that originated from Chris Walkens performance in an episode of Saturday Night Live: Gotta have more ...",CELEBRITIES_a0fd_0892,Cowbell,CELEBRITIES_OPT_5df6_000A
"What character did actor Christopher Walken portray in the 1992 movie Batman Returns?",CELEBRITIES_31dc_0893,"Max Shreck",CELEBRITIES_OPT_564e_000B
"What animated character did Christopher Walken voice in the 1998 animated movie Antz?",CELEBRITIES_acdd_0894,"Colonel Cutter",CELEBRITIES_OPT_c016_000A
"In what Denzel Washington movie did Christopher Walken appear as Denzels ex-colleague from CIA?",CELEBRITIES_0819_0895,"Man on Fire",CELEBRITIES_OPT_22a5_000A
"In what movie did Christopher Walken play the role of a World War II veteran and father of Frank Abagnale, Jr.?",CELEBRITIES_fbc9_0896,"Catch Me If You Can",CELEBRITIES_OPT_e9ed_000A
"What legendary musician was the main character in the 1995 play Him, written by Christopher Walken?",CELEBRITIES_8e8e_0897,"Elvis Presley",CELEBRITIES_OPT_ae5e_000D
"Which state was American actress and singer Hilary Duff born in?",CELEBRITIES_6f00_0898,Texas,CELEBRITIES_OPT_f596_000D
"Which of these is a name of one of Hilary Duffs albums?",CELEBRITIES_dc10_0899,"Most Wanted",CELEBRITIES_OPT_7ae1_000A
"In which of these movies does Hilary co-star with her sister, Haylie Duff?",CELEBRITIES_7b7e_0900,"Material Girls",CELEBRITIES_OPT_5e4c_000B
"When was Hilary Duff born?",CELEBRITIES_c507_0901,"September 28th, 1987",CELEBRITIES_OPT_1119_000D
"Alternative rock band, Weezer has had the same members throughout their career.",CELEBRITIES_89ea_0902,False,CELEBRITIES_OPT_0dec_000A
"Where is the name of alternative rock band, Weezer derived from?",CELEBRITIES_087e_0903,"Rivers Cuomos childhood nickname",CELEBRITIES_OPT_0c11_000A
"Rivers Cuomo of the band, Weezer, has converted to Buddhism.",CELEBRITIES_c1fe_0904,False,CELEBRITIES_OPT_97d6_000A
"Directed by Spike Jonze, this was the first video of alternative rock band, Weezer.",CELEBRITIES_34ce_0905,"Undone (The Sweater Song)",CELEBRITIES_OPT_8ece_000C
"Finish the lyric by American alternative rock band, Weezer: If You Want it You can Have it All You have to do is",CELEBRITIES_5cc3_0906,"reach out there and grab it",CELEBRITIES_OPT_6734_000A
"What was the first video of the band, Weezer, that Scott Shriner was featured in?",CELEBRITIES_63b5_0907,Photograph,CELEBRITIES_OPT_9e40_000B
"Who directed the video for Weezers Say It Aint So?",CELEBRITIES_e263_0908,"Sophie Muller",CELEBRITIES_OPT_8bb6_000B
"How many animals and insects are referenced on Weezers second album, Pinkerton?",CELEBRITIES_db23_0909,11,CELEBRITIES_OPT_30bd_000C
"Michael Jackson was born in this US state on August 29, 1958.",CELEBRITIES_3ff3_0910,Indiana,CELEBRITIES_OPT_94b0_000D
"John F. Kennedy, 35th President of the United States, was born in this US state on May 29, 1917.",CELEBRITIES_1570_0911,Massachusetts,CELEBRITIES_OPT_4f78_000D
"In what US city was Academy Award winner Jane Fonda born on December 21, 1937?",CELEBRITIES_7c1d_0912,"New York City",CELEBRITIES_OPT_d740_000B
"Composer Ludwig van Beethoven was born around 16 December 1770 in this German city.",CELEBRITIES_7ce4_0913,Bonn,CELEBRITIES_OPT_cc83_000B
"In what Latin American country was revolutionary Che Guevara born on June 14, 1928?",CELEBRITIES_84a2_0914,Argentina,CELEBRITIES_OPT_98c1_000C
"Film legend Charlie Chaplin was born on April 16, 1889 in this country of the United Kingdom.",CELEBRITIES_4bbd_0915,England,CELEBRITIES_OPT_c570_000D
"In what US state was The King of Rock n Roll Elvis Presley born on January 8, 1935?",CELEBRITIES_2741_0916,Mississippi,CELEBRITIES_OPT_b389_000D
"In what country was Academy Award-winning actor Anthony Hopkins born on December 31, 1937?",CELEBRITIES_f329_0917,Wales,CELEBRITIES_OPT_2dd0_000C
"In what European country was Oscar-winning actress Audrey Hepburn born on May 4, 1929?",CELEBRITIES_6cb2_0918,Belgium,CELEBRITIES_OPT_99f7_000C
"Academy Award winner Tom Hanks was born on July 9, 1956 in this US state.",CELEBRITIES_1fc7_0919,California,CELEBRITIES_OPT_65c1_000B
"Which statement is true about Will Lee?",CELEBRITIES_d7df_0920,"He was born in Brooklyn, New York in 1908.",CELEBRITIES_OPT_5e3f_000D
"Of course, Will Lees most famous role was that of Mr. Hooper on Sesame Street. What was Mr. Hoopers first name?",CELEBRITIES_5e6a_0921,Harold,CELEBRITIES_OPT_fc21_000B
"Which member of Sesame Street had a lot of trouble saying Mr. Hooper?",CELEBRITIES_9c24_0922,"Big Bird",CELEBRITIES_OPT_2e8f_000B
"Who ran the store on the childrens show Sesame Street immediately after Mr. Hoopers death?",CELEBRITIES_35b8_0923,"David and Gina",CELEBRITIES_OPT_a920_000A
"In episode 335 of Sesame Street, Alan went on vacation. Who ran the store while he was away?",CELEBRITIES_ae81_0924,Natalie,CELEBRITIES_OPT_a84d_000A
"Will Lee began his acting career doing Broadway musicals.",CELEBRITIES_26f9_0925,False,CELEBRITIES_OPT_655b_000B
"Just like many fine American actors, Will Lee was blacklisted from 1951-1956. Who was responsible for the blacklistings?",CELEBRITIES_5256_0926,"Senator Joseph McCarthy",CELEBRITIES_OPT_cba5_000B
"In 1953 Will Lee appeared in this great American movie.",CELEBRITIES_2683_0927,"Little Fugitive",CELEBRITIES_OPT_67e5_000B
"In the 1930s, Will Lee was a member of this famous theater group.",CELEBRITIES_cdc6_0928,"The Group Theater",CELEBRITIES_OPT_f6af_000B
"In 1980, Will Lee played Shmuel in this movie.",CELEBRITIES_0262_0929,"Playing for Time",CELEBRITIES_OPT_c1fc_000A
"In what US state was the 43rd President of the United States George W. Bush born on July 6, 1946?",CELEBRITIES_6c94_0930,Connecticut,CELEBRITIES_OPT_3699_000C
"In what country was Academy Award winner Katharine Hepburn born on May 12, 1907?",CELEBRITIES_d0ba_0931,"United States",CELEBRITIES_OPT_6ae9_000B
"Author and poet Oscar Wilde was born in this European country on October 16, 1854.",CELEBRITIES_d2b1_0932,Ireland,CELEBRITIES_OPT_117d_000B
"Albert Einstein was born on March 14, 1879 on the territory of what present day country?",CELEBRITIES_598f_0933,Germany,CELEBRITIES_OPT_ae3e_000C
"In what US state was Academy Award winner Meryl Streep born on June 22, 1949?",CELEBRITIES_0822_0934,"New Jersey",CELEBRITIES_OPT_0506_000A
"Madonna Louise Ciccone, known as simply Madonna, was born on August 16, 1958 in this country.",CELEBRITIES_31d0_0935,"the United States",CELEBRITIES_OPT_92e7_000B
"In what US state was movie director and producer Steven Spielberg born on December 18, 1946?",CELEBRITIES_1c4e_0936,Ohio,CELEBRITIES_OPT_0458_000D
"In what country was composer Johann Sebastian Bach born on March 31, 1685?",CELEBRITIES_2325_0937,Germany,CELEBRITIES_OPT_0938_000B
"African-American civil rights movement leader Martin Luther King, Jr. was born in this US state on January 15, 1929.",CELEBRITIES_38ff_0938,Georgia,CELEBRITIES_OPT_7180_000C
"Academy Award winner Dustin Hoffman was born on August 8, 1937 in this US city.",CELEBRITIES_4c54_0939,"Los Angeles",CELEBRITIES_OPT_0e95_000D
"What did supermodel Naomi Campbell study in the Italia Conti Academy where she was accepted at the age of 10?",CELEBRITIES_8b72_0940,Ballet,CELEBRITIES_OPT_da69_000D
"What popular fashion brand did supermodel Christy Turlington represent from 1987 to 2007?",CELEBRITIES_595a_0941,"Calvin Klein",CELEBRITIES_OPT_de1e_000B
"In what popular Macaulay Culkin movie has supermodel Claudia Schiffer made an appearance?",CELEBRITIES_2321_0942,"Richie Rich",CELEBRITIES_OPT_4826_000C
"Supermodel Cindy Crawford won an academic scholarship to major in this field at Northwestern University.",CELEBRITIES_0517_0943,"Chemical engineering",CELEBRITIES_OPT_9f8b_000A
"What is the name of supermodel Kate Moss daughter born on 29 September 2002?",CELEBRITIES_6e47_0944,Lila,CELEBRITIES_OPT_0f0f_000D
"What fashion designer called supermodel Linda Evangelista top of the tops and stated, There is not another model in the world as professional as she is?",CELEBRITIES_e32b_0945,"Karl Lagerfeld",CELEBRITIES_OPT_adf2_000C
"In what popular TV sitcom did supermodel Elle Macpherson make a guest appearance in 1999?",CELEBRITIES_ce9a_0946,Friends,CELEBRITIES_OPT_e5a9_000A
"What actress did supermodel Tyra Banks co-star with in the 2000 Disney film Life-Size?",CELEBRITIES_a8c1_0947,"Lindsay Lohan",CELEBRITIES_OPT_9c1e_000C
"What member of Bon Jovi did model Eva Herzigova marry in September 1996?",CELEBRITIES_5298_0948,"Tico Torres",CELEBRITIES_OPT_39b3_000C
"Model Helena Christensen admitted she was addicted to this food and was even considering getting a shoulder tattoo of it.",CELEBRITIES_3a96_0949,Cheese,CELEBRITIES_OPT_fd0c_000D
"What popular person once said, The history of dance on film begins with Astaire?",CELEBRITIES_1914_0950,"Gene Kelly",CELEBRITIES_OPT_e1cf_000C
"What musical instrument did Fred Astaire learn to play when he was a child?",CELEBRITIES_ab3c_0951,"All of these",CELEBRITIES_OPT_db42_000A
"Where did Fred Astaire and his sister Adele suposedly take their stage name Astaire from?",CELEBRITIES_aaa1_0952,"From their uncles name",CELEBRITIES_OPT_0ae1_000A
"What did Fred Astaires screen test report for RKO Pictures read according to him?",CELEBRITIES_a55e_0953,"Cant act.",CELEBRITIES_OPT_e046_000A
"What is the name of Fred Astaires first-born child, born in 1936?",CELEBRITIES_10c3_0954,"Fred, Jr.",CELEBRITIES_OPT_2a8a_000D
"How did Fred Astaire break his wrist when he was seventy-eight?",CELEBRITIES_e13c_0955,"He fell from his grandsons skateboard.",CELEBRITIES_OPT_aabb_000C
"What peculiar clause does Fred Astaires will contain?",CELEBRITIES_38c0_0956,"He should never be portrayed in films.",CELEBRITIES_OPT_e7d7_000B
"What animal costume did young Fred Astaire wear at his first ever stage performance?",CELEBRITIES_0835_0957,"Lobster costume",CELEBRITIES_OPT_3f19_000C
"What award did Fred Astaire receive from his long-time professional partner Ginger Rogers in 1950?",CELEBRITIES_282d_0958,"Academy Award",CELEBRITIES_OPT_33b6_000D
"What legendary actress starred alongside Fred Astaire in the 1957 musical movie Funny Face?",CELEBRITIES_e246_0959,"Audrey Hepburn",CELEBRITIES_OPT_bf5b_000A
"What is Kirk Douglas birth name?",CELEBRITIES_079e_0960,"Issur Danielovitch",CELEBRITIES_OPT_698d_000D
"What job did Kirk Douglas have before he turned to acting?",CELEBRITIES_ec9d_0961,"Newspaper boy",CELEBRITIES_OPT_1c96_000C
"In which war did Kirk Douglas participate after he joined the U.S. Navy?",CELEBRITIES_98d9_0962,"World War II",CELEBRITIES_OPT_e40c_000A
"How many children did Kirk Douglas father?",CELEBRITIES_facd_0963,Four,CELEBRITIES_OPT_9fcd_000A
"What famous painter did Kirk Douglas portray in the 1956 movie Lust for Life?",CELEBRITIES_cd18_0964,"Vincent Van Gogh",CELEBRITIES_OPT_1586_000B
"What expression did Kirk Douglas use to describe the majority of characters he has played in movies?",CELEBRITIES_417f_0965,"Sons of bitches",CELEBRITIES_OPT_10c6_000D
"In what movie did Kirk Douglas portray manipulative film producer Jonathan Shields?",CELEBRITIES_e4bf_0966,"The Bad and the Beautiful",CELEBRITIES_OPT_6078_000A
"Which popular Jules Verne character did Kirk Douglas portray in the 1954 movie 20,000 Leagues Under the Sea?",CELEBRITIES_bca3_0967,"Ned Land",CELEBRITIES_OPT_84bd_000C
"What accident did Kirk Douglas survive in 1991?",CELEBRITIES_f308_0968,"Helicopter crash",CELEBRITIES_OPT_03e0_000D
"What character did Kirk Douglas portray in the 1949 movie Champion that brought him his first Oscar nomination?",CELEBRITIES_7af2_0969,Boxer,CELEBRITIES_OPT_849d_000C
"Actor and director George Clooney was born on May 6, 1961 in this US state.",CELEBRITIES_bf49_0970,Kentucky,CELEBRITIES_OPT_f356_000C
"What medical condition did George Clooney develop when he was a student?",CELEBRITIES_56d5_0971,"Bells palsy",CELEBRITIES_OPT_d8fc_000D
"George Clooney tried to play this sport professionally when he was younger.",CELEBRITIES_1f60_0972,Baseball,CELEBRITIES_OPT_000f_000C
"Actor and director George Clooney planned to start a career in this field when he was a student.",CELEBRITIES_d778_0973,Law,CELEBRITIES_OPT_9173_000B
"What job did George Clooney have before he started his film career?",CELEBRITIES_d976_0974,"Underwear salesman",CELEBRITIES_OPT_8385_000C
"What was the name of George Clooneys character on NBCs medical drama ER?",CELEBRITIES_0dfe_0975,"Dr. Douglas Ross",CELEBRITIES_OPT_7563_000D
"What was the movie for which George Clooney received his first Academy Award?",CELEBRITIES_d39b_0976,Syriana,CELEBRITIES_OPT_e1ea_000D
"In what kind of accident was George Clooney injured on September 21, 2007?",CELEBRITIES_8e01_0977,"Motorcycle crash",CELEBRITIES_OPT_764a_000D
"George Clooney had this large animal as a pet between 1987 and 2006.",CELEBRITIES_c8e2_0978,Pig,CELEBRITIES_OPT_48b8_000B
"Which of these movies was directed by George Clooney?",CELEBRITIES_f964_0979,"Confessions of a Dangerous Mind",CELEBRITIES_OPT_38dc_000B
"What magazine rated actor Patrick Swayze The Sexiest Man Alive in 1991?",CELEBRITIES_adf9_0980,People,CELEBRITIES_OPT_cff3_000D
"What member of Patrick Swayzes family was a dancer, choreographer and dance instructor?",CELEBRITIES_6e4c_0981,"His mother",CELEBRITIES_OPT_3694_000B
"What does Jennifer Greys character, Baby, bring to the party in the 1987 movie Dirty Dancing, also starring Patrick Swayze?",CELEBRITIES_3e66_0982,"A watermelon",CELEBRITIES_OPT_e843_000D
"In what 1979 movie did Patrick Swayze make his debut appearance?",CELEBRITIES_9c8b_0983,"Skatetown, U.S.A.",CELEBRITIES_OPT_966b_000D
"For his performance in what movie did Patrick Swayze receive his first Golden Globe Award nomination for Best Actor?",CELEBRITIES_76b0_0984,"Dirty Dancing",CELEBRITIES_OPT_171d_000A
"What is the meaning of the slang phrase Im Swayze, popular in hip-hop culture and referring to Patrick Swayzes role in Ghost?",CELEBRITIES_afee_0985,"Im leaving",CELEBRITIES_OPT_d268_000A
"What animals did actor Patrick Swayze breed in his ranches in California and New Mexico?",CELEBRITIES_1998_0986,"Arabian horses",CELEBRITIES_OPT_7384_000B
"What is the name of the actress whom Patrick Swayze married in June 12, 1975?",CELEBRITIES_1ed6_0987,"Lisa Niemi",CELEBRITIES_OPT_ffbd_000D
"For what 1991 movie was actor Patrick Swayze nominated for the MTV Movie Award for Most Desirable Male?",CELEBRITIES_e961_0988,"Point Break",CELEBRITIES_OPT_012c_000C
"What was the last movie that actor Patrick Swayze appeared in before his death?",CELEBRITIES_4422_0989,"Powder Blue",CELEBRITIES_OPT_6002_000C
"Where was Milla Jovovich born?",CELEBRITIES_92b1_0990,"Kiev, USSR",CELEBRITIES_OPT_bf38_000B
"What year was Milla Jovovich born?",CELEBRITIES_e105_0991,1975,CELEBRITIES_OPT_8dac_000A
"In 1994 Milla Jovovich released a musical album.",CELEBRITIES_848f_0992,True,CELEBRITIES_OPT_b779_000B
"What is the name of Milla Jovovichs mother?",CELEBRITIES_d85f_0993,"Galina Jovovich",CELEBRITIES_OPT_05fe_000B
"In which movie did Milla Jovovich make her film debut?",CELEBRITIES_509b_0994,"Two Moon Junction",CELEBRITIES_OPT_b30a_000A
"Milla Jovovich has been on the cover of more than one hundred magazines worldwide.",CELEBRITIES_d44c_0995,True,CELEBRITIES_OPT_d744_000A
"Milla Jovovich went to high school with which of the following?",CELEBRITIES_4ff0_0996,"Christina Applegate",CELEBRITIES_OPT_3740_000C
"In 2003 Milla Jovovich got engaged to this director.",CELEBRITIES_7b7a_0997,"Paul W.S. Anderson",CELEBRITIES_OPT_c4ee_000C
"When did Louis Prima live?",CELEBRITIES_2e5b_0998,"1910- 1978",CELEBRITIES_OPT_8f9c_000B
"Which was  Louis Primas  first instrument ?",CELEBRITIES_3a82_0999,violin,CELEBRITIES_OPT_d3c0_000B
"What was Louis Primas nickname?",CELEBRITIES_6d25_1000,"The King of Swingers",CELEBRITIES_OPT_3a72_000D
"With which singer was Louis Prima  most closely  aligned ?",CELEBRITIES_879e_1001,"Keely Smith",CELEBRITIES_OPT_1f13_000D
"The band usually backed up Louis Prima for most of his career.",CELEBRITIES_7c1e_1002,"Sam Butera and the Witnesses",CELEBRITIES_OPT_0306_000A
"Both David Lee Roth and  Brian Setzer had hits with remakes of this song popularized by Louis Prima.",CELEBRITIES_f2fe_1003,"Just A Gigolo",CELEBRITIES_OPT_6e07_000A
"Which of these was not a Louis Prima  song ?",CELEBRITIES_5c45_1004,"Day In, Day Out",CELEBRITIES_OPT_5b61_000C
"Ella Fitzgerald, Etta James, Jo Stafford, The Harptones, and Christina Aquilera all had  big hits with this Louis Prima  written song.",CELEBRITIES_1a76_1005,"A Sunday Kind of Love",CELEBRITIES_OPT_b664_000B
"Louis Prima was one of the top performers in Las Vegas for many years. How was his show publicized?",CELEBRITIES_cbc3_1006,"The Wildest Show in Vegas",CELEBRITIES_OPT_63e2_000C
"Disney  used Louis Primas voice  for a character in this  movie.",CELEBRITIES_f477_1007,"The Jungle Book",CELEBRITIES_OPT_90e2_000B
"Which was not a Louis Prima number ?",CELEBRITIES_c3a1_1008,"The Mouse That Roared",CELEBRITIES_OPT_fb86_000B
"Justin Timberlakes What Goes Around.....Comes Around! video featured which of the following actresses?",CELEBRITIES_e2ca_1009,"Scarlett Johansson",CELEBRITIES_OPT_4ad1_000C
"What is the name of the record label that Justin Timberlake started in 2007?",CELEBRITIES_9204_1010,"Tennman Records",CELEBRITIES_OPT_3277_000A
