question,QID,answer,answer_OID
"He is one of the best quarterbacks in the history of the Pittsburgh Steelers. He has also been a fairly successful actor and sports analyst.",PEOPLE_1052_1902,"Terry Bradshaw",PEOPLE_OPT_e4db_000C
"Who was the only American-born member of Monty Python?",PEOPLE_eb50_1903,"Terry Gilliam",PEOPLE_OPT_faf6_000B
"Who was manager of the Boston Red Sox when they won their first World Series in over 90 years?",PEOPLE_cc50_1904,"Terry Francona",PEOPLE_OPT_732d_000C
"In his 31-year career, this driver, nicknamed The Iceman, has won over 20 major NASCAR races.",PEOPLE_6bf2_1905,"Terry Labonte",PEOPLE_OPT_954f_000D
"When this Terry was only 6, she appeared in a widely popular movie.",PEOPLE_6926_1906,"The dog who played Toto",PEOPLE_OPT_c8bd_000A
"In 1954 this first baseman was elected to the Baseball Hall of Fame.",PEOPLE_1502_1907,"Bill Terry",PEOPLE_OPT_c455_000B
"TERI is a private, non-profit agency that deals with this subject.",PEOPLE_0fcc_1908,"The improvement of the lives of people with autism",PEOPLE_OPT_590e_000C
"In which sport was Terry Sawchuck famous?",PEOPLE_5358_1909,Hockey,PEOPLE_OPT_dd9c_000C
"Who was the winner in Season 2 of Americas Got Talent?",PEOPLE_580a_1910,"Terry Fator",PEOPLE_OPT_1828_000D
"Which of the following US Presidents was related to 11 former presidents, either by blood or marriage?",PEOPLE_0945_1911,"Franklin D. Roosevelt",PEOPLE_OPT_86d8_000D
"Which US President had 15 children, 8 by his first wife and 7 by his second wife?",PEOPLE_746c_1912,"John Tyler",PEOPLE_OPT_c655_000C
"Which US President loved to cook and developed a recipe for vegetable soup?",PEOPLE_a630_1913,"Dwight D. Eisenhower",PEOPLE_OPT_a13d_000B
"What US President has worn a Nazi uniform?",PEOPLE_d2ae_1914,"Ronald Reagan",PEOPLE_OPT_d41f_000B
"William Taft was the heaviest president of the United States.",PEOPLE_c532_1915,True,PEOPLE_OPT_a97b_000A
"What do these US Presidents have in common: George Washington, James Madison, Andrew Jackson, James Polk, James Buchanan and Warren Harding.",PEOPLE_5a2f_1916,"They had no children.",PEOPLE_OPT_ef80_000A
"Who is the first US President born on the 4th of July?",PEOPLE_b93a_1917,"Calvin Coolidge",PEOPLE_OPT_0993_000A
"Which of these US Presidents did not die on July 4?",PEOPLE_8474_1918,"Herbert Hoover",PEOPLE_OPT_3c8d_000D
"Which US President was fined $20 for speeding with his horse and carriage?",PEOPLE_ebc4_1919,"Ulysses Grant",PEOPLE_OPT_267f_000A
"Ariel Sharon, the 11th Prime Minister of Israel, was born in what year?",PEOPLE_8cd8_1920,1928,PEOPLE_OPT_d481_000D
"Which best describes former Prime Minister Ariel Sharons family life?",PEOPLE_dd9f_1921,"He was married twice and has three sons.",PEOPLE_OPT_3714_000A
"When did Ariel Sharon first fly to Israel?",PEOPLE_fde2_1922,"in 1945",PEOPLE_OPT_cbd3_000C
"Which of the statements describes most accurately Ariel Sharons education?",PEOPLE_c79d_1923,"He obtained an undergraduate degree from Hebrew University and a degree from Tel Aviv University.",PEOPLE_OPT_c6df_000D
"When did Sharon, a Major General by rank, retire from his military career?",PEOPLE_a43e_1924,1972,PEOPLE_OPT_d951_000C
"In which year did Ariel Sharon return to the Israel Defence Forces after his retirement?",PEOPLE_fefa_1925,1973,PEOPLE_OPT_7c86_000D
"What was the name of the first political party of Prime Minister Sharon?",PEOPLE_e084_1926,Likud,PEOPLE_OPT_fa81_000C
"Which statement best describes Ariel Sharons political life?",PEOPLE_c112_1927,"He held many positions in his first political party but finally formed a new one.",PEOPLE_OPT_4f09_000D
"Unit 101 was an Israeli organization closely connected to Ariel Sharons life. What type of organization was it?",PEOPLE_1e0b_1928,"A commando special operations group formed by Sharon in 1953",PEOPLE_OPT_c5ed_000A
"In 1981, Arabs attacked farming settlements in northern Israel by assaults and by shooting missiles into the farms. In order to stop this, Ariel Sharon launched what  military operation?",PEOPLE_7fb0_1929,"Operation Peace for the Galilee",PEOPLE_OPT_8a6e_000C
"As Minister of Construction and Housing, Ariel Sharon was unsuccessful in finding homes for the immigrants except for those willing to live on kibbutzim.",PEOPLE_a161_1930,False,PEOPLE_OPT_4514_000A
"December 18, 2005 and January 4, 2006 were critical dates in Ariel Sharons life. What happened on these dates?",PEOPLE_aa31_1931,"He suffered ischemic strokes.",PEOPLE_OPT_18a0_000C
"What is Fidel Castros real name?",PEOPLE_bafb_1932,"Fidel Alejandro Castro Ruz",PEOPLE_OPT_fbfe_000A
"Fidel Castro once swam across the Rio Grande to sneak into the USA .",PEOPLE_f4d4_1933,True,PEOPLE_OPT_c605_000B
"In 1945 Fidel Castro entered the University of Havana. Besides studying law there he played which position for the schools baseball team?",PEOPLE_b04e_1934,"Left-handed pitcher",PEOPLE_OPT_e8f1_000B
"Which political group did Fidel Castro join during his college days?",PEOPLE_f25b_1935,"Partido Ortodoxos",PEOPLE_OPT_c721_000B
"What honor did Fidel Castro win in 1944?",PEOPLE_053e_1936,"Best Cuban Athlete",PEOPLE_OPT_51a1_000A
"Who became leader of Cuba after a coup d etat in 1940?",PEOPLE_7b62_1937,"Fulgencio Batista",PEOPLE_OPT_e32c_000D
"Where was the failed attack on the Cuban army, led by Fidel Castro in 1953?",PEOPLE_1a7b_1938,"Moncada Barracks",PEOPLE_OPT_33c9_000C
"When did Fidel Castro and his group assume power?",PEOPLE_1a07_1939,1959,PEOPLE_OPT_25d2_000C
"Why did the USA declare an embargo on all trade to and from Cuba on October 27, 1962?",PEOPLE_1b16_1940,"American spy planes found Russian-made missiles in Cuba.",PEOPLE_OPT_43d2_000D
"Which famous American wrote the song A Hard Rains a-Gonna Fall at the height of the Cuban Missile Crisis?",PEOPLE_ffd5_1941,"Bob Dylan",PEOPLE_OPT_1d79_000C
"What settled the 1962 Cuban Missile Crisis?",PEOPLE_16c8_1942,"Russia took away the missiles in Cuba and the USA took away its missiles and spy equipment  in Turkey",PEOPLE_OPT_bdda_000D
"Which statement is not true?",PEOPLE_91ee_1943,"Religion is greatly oppressed in Cuba.",PEOPLE_OPT_2290_000C
"The 6th Prime Minister of Israel, Menachem Wolfovitch Begin was born in what year?",PEOPLE_ca40_1944,1913,PEOPLE_OPT_1f69_000A
"Menachem Begin was a member of the Betar Movement, which is what kind of organization?",PEOPLE_20e5_1945,"A Zionist youth group formed in 1929 at first to defend Jewish youth in Poland and then throughout Europe",PEOPLE_OPT_1ee3_000B
"Why  was Menachem Begin released  from Siberia in 1941?",PEOPLE_4722_1946,"Because of the the Sikorski-Mayski Agreement",PEOPLE_OPT_70f4_000C
"What Zionist group did Menachem Begin join in 1942?",PEOPLE_4b0b_1947,Irgun,PEOPLE_OPT_4a2d_000A
"What was the aim of Altalena Affair that took place in June, 1948?",PEOPLE_e9c0_1948,"All of these",PEOPLE_OPT_023d_000C
"The right-wing Israeli political party Likud was formed in what year?",PEOPLE_81d1_1949,1965,PEOPLE_OPT_115a_000D
"When did Menachem Begin become the first Likud Prime Minister of Israel?",PEOPLE_62fa_1950,1977,PEOPLE_OPT_0689_000B
"The Camp David Accords were signed by Egyptian President Anwar Sadat and Israeli Prime Minister Menachem Begin in what year?",PEOPLE_cd5b_1951,1978,PEOPLE_OPT_b2ad_000C
"The Israeli air strike against the Iraqi Osirak nuclear reactor, ordered by Menachem Begin, is known under what name?",PEOPLE_f8f2_1952,"Operation Opera",PEOPLE_OPT_4558_000C
"When did Prime Minister Menachem Begin  retire from public office?",PEOPLE_81e0_1953,1983,PEOPLE_OPT_1a4f_000C
"Where was George Washington inaugurated as first President of the United States?",PEOPLE_4320_1954,"New York City",PEOPLE_OPT_7a3b_000D
"Who was George Washingtons first Secretary of Defense?",PEOPLE_938e_1955,"This cabinet position did not exist",PEOPLE_OPT_cf67_000C
"What was George Washingtons first residence as President?",PEOPLE_6da1_1956,"Osgood House",PEOPLE_OPT_c52f_000A
"How many states comprised the Union when George Washington became President?",PEOPLE_9ab6_1957,11,PEOPLE_OPT_282d_000B
"What were the first three executive departments during George Washingtons tenure as President?",PEOPLE_0f31_1958,"War, State, Treasury",PEOPLE_OPT_dbce_000D
"What was the population of the US in 1790?",PEOPLE_1f29_1959,"4 million",PEOPLE_OPT_ad77_000D
"She was born in 1981 in New York and is the daughter of a real estate magnate.",PEOPLE_99e9_1960,"Ivanka Trump",PEOPLE_OPT_9f43_000C
"This socialite, model actress, singer, fashion designer said Dress cute wherever you go, life is too short to blend in.",PEOPLE_955b_1961,"Paris Hilton",PEOPLE_OPT_86ec_000C
"This American actress and comedian starred in the 1996 movie Father‚Äôs Day as Carrie Lawrence.",PEOPLE_c980_1962,"Julia Louis-Dreyfus",PEOPLE_OPT_6d63_000C
"Which of these ladies has been called the Russian Paris Hilton?",PEOPLE_ef21_1963,"Anna Anisimova",PEOPLE_OPT_9a80_000A
"This lady is an equestrian professional. She was featured in the HBO documentary Born Rich.",PEOPLE_bfe8_1964,"Georgina Bloomberg",PEOPLE_OPT_0a78_000B
"Born on January 5, 1984, she is the great-granddaughter of media tycoon William Randolph Hearst.",PEOPLE_e930_1965,"Amanda Hearst",PEOPLE_OPT_bade_000C
"Fashion model Lydia Hearst-Shaw is heiress to the media empire established by William Randolph Hearst.",PEOPLE_7848_1966,True,PEOPLE_OPT_8fd8_000A
"This socialite and fashion designer married businessman Todd Andrew Meister in 2004.",PEOPLE_9ce7_1967,"Nicky Hilton",PEOPLE_OPT_9db5_000C
"Her parents are co-founders of a pioneering cosmetics company.",PEOPLE_1f91_1968,"Aerin Lauder",PEOPLE_OPT_95be_000A
"Her fathers is a clothing designer and one of her brothers is a filmmaker.",PEOPLE_fdb9_1969,"Dylan Lauren",PEOPLE_OPT_95c6_000C
"This national scientists of the Philippines is the inventor of the videophone.",PEOPLE_a9b5_1970,"Gregorio Zara",PEOPLE_OPT_3991_000A
"This person is the inventor of the Lunar Rover, more popularly known as the Moon Buggy.",PEOPLE_13e7_1971,"Eduardo San Juan",PEOPLE_OPT_082e_000A
"Filipino inventor Fe del Mundo announced that he had invented a car that runs with water as fuel.",PEOPLE_ed97_1972,False,PEOPLE_OPT_487a_000B
"A Filipino scientist was reportedly the one who discovered the erythromycin in 1949.",PEOPLE_35e1_1973,True,PEOPLE_OPT_6197_000B
"Who was the Filipino that introduced the first single-chip graphical user interface accelerator and participated in developing the Ethernet controller chip that made the Internet possible?",PEOPLE_2e4e_1974,"Diosdado Banatao",PEOPLE_OPT_f987_000C
"This liquid allegedly developed by Filipino Department of Science and Technology is an iodine-rich drinking water that treats micronutrient deficiencies responsible for goiter, mental and physical retardation, and birth defects.",PEOPLE_62fc_1975,"Tubig Talino",PEOPLE_OPT_92ff_000C
"The name of what Filipino popular means of public transportation evolved from a military designation of a light vehicle first used by the Americans in World War II?",PEOPLE_0e01_1976,Jeepney,PEOPLE_OPT_dddf_000C
"What Welsh pirate was known for his love of fine clothing and jewelry?",PEOPLE_ac80_1977,"Bartholomew Roberts",PEOPLE_OPT_3d8f_000C
"What French pirate was given the title Baron by Napoleon Bonaparte?",PEOPLE_25fc_1978,"Robert Surcouf",PEOPLE_OPT_823b_000D
"According to rumors this Scottish sailor left behind a great treasure.",PEOPLE_5915_1979,"William Kidd",PEOPLE_OPT_5dca_000C
"What notorious English pirate was reported to have lit matches woven into his black beard to intimidate his enemies during battle?",PEOPLE_e6aa_1980,"Edward Teach",PEOPLE_OPT_be51_000D
"This famous English pirate and politician of the Elizabethan era sailed around the world, returning to England in 1580.",PEOPLE_969e_1981,"Francis Drake",PEOPLE_OPT_a43d_000C
"This Welsh privateer was knighted in 1674 and the following year he took up the post of Lieutenant Governor of Jamaica.",PEOPLE_a417_1982,"Henry Morgan",PEOPLE_OPT_4516_000A
"Why were popular female pirates –ênne Bonny and Mary Read not executed after they were captured?",PEOPLE_56b5_1983,"because they were pregnant",PEOPLE_OPT_0422_000B
"What famous pirate was arrested and conducted to the Kingdom of England in 1672 because he violated a peace treaty between England and Spain?",PEOPLE_595b_1984,"Henry Morgan",PEOPLE_OPT_a3ff_000B
"Ching Shih was a prominent Chinese female pirate active during what century?",PEOPLE_ade1_1985,19th,PEOPLE_OPT_db56_000B
"What legendary French corsair was nicknamed King of Corsairs due to his gallantry and chivalry?",PEOPLE_c21b_1986,"Robert Surcouf",PEOPLE_OPT_60fb_000C
"The Bermuda Triangle is located in the western part of the North Atlantic Ocean.",PEOPLE_7190_1987,True,PEOPLE_OPT_4364_000B
"In what year did Flight 19, a training flight of TBM Avenger bombers, go missing while over the Atlantic?",PEOPLE_3bb9_1988,1945,PEOPLE_OPT_dd1f_000A
"The loss of this US vessel with all 306 crew and passengers in 1918 was credited to the Bermuda Triangle.",PEOPLE_ba7f_1989,"USS Cyclops",PEOPLE_OPT_8a81_000B
"In the 1970s, American author and pilot Larry Kusche made the following conclusion regarding the Bermuda Triangle.",PEOPLE_6b92_1990,"All of these",PEOPLE_OPT_460d_000D
"Edgar Cayce, who was believed to be psychic, suggested that the Bermuda Triangle was the location of which of the following?",PEOPLE_729d_1991,Atlantis,PEOPLE_OPT_0743_000B
"The Bermuda Triangle area is among the most heavily-sailed shipping lanes in the world.",PEOPLE_8faf_1992,True,PEOPLE_OPT_1003_000B
"The disappearance of Theodosia Burr Alston, daughter of former US Vice President Aaron Burr, has been cited in relation to the Bermuda Triangle. She was a passenger aboard what ship when she disappeared?",PEOPLE_c427_1993,"The Patriot",PEOPLE_OPT_9141_000A
"What Steven Spielberg film suggests that Flight 19 was abducted by aliens?",PEOPLE_8a89_1994,"Close Encounters of the Third Kind",PEOPLE_OPT_7993_000D
"It was proven in the 1980s that some of the Bermuda Triangle incidents were related to compass problems.",PEOPLE_c6f0_1995,False,PEOPLE_OPT_a4f5_000A
"What aircraft disappeared in 1948 while on a flight from San Juan, Puerto Rico, to Miami?",PEOPLE_20ab_1996,"Douglas DC-3",PEOPLE_OPT_c433_000C
"Senator Ted Kennedys Irish inherent eloquence made him a powerful orator, none more so than when he delivered these words need not be idealized, or enlarged in death beyond what he was in life; to be remembered simply as a good and decent man, who saw wrong and tried to right it, saw suffering and tried to heal it, saw war and tried to stop it. Who was eulogized in Senator Kennedys speech?",PEOPLE_3e68_1997,"Robert F. Kennedy",PEOPLE_OPT_2517_000B
"Senator Ted Kennedy made a sudden, dramatic appearance in the summer of 2008 to cast the decisive vote for a cause he had fought for during his senate career. For what cause did Senator Kennedy come to vote Aye?",PEOPLE_0887_1998,Medicare,PEOPLE_OPT_f776_000B
"Ted Kennedy was approached by the Green Bay Packers to play professional football.",PEOPLE_7b4e_1999,True,PEOPLE_OPT_987b_000B
"From the floor of the Senate, Ted Kennedy described this mans America as one in which women would be forced into back-alley abortions, blacks would sit at segregated lunch counters, rouge police could break down citizens doors in midnight raids......the doors of the Federal courts would be shut on the fingers of millions of citizens. Who was the nominee to the U. S. Supreme Court that was the subject of Kennedys speech?",PEOPLE_1db5_2000,"Robert Bork",PEOPLE_OPT_6bd7_000C
"Ted Kennedys hopes for becoming President of the United States were dealt a crushing blow on the night of July 18, 1969 in the swirling waters off Dike Bridge. Who was the young girl who died that night in an accident that is known as the Chappaquiddick incident?",PEOPLE_ac57_2001,"Mary Jo Kopechne",PEOPLE_OPT_e803_000C
"For me, a few hours ago, this campaign came to an end. For all those whose care have been our concern, the work goes on, the cause endures, the hope still lives and the dream shall never die. These are words from Ted Kennedys concession speech after his failed run for the 1980 Democratic nomination for President of the United States. Who defeated Kennedy in his only bid for the Presidency?",PEOPLE_89e2_2002,"Jimmy Carter",PEOPLE_OPT_b119_000A
"In April 2009, Senator Ted Kennedy was asked to throw out the ceremonial first pitch on opening day for this major league team. In what stadium would you be sitting to watch Senator Kennedys first pitch?",PEOPLE_80ac_2003,"Fenway Park",PEOPLE_OPT_a7eb_000B
"Although Ted Kennedy enjoyed great success in the Senate, his behavior in his personal life was bringing negative press. His drinking and parting was spotlighted, when on March 29, 1991, after a night of hard parting at Au Bar with his son and nephew, a young woman brought rape charges against his nephew. Who is the nephew who stood trial in 1991?",PEOPLE_91af_2004,"William Kennedy Smith",PEOPLE_OPT_ba89_000B
"Who was Ted Kennedy speaking of with these lines, He had every gift but length of years.",PEOPLE_e28e_2005,"John F. Kennedy, Jr",PEOPLE_OPT_1781_000A
"Who delivered the eulogy at Senator Ted Kennedy funeral?",PEOPLE_c32f_2006,"President Obama",PEOPLE_OPT_6e42_000B
"What is the meaning of the Hebrew name Michael?",PEOPLE_8bef_2007,"Who is like God?",PEOPLE_OPT_52b6_000C
"What is the meaning of the Hebrew name Elizabeth, Elisabeth or Elisheva?",PEOPLE_48b8_2008,"My God is an oath.",PEOPLE_OPT_3b5d_000D
"What does the Hebrew name Isaac mean?",PEOPLE_c997_2009,Laughter,PEOPLE_OPT_0615_000D
"What is the meaning of the Hebrew name Sarah?",PEOPLE_6089_2010,Princess,PEOPLE_OPT_8474_000C
"What does the biblical name Benjamin mean in Hebrew?",PEOPLE_809b_2011,"Son of my right hand",PEOPLE_OPT_116c_000C
"Which of these titles were Prince William and Kate Middleton granted upon marriage by Elizabeth II?",PEOPLE_2a33_2012,"Duke and Duchess of Cambridge",PEOPLE_OPT_4e9c_000C
"What is Kate Middleton prohibited to do after becoming a member of the British royal family on April 29, 2011?",PEOPLE_e09f_2013,"all of these",PEOPLE_OPT_0a9e_000C
"What US building was lit in red, white, and blue at sunset on 29 April 2011, to mark the wedding of Prince William and Kate Middleton?",PEOPLE_8bc0_2014,"Empire State Building",PEOPLE_OPT_f087_000A
"Prince William proposed to Kate Middleton in October 2010 while on a private holiday in this country.",PEOPLE_2e42_2015,Kenya,PEOPLE_OPT_d212_000C
"Prince William and Kate Middleton share common ancestors.",PEOPLE_8085_2016,True,PEOPLE_OPT_d5c3_000B
"Name the venue, known as Royal Peculiar, where Prince William and Cathrine Middleton got married.",PEOPLE_d826_2017,"Westminster Abbey",PEOPLE_OPT_aac7_000D
"Who read an extract from the New Testaments Epistle to the Romans during Prince William and Kate Middletons wedding ceremony?",PEOPLE_fcd7_2018,"Kate Middletons brother, James",PEOPLE_OPT_82bb_000B
"At the time of her wedding Cathrine Middleton, who has been dubbed Waity Katie, became the oldest royal bride in history. How old was she when she walked down the aisle?",PEOPLE_2df8_2019,30,PEOPLE_OPT_1f8c_000D
"Which of these celebrities was NOT invited to Prince William and Cathrine Middletons wedding?",PEOPLE_e091_2020,"Ewan McGregor",PEOPLE_OPT_911e_000D
"What English designer created Kate Middletons bridal gown, which was made of satin and featured a hand-made lace bodice?",PEOPLE_d447_2021,"Sarah Burton",PEOPLE_OPT_52e3_000D
"Senator Edmund Muskie of Maine ran on the ticket with sitting Vice President Hubert Humphrey in 1968.",PEOPLE_8289_2022,True,PEOPLE_OPT_da96_000A
"Which senator represented California from 1969-1993?",PEOPLE_8d4c_2023,"Alan Cranston",PEOPLE_OPT_fbd8_000B
"After serving 5 US Presidents, Senator Elizabeth Dole won election to the Senate from North Carolina in 2002.",PEOPLE_b74a_2024,False,PEOPLE_OPT_36bb_000B
"This senator served Ohio in the US Senate from 1976 to 1995 as a Democrat.",PEOPLE_4de2_2025,"Howard Metzenbaum",PEOPLE_OPT_c7aa_000B
"John L. McClellan served as Arkansas senator from 1942-1977.",PEOPLE_ab39_2026,True,PEOPLE_OPT_8546_000B
"Which low-keyed US senator served Maryland from 1977 to 2006?",PEOPLE_2e25_2027,"Paul Sarbanes",PEOPLE_OPT_bef1_000B
"Morris K. Udall, from Arizona served in the US Senate until 1991 and wrote an autobiography entitled Too Funny to Be President.",PEOPLE_3452_2028,False,PEOPLE_OPT_bdee_000A
"In 1981, Senator Charles Grassley started representing Iowa as a Democrat.",PEOPLE_e116_2029,False,PEOPLE_OPT_7bce_000A
"In what state was Franklin D. Roosevelt (FDR) born and from what college did he get his undergraduate degree?",PEOPLE_f9d5_2030,"New York; Harvard",PEOPLE_OPT_e0bd_000A
"What was the last public office that FDR held before being elected president?",PEOPLE_e1f8_2031,"governor of New York",PEOPLE_OPT_7c55_000C
"Who did FDR defeat to win the presidential election in 1932?",PEOPLE_442f_2032,"Herbert Hoover",PEOPLE_OPT_0524_000A
"FDR was confined to a wheelchair throughout his presidency due to which of the following?",PEOPLE_3cb4_2033,polio,PEOPLE_OPT_ca84_000C
"The New Deal was a series of economic programs passed during the first term of FDR. Part of the New Deal were the PWA (Public Works Administration) and the WPA (Works Progress Administration) which were intended to do which of the following?",PEOPLE_f48b_2034,"all of these",PEOPLE_OPT_bfab_000A
"Which of the following programs, started as part of the New Deal, did NOT last into the 21st century?",PEOPLE_5f51_2035,"National Recovery Board",PEOPLE_OPT_def7_000D
"Roosevelt was very effective in communicating with the American people by radio. What did he call his best known radio broadcasts to the American people?",PEOPLE_34f8_2036,"Fireside Chats",PEOPLE_OPT_412d_000D
"Which of the following were most likely to dislike and oppose Franklin D. Roosevelt?",PEOPLE_e843_2037,"wealthy people",PEOPLE_OPT_36b4_000D
"FDR favored helping Britain in its fight with Germany after 1939. However, he was limited in ability to send military equipment to Britain because of strong opposition. Which of the following most strongly influenced FDR to go slow on aid to Britain?",PEOPLE_e4a8_2038,isolationists,PEOPLE_OPT_a4eb_000B
"After the Japanese attack on Pearl Harbor, Franklin D. Roosevelt went before Congress to call for a declaration of war on Japan. What was his memorable phrase for the day of the attack?",PEOPLE_06c6_2039,"date that will live in infamy",PEOPLE_OPT_c036_000D
"This person helped Franklin D. Roosevelt by mixing with the US people and relaying their ideas and feelings to the president.",PEOPLE_7483_2040,"his wife Eleanor Roosevelt",PEOPLE_OPT_226e_000C
"Which statement is true about FDR?",PEOPLE_0d12_2041,"He was the first US President to be elected for four presidential terms.",PEOPLE_OPT_1f37_000B
"Where did George Washington and his troops enter winter quarters after Trenton and Princeton in early 1777?",PEOPLE_6aaa_2042,Morristown,PEOPLE_OPT_b6b0_000A
"During the Revolutionary War, George Washington sent armed schooners to prey on enemy shipping for supplies.",PEOPLE_56aa_2043,True,PEOPLE_OPT_db4a_000B
"Throughout the American War for Independence, Martha Washington traveled with her husband George Washington a majority of the time and was close by.",PEOPLE_4ff1_2044,True,PEOPLE_OPT_600b_000B
"What happened to John McCain III while serving in Vietnam?",PEOPLE_082b_2045,"He became a prisoner of war.",PEOPLE_OPT_810f_000A
"What branch of service did John McCain III serve in?",PEOPLE_caf9_2046,Navy,PEOPLE_OPT_ad5a_000C
"John McCain III cant comb his hair.",PEOPLE_ce29_2047,True,PEOPLE_OPT_ea3a_000A
"What college did John McCain III attend?",PEOPLE_fc5f_2048,"United States Naval Academy",PEOPLE_OPT_d407_000C
"What year was John McCain III born?",PEOPLE_15b6_2049,1936,PEOPLE_OPT_af24_000C
"In 1987, John McCain III assumed office as a Senator from this state.",PEOPLE_fa02_2050,Arizona,PEOPLE_OPT_c6b0_000A
"Which Southeastern state primary was crucial in the 2000 election battle between George W. Bush and John McCain?",PEOPLE_2f10_2051,"South Carolina",PEOPLE_OPT_9ef2_000B
"In 2008, this newspaper reported on John McCains relationship with a lobbyist in Washington?",PEOPLE_502a_2052,"New York Times",PEOPLE_OPT_a8d2_000D
"What aircraft did John McCain III fly while in the military?",PEOPLE_b4e3_2053,"A-4 Skyhawk",PEOPLE_OPT_089f_000D
"How many medals did John McCain III receive while in the military?",PEOPLE_54bb_2054,5,PEOPLE_OPT_13c0_000B
"Which statement is true?",PEOPLE_29a0_2055,"At age 37 King James commissions a translation of the Bible.",PEOPLE_OPT_d288_000C
"Who portrayed Jesse James in the 2007 movie The Assassination of Jesse James by the Coward Bob Ford?",PEOPLE_d5d3_2056,"Brad Pitt",PEOPLE_OPT_a262_000B
"Who played Jesse James in the 1966 horror fantasy movie Jesse James Meets Frankensteins Daughter?",PEOPLE_7694_2057,"John Lupton",PEOPLE_OPT_74dc_000B
"Who played Jesse James in the1939 film Jesse James at Bay?",PEOPLE_f7e3_2058,"Roy Rogers",PEOPLE_OPT_0a66_000A
"Did Robert Wagner play Jesse in the 1957 movie The True Story of Jesse James?",PEOPLE_1eb8_2059,Yes,PEOPLE_OPT_228d_000A
"In 624, this priestess led the Arabian Quraish against Muhammad.",PEOPLE_e49a_2060,"Hind - Al - Hunnud",PEOPLE_OPT_c6e8_000C
"In 1945, Fidel Castro entered the University of Havana to study what major subject?",PEOPLE_06f7_2061,Law,PEOPLE_OPT_6c06_000D
"When Fidel Castro was a teenager, he chose the middle name Alejandro referring to which historical figure?",PEOPLE_8d9a_2062,"Alexander the Great",PEOPLE_OPT_f90b_000B
"Cuban political leader Fidel Castro has three sisters. Two of them are named Juanita and Emma. What is the name of the third one?",PEOPLE_471c_2063,Angela,PEOPLE_OPT_8e10_000C
"What revolutionary organization did Fidel Castro lead in order to overthrow the regime of Fulgencio Batista in Cuba in 1959?",PEOPLE_b581_2064,"The 26th of July Movement",PEOPLE_OPT_07da_000B
