question,QID,answer,answer_OID
"Which Canadian Prime Ministers was born on October 18, 1919 in Montr√©al, Quebec?",PEOPLE_a813_1231,"Pierre Elliott Trudeau",PEOPLE_OPT_2c5b_000D
"Which Canadian Prime Minister spent a record 21 years in office?",PEOPLE_9a31_1232,"William Lyon Mackenzie King",PEOPLE_OPT_3e0a_000B
"Which Canadian Prime Minister‚Äôs photo is on the Canadian $5 bill?",PEOPLE_9995_1233,"Sir Wilfrid Laurier",PEOPLE_OPT_b15c_000D
"This Canadian Prime Ministers term was only 5 months.",PEOPLE_9a7a_1234,"Kim Cambell",PEOPLE_OPT_81d0_000A
"Which Canadian Prime Minister was in office in the period between November 7, 1873 and October 8, 1878?",PEOPLE_5ba4_1235,"Alexander Mackenzie",PEOPLE_OPT_9cb9_000A
"This 19th century womens right activist was born in England in 1853. She was a poet,  a writer and a leader in The Church of Jesus Christ of Latter-day Saints. She was also active in the Republican Party in the state of Utah.",PEOPLE_1cbf_1236,"Ruth May Fox",PEOPLE_OPT_a855_000D
"Born Anna Mary Robertson in 1860, this famous centenarian began painting in her 70s when arthritis caused her embroidering skills to deteriorate.",PEOPLE_d54f_1237,"Grandma Moses",PEOPLE_OPT_dcdf_000D
"This actor starred in over 200 movies in his career from 1931-1989, usually playing bit parts. His more notable parts include the voice of the carnival barker in Pinocchio and his portrayal of a used car salesman in the movie Detour.",PEOPLE_8347_1238,"Don Brodie",PEOPLE_OPT_d39e_000C
"Robert De Niros role in Casino was based on the real life gangster Benjamin Bugsy Siegel.",PEOPLE_a557_1239,False,PEOPLE_OPT_3b16_000B
"Mickey Featherstone, member of  an organized crime gang the Westies, fled to Canada to avoid being drafted into Vietnam.",PEOPLE_ed65_1240,False,PEOPLE_OPT_9e4e_000A
"Mobster Tommy DeSimone attempted to rape Henry Hills wife, Karen Hill, while Henry Hill was in prison. Who was Karen having an affair with at the time?",PEOPLE_1880_1241,"Paul Vario",PEOPLE_OPT_011f_000C
"Mob lawyer Frank Ragano claimed that this Florida mob boss was involved in JFKs assassination.",PEOPLE_1724_1242,"Santo Trafficante Jr.",PEOPLE_OPT_5333_000B
"Sonny Black of the Bonano family murdered Sonny Red who also belonged to the Bonano family.",PEOPLE_18b3_1243,True,PEOPLE_OPT_0888_000A
"Were Tommy DeSimone, Henry Hill, or Jimmy Burke ever made members of the Mafia?",PEOPLE_02af_1244,No,PEOPLE_OPT_ffe7_000A
"Stephen Cranes war novel The Red Badge of Courage is set during this war.",PEOPLE_b3a4_1245,"American Civil War",PEOPLE_OPT_305b_000C
"What 1977 sci-fi classic is one of the few films both written and directed by Steven Spielberg?",PEOPLE_60ac_1246,"Close Encounters of the Third Kind",PEOPLE_OPT_da08_000C
"Stephen King published several short novels, such as Rage, The Long Walk, and Roadwork under this pen name.",PEOPLE_cbdb_1247,"Richard Bachman",PEOPLE_OPT_0bf9_000A
"What 1984 hit single from the movie The Woman in Red earned Stevie Wonder an Academy Award for Best Original Song?",PEOPLE_7a36_1248,"I Just Called to Say I Love You",PEOPLE_OPT_feff_000A
"What famous American musician, known for his trademark scarves, was born Steven Victor Tallarico in New York, NY in 1948?",PEOPLE_fdb9_1249,"Steven Tyler",PEOPLE_OPT_bd32_000B
"What actor is not correctly paired with the movie in which he starred?",PEOPLE_1eb9_1250,"Steven Seagal - The Delta Force",PEOPLE_OPT_bd85_000D
"What late-night NBC talk show was hosted by Steve Allen from 1954 to 1957?",PEOPLE_4b7c_1251,"The Tonight Show",PEOPLE_OPT_9a95_000D
"What actor won a Golden Globe for the leading role of Michael Scott in the American adaptation of the British series The Office?",PEOPLE_791d_1252,"Steve Carell",PEOPLE_OPT_e73a_000C
"In 1990, rock drummer Steve Adler was fired from this band because he was unable to perform well during the recording session of the song Civil War.",PEOPLE_f764_1253,"Guns N Roses",PEOPLE_OPT_3529_000A
"What Greek mythical hero did American bodybuilder and actor Steve Reeves portray in a 1958 movie?",PEOPLE_0ab0_1254,Hercules,PEOPLE_OPT_cf07_000C
"Who wrote the plays Pericles Prince of Tyre, Cymbeline and Titus Andronicus?",PEOPLE_5823_1255,"William Shakespeare",PEOPLE_OPT_9d4a_000B
"What playwright wrote Tambourlaine, Dido and Edward II?",PEOPLE_5318_1256,"Christopher Marlowe",PEOPLE_OPT_6430_000B
"Volpone, The Alchemist and Sejanus are plays by this dramatist.",PEOPLE_0d3f_1257,"Ben Jonson",PEOPLE_OPT_10c2_000B
"Who penned the plays The Rivals, The School for Scandal, Pizarro and The Critic?",PEOPLE_e63c_1258,"Richard Sheridan",PEOPLE_OPT_cfd2_000B
"What playwright is the author of The Way of the World, The Mourning Bride and Love for Love?",PEOPLE_6c94_1259,"William Congreve",PEOPLE_OPT_0347_000A
"Hedda Gabler, The Wild Duck, An Enemy of the People and Ghosts are plays written by this playwright.",PEOPLE_b4bc_1260,"Heinrich Ibsen",PEOPLE_OPT_c7c5_000A
"What playwright penned Waiting for Lefty, Golden Boy, Till the Day I Die and Awake and Sing?",PEOPLE_4989_1261,"Clifford Odets",PEOPLE_OPT_bc4e_000B
"Who is the author of the plays Nathan the Wise, The Education of Mankind, The Freethinker?",PEOPLE_c04a_1262,"Gotthold Lessing",PEOPLE_OPT_cb44_000A
"The Killer, A Stroll in the Air, Rhinoceros and Hunger and Thirst are plays by this dramatist.",PEOPLE_51da_1263,"Eugene Ionesco",PEOPLE_OPT_1e2b_000A
"What playwright is the author of The Misanthrope, The Miser, Tartuffe and The School for Wives?",PEOPLE_3cef_1264,"Jean-Baptiste Poquelin",PEOPLE_OPT_567f_000A
"Name the author of the plays Cyrano de Bergerac, Les Romanesques, Chantecler.",PEOPLE_2e85_1265,"Edmond Rostand",PEOPLE_OPT_fafe_000D
"Waiting for Godot, Krapps Last Tape, Happy Days, Catastrophe are some of the plays written by this playwright.",PEOPLE_a5f1_1266,"Samuel Beckett",PEOPLE_OPT_b244_000D
"Who is the author of the plays Oedipe, Eriphile, Mahomet and Naine?",PEOPLE_da7a_1267,"None of these",PEOPLE_OPT_a578_000A
"What novel by Joseph Heller is a sequel to Catch-22 and revisits some characters of the original, including Yossarian and Milo Minderbinder?",PEOPLE_bfad_1268,"Closing Time",PEOPLE_OPT_cc61_000A
"Joseph Conrad, the author of the popular novel Heart of Darkness, is regarded as one of the greatest novelists in the English language, although he did not learn to speak English fluently until he was in his twenties. What was his native language?",PEOPLE_68a0_1269,Polish,PEOPLE_OPT_a3dd_000D
"Joseph Haydn, often called the Father of the Symphony, was one of the most prominent composers of this period.",PEOPLE_e97f_1270,"Classical period",PEOPLE_OPT_95fb_000A
"In 1939, Soviet leader Josef Stalin signed a non-aggression pact with Nazi Germany which was violated when Germany invaded the Soviet Union during WWII. What was the code name for this invasion?",PEOPLE_b687_1271,"Operation Barbarossa",PEOPLE_OPT_e499_000D
"Who recorded the song We Didnt Start the Fire that makes reference to headline events and mentions Joe DiMaggio, Josef Stalin and Joseph McCarthy?",PEOPLE_edd1_1272,"Billy Joel",PEOPLE_OPT_af70_000A
"US Senator Joseph McCarthy gained national attention and began his anti-communist pursuits with a famous speech delivered on this day in 1950.",PEOPLE_b3e7_1273,"Lincoln Day",PEOPLE_OPT_83d0_000D
"What was Joe DiMaggios uniform number retired by the Yankees in 1952?",PEOPLE_ff2b_1274,5,PEOPLE_OPT_da2d_000B
"At the start of World War II, Joseph P. Kennedy, Sr., the patriarch of the prominent political clan, served as the United States Ambassador to this country.",PEOPLE_b88d_1275,"The United Kingdom",PEOPLE_OPT_7219_000C
"What 18th-century British theologian, natural philosopher and educator is credited with the discovery of oxygen?",PEOPLE_9f92_1276,"Joseph Priestly",PEOPLE_OPT_3452_000B
"What British physicist was awarded the Nobel Prize for the discovery of the electron and his work on the conduction of electricity in gases?",PEOPLE_0173_1277,"Joseph John Thomson",PEOPLE_OPT_6e6f_000C
"What was the goal of Roosevelts New Deal program?",PEOPLE_01ba_1278,"all of these",PEOPLE_OPT_386d_000D
"In a famous statement from his first inaugural address, President Roosevelt said that this was the only thing Americans had to fear.",PEOPLE_1b14_1279,"fear itself",PEOPLE_OPT_8cca_000A
"The Public Works Administration (PWA), that was created as part of the New Deal program, attempted to improve the economy by which of the following?",PEOPLE_2d8f_1280,"hiring many unemployed people to build schools, roads, etc.",PEOPLE_OPT_7a81_000C
"Which of the following US population groups was LEAST likely to support Roosevelt and the New Deal?",PEOPLE_3d6f_1281,"upper middle class whites",PEOPLE_OPT_72bd_000D
"Why did many people criticise the Agricultural Adjustment Act (AAA) of 1933?",PEOPLE_b6d2_1282,"Paid farmers to grow less than previously",PEOPLE_OPT_6a9b_000B
"President Roosevelt skillfully communicated with the American people through which of the following?",PEOPLE_ac9c_1283,"radio fireside chats",PEOPLE_OPT_096a_000C
"Which of these was created by Roosevelt to insure that the stock market was properly regulated?",PEOPLE_7c56_1284,"Securities and Exchange Commission",PEOPLE_OPT_33e4_000C
"Although it did not happen, many Americans feared that the Great Depression would greatly increase the power of this political party.",PEOPLE_c03e_1285,"The Communist Party of the USA",PEOPLE_OPT_76f0_000C
"George W. Bush, who became U.S. President in 2001, was born in which city?",PEOPLE_f341_1286,"New Haven, Connecticut, USA",PEOPLE_OPT_1dc7_000D
"In 2004, George W. Bush was reelected as which U.S. President in succession?",PEOPLE_125b_1287,"The 43rd president",PEOPLE_OPT_ca23_000A
"In 2002, U.S. President  George W. Bush told British Prime Minister Tony Blair that the problem with the French is that they dont have a word for entrepreneur.",PEOPLE_ade6_1288,False,PEOPLE_OPT_896d_000A
"In 1968 George W. Bush obtained a bachelor‚Äôs degree in history from which university?",PEOPLE_6d25_1289,"Yale University",PEOPLE_OPT_3996_000B
"U.S. President George W. Bush was the first Governor in Texas that was elected to two 4-year terms in a row.",PEOPLE_289c_1290,True,PEOPLE_OPT_bf5f_000A
"In 1975, U.S. President George W. Bush received a masters degree in business administration from which university?",PEOPLE_5c78_1291,"Harvard Business School",PEOPLE_OPT_0b13_000C
"U. S. President George W. Bush is the son of George H. W. Bush, who served as U.S. President from 1989 to 1993. However, who were the first father and son, who both served as U. S. Presidents?",PEOPLE_c143_1292,"John Adams and John Quincy Adams",PEOPLE_OPT_ec4d_000B
"An act of terrorism totally outside the bounds of international law and diplomatic tradition, a crisis that calls for firmness and restraint. is a quote by U. S. President George W. Bush.",PEOPLE_a162_1293,False,PEOPLE_OPT_62f4_000B
"After the 2000 presidential elections, Richard B. Cheney became U.S. Vice President under President George W. Bush.",PEOPLE_1171_1294,True,PEOPLE_OPT_c1d1_000B
"Which of these was the tallest U.S. President?",PEOPLE_09f4_1295,"Abraham Lincoln",PEOPLE_OPT_f5ba_000B
"George Washington was related to which other US President?",PEOPLE_d77a_1296,"James Madison",PEOPLE_OPT_6e9f_000D
"George Washington was related to  which King of England?",PEOPLE_6f6d_1297,"King Edward III",PEOPLE_OPT_4409_000D
"George Washington was of small to medium stature.",PEOPLE_d88e_1298,False,PEOPLE_OPT_1597_000B
"Which of the following is true regarding George Washingtons teeth by the time he was inaugurated as president?",PEOPLE_eb69_1299,"He had one tooth remaining.",PEOPLE_OPT_8308_000C
"How many children did George Washington have?",PEOPLE_a81c_1300,None,PEOPLE_OPT_5b6f_000C
"Where was George Washington born?",PEOPLE_0d86_1301,Virginia,PEOPLE_OPT_383c_000B
"What was George Washingtons first occupation?",PEOPLE_3952_1302,"Land Surveyor",PEOPLE_OPT_d506_000D
"What was the name of George Washingtons wife?",PEOPLE_e306_1303,"Martha  Dandridge Custice",PEOPLE_OPT_5816_000A
"George Washington served in both the Virginia Militia and the Continental Army.",PEOPLE_f504_1304,True,PEOPLE_OPT_33e8_000B
"Mount Vernon was built for which of the following reasons?",PEOPLE_38b1_1305,"None of these",PEOPLE_OPT_1716_000D
"In what year was George Washington elected president?",PEOPLE_b57d_1306,1789,PEOPLE_OPT_113b_000D
"Which of the following did George Washington not accomplish?",PEOPLE_28c8_1307,"Alien and Sedition Acts",PEOPLE_OPT_dac3_000C
"Was George Washington assassinated?",PEOPLE_575d_1308,No,PEOPLE_OPT_82be_000A
"Maria or Mary is probably the most popular name around the world. What does it mean?",PEOPLE_9555_1309,Bitterness,PEOPLE_OPT_a5f8_000B
"What is the meaning of the very popular name Mark?",PEOPLE_2015_1310,Warlike,PEOPLE_OPT_53fb_000C
"What does the name Steven or Stephen mean?",PEOPLE_7bbc_1311,Crown,PEOPLE_OPT_35d2_000B
"The names Christina, Christoper and their derivatives all come from the name of Christ. What does it mean?",PEOPLE_c457_1312,Messiah,PEOPLE_OPT_e1ee_000B
"The names Nicole, Niki, Nicolas come from the old name Nicholas. What is the meaning of this name?",PEOPLE_0173_1313,"Victory of the people",PEOPLE_OPT_7448_000D
"What is the meaning of the very common name John?",PEOPLE_e60b_1314,"God is gracious",PEOPLE_OPT_3b19_000C
"Ann, Anne, Annabel, Anita are names derived from the Latin name Anna. What does this name mean?",PEOPLE_7671_1315,Gracious,PEOPLE_OPT_d59b_000D
"What is the meaning of the name Natalie?",PEOPLE_9674_1316,"Born at Christmas",PEOPLE_OPT_2f38_000D
"Peter is quite a common name around the world with many variations. What is its meaning?",PEOPLE_e6a3_1317,Rock,PEOPLE_OPT_c420_000C
"What is the meaning of the name George which has variants in dozens of languages?",PEOPLE_c51d_1318,Farmer,PEOPLE_OPT_ccba_000D
"This former President died exactly 34 years following President Trumans death.",PEOPLE_34d5_1319,"Gerald Ford",PEOPLE_OPT_207e_000A
"What was the name of the song recorded by Chicago in 1975 in memory of Harry S. Truman?",PEOPLE_539c_1320,"Harry Truman",PEOPLE_OPT_96b2_000D
"How old was Harry Trumans wife, Bess Truman, when she died in 1982?",PEOPLE_c3d4_1321,97,PEOPLE_OPT_fe96_000A
"In the television show The Simpsons, Harry Truman is on the million dollar bill.",PEOPLE_81ba_1322,False,PEOPLE_OPT_b8cf_000A
"Alben Barkley served as  Vice President under Harry S. Truman from 1949-1953.  Who served as Trumans Vice President from 1945-1949?",PEOPLE_ff27_1323,"no one",PEOPLE_OPT_6b13_000C
"During the 1952 Presidential campaign, then exiting President Harry Truman had a nickname for Presidential candidate Estes Kefauver whom he disliked and distrusted. What was that nickname?",PEOPLE_4662_1324,"cow fever",PEOPLE_OPT_9e29_000D
"Harry and Bess Truman were he first senior citizens to receive medicare cards. They received them in the mid-60s from then President LBJ.",PEOPLE_5eff_1325,True,PEOPLE_OPT_11de_000B
"In 1956, Harry Truman received an honorary degree in Civil Law from this University.",PEOPLE_4973_1326,"Oxford University",PEOPLE_OPT_bf9d_000A
"When Harry Truman left the Presidency he was highly regarded by the American people.",PEOPLE_7010_1327,False,PEOPLE_OPT_013d_000A
"What was the nickname of the third child of John I of Portugal ‚Äì Prince Henry, who was responsible for the beginning of the European worldwide explorations?",PEOPLE_bdf9_1328,"The Navigator",PEOPLE_OPT_fb70_000A
"The rounding of the Cape of Good Hope in 1488 was a major milestone in the attempts by the Portuguese to establish direct trade relations with the Far East. Who was the first European to reach The Cape?",PEOPLE_bdff_1329,"Bartolomeu Dias",PEOPLE_OPT_c636_000A
"In his initial voyage in 1492, in an attempt to find a shorter and more direct trade route to Asia, Christopher Columbus found what was called a ‚ÄúNew World‚Äù. What is the territorys present day name?",PEOPLE_b1a7_1330,America,PEOPLE_OPT_8547_000C
"What were the carrack and caravel, whose development in the 15th century in Portugal enabled more widespread exploration of the world?",PEOPLE_565c_1331,"types of ships",PEOPLE_OPT_b380_000D
"Who was the Portuguese explorer that commanded the first ships to sail directly from Europe to India?",PEOPLE_3cb6_1332,"Vasco da Gama",PEOPLE_OPT_5f3a_000C
"Commissioned to establish permanent commercial relations and to introduce Christianity wherever he went, Portuguese explorer Pedro √Ålvares Cabral left Lisbon on 9 March 1500 with a fleet of thirteen ships and discovered what present day territory?",PEOPLE_b738_1333,Brazil,PEOPLE_OPT_6089_000A
"The name of the largest ocean, the Pacific Ocean, is derived from the Latin name ‚ÄúMare Pacificum‚Äù, which means peaceful sea. Who gave the ocean this name?",PEOPLE_8fee_1334,"Ferdinand Magellan",PEOPLE_OPT_a779_000B
"Who completed the first circumnavigation of the globe in a single expedition in September 1522?",PEOPLE_754c_1335,"Juan Sebasti√°n Elcano",PEOPLE_OPT_e021_000A
"In 1519, in search of the Spice Islands, Portuguese navigator Ferdinand Magellan set out on an expedition with 241 men on five ships, called Concepci√≥n, San Antonio,Trinidad, Victoria and what else?",PEOPLE_20ad_1336,Santiago,PEOPLE_OPT_cfba_000D
"Which of the following happened first chronologically?",PEOPLE_911c_1337,"The Madeira Islands were discovered in the Atlantic ocean.",PEOPLE_OPT_63a0_000A
"The name John originates from the Hebrew name Yohannan. What does Yohannan mean?",PEOPLE_69cb_1338,"Yahweh is Gracious",PEOPLE_OPT_095f_000C
"Eoin is a version of the name John.",PEOPLE_6ede_1339,Yes,PEOPLE_OPT_a873_000A
"John is a slang term meaning prostitute.",PEOPLE_8e91_1340,False,PEOPLE_OPT_c021_000A
"Did John Loren Sandford write a book titled Dark  of the Moon?",PEOPLE_3fdc_1341,No,PEOPLE_OPT_b4eb_000A
"This Italian-American gangster ran the streets of Chicago during the Prohibition years and orchestrated the most notorious gangland killing of the 20th century.",PEOPLE_8aa6_1342,"Al Capone",PEOPLE_OPT_fd4a_000C
"What was Joseph Bonannos nickname?",PEOPLE_7c4c_1343,"Joe Bananas",PEOPLE_OPT_dfc8_000B
"Carlo Gambinos family belonged to the Honored Society, a criminal brotherhood that used codes of honor and millions of Italian Lira to control illegal businesses in Sicily.",PEOPLE_6247_1344,True,PEOPLE_OPT_4073_000B
"This NY mobster was nicknamed The Chin and was often seen wandering the streets of Greenwich Village in his bathrobe and slippers, mumbling incoherently to himself.",PEOPLE_7d1e_1345,"Vincent Gigante",PEOPLE_OPT_2950_000C
"This Chinese eunuch is controversially regarded as the inventor of paper.",PEOPLE_235f_1346,"Cai Lun",PEOPLE_OPT_d458_000C
"What American scientist invented the phonograph, the motion picture camera, and the long-lasting electric light bulb?",PEOPLE_6eb7_1347,"Thomas Edison",PEOPLE_OPT_6f33_000C
"What is the name of the German scientist who invented the X-ray machine?",PEOPLE_c236_1348,"Wilhelm Roentgen",PEOPLE_OPT_739e_000C
"This scientist discovered insulin and called it pancreatine.",PEOPLE_aed8_1349,"Nicolae Paulescu",PEOPLE_OPT_2183_000A
"This American engineer is known as the inventor of the microwave oven.",PEOPLE_e76a_1350,"Percy Spencer",PEOPLE_OPT_e515_000A
"What is the name of the man who invented dynamite?",PEOPLE_c0a9_1351,"Alfred Nobel",PEOPLE_OPT_6a31_000A
"This American physicist invented the first automatic programmable electronic digital computer.",PEOPLE_597e_1352,"John Vincent Atanasoff",PEOPLE_OPT_dfe1_000B
"What is the name of the Italian maker of musical instruments who is considered the inventor of the piano?",PEOPLE_69e1_1353,"Bartolomeo Cristofori",PEOPLE_OPT_bcd4_000C
"What is the name of the philologist who invented the Esperanto language?",PEOPLE_329e_1354,"Ludwik Lazarz Zamenhof",PEOPLE_OPT_0e32_000C
"Who is credited with the discovery of penicillin?",PEOPLE_9eb7_1355,"Alexander Fleming",PEOPLE_OPT_04ed_000B
"Which is correctly ranked highest to lowest",PEOPLE_caaf_1356,"Marquess, Earl, Baron, Knight",PEOPLE_OPT_6e5a_000A
"In Chinese nobility, the equivalent of a Count is called:",PEOPLE_fdba_1357,Bo,PEOPLE_OPT_21fb_000D
"The highest ranked title in British Nobility is:",PEOPLE_860a_1358,Duke,PEOPLE_OPT_0549_000A
"In Germany, a Kaiser is a:",PEOPLE_51de_1359,Emperor,PEOPLE_OPT_d0bf_000B
"The collective peerage of Japan is known as:",PEOPLE_e2b7_1360,Kazoku,PEOPLE_OPT_8b4a_000D
"The Russian nobility were required to wear a kind of uniform at Court.",PEOPLE_d1aa_1361,True,PEOPLE_OPT_7237_000A
"In Korea, a Panseo is a:",PEOPLE_8089_1362,Viscount,PEOPLE_OPT_2057_000C
"In Belgium, nobility titles are still granted by the King of the Belgians.",PEOPLE_da69_1363,True,PEOPLE_OPT_b5f7_000A
"In Fiji the nobility consists of:",PEOPLE_6c56_1364,Chiefs,PEOPLE_OPT_a945_000B
"How long did Queen Victoria reign?",PEOPLE_37d0_1365,"63 years",PEOPLE_OPT_9ea9_000C
"Who was Queen Victorias spouse and consort?",PEOPLE_d197_1366,"Prince Albert",PEOPLE_OPT_3e4f_000D
"How many children did Queen Victoria have?",PEOPLE_8d51_1367,9,PEOPLE_OPT_801f_000C
"After her husbands death in 1861, Queen Victoria only wore almost entirely black for the remainder of her life.",PEOPLE_06e7_1368,True,PEOPLE_OPT_1c95_000B
"What other title did Queen Victoria of England have?",PEOPLE_1191_1369,"Empress of India",PEOPLE_OPT_4f43_000C
"By what moniker was Queen Victoria known?",PEOPLE_4e58_1370,"Grandmother of Europe",PEOPLE_OPT_8ea3_000B
"Queen Victoria was the first monarch to live in Kensington Palace.",PEOPLE_741d_1371,False,PEOPLE_OPT_b1db_000B
"Queen Victoria died of typhoid fever.",PEOPLE_ab03_1372,False,PEOPLE_OPT_a6d4_000B
"Who succeeded Queen Victoria on the British throne?",PEOPLE_3cd6_1373,"King Edward VII",PEOPLE_OPT_b4b4_000C
"Slavery was banned in all of the British empire under Queen Victoria.",PEOPLE_52b6_1374,True,PEOPLE_OPT_58cd_000B
"Where is Queen Victoria buried?",PEOPLE_9cc6_1375,"Frogmore, Windsor",PEOPLE_OPT_d094_000D
"How many lives is Ronald Reagan credited for saving while a life guard?",PEOPLE_6710_1376,77,PEOPLE_OPT_551e_000D
"Ronald Reagan held many jobs, one of which was in sports. What was this job?",PEOPLE_ddbf_1377,"sports caster",PEOPLE_OPT_91c4_000D
"Which of these was Ronald Reagans favorite candy?",PEOPLE_a24a_1378,"Jelly Beans",PEOPLE_OPT_7a1a_000A
"During World War II Ronald Reagan made training videos for the US Army Air Corps.",PEOPLE_8ae2_1379,True,PEOPLE_OPT_5834_000A
"Ronald Reagan was originally a member of the Democratic party.",PEOPLE_099e_1380,True,PEOPLE_OPT_06b8_000B
"In which middle eastern country did terrorists attack an American marine barracks during the Ronald Reagan administration?",PEOPLE_88fc_1381,Lebanon,PEOPLE_OPT_8875_000D
"What was the name of the man who shot Ronald Reagan in 1981?",PEOPLE_82ad_1382,"John Hinckley",PEOPLE_OPT_21ef_000A
"What US president had a daughter named Margaret who became a successful writer of fiction and non-fiction books?",PEOPLE_2fd7_1383,"Harry S. Truman",PEOPLE_OPT_d01c_000C
"A former schoolteacher, this actress gained fame for her portrayal of The Wicked Witch of the West in the 1939 film The Wizard of Oz.",PEOPLE_823d_1384,"Margaret Hamilton",PEOPLE_OPT_ba86_000A
"Which author is not correctly matched with the novel she wrote?",PEOPLE_06e1_1385,"Margaret Moore - The Blind Assassin",PEOPLE_OPT_e78c_000C
"Name the famous author whose granddaughter committed suicide one day before the anniversary of his own suicide.",PEOPLE_fb41_1386,"Ernest Hemingway",PEOPLE_OPT_7108_000B
"What event occurred six days after Marguerite de Valois (Queen Margot) marriage to Henry de Bourbon, the King of Navarre?",PEOPLE_23b5_1387,"Saint Bartholomews Day",PEOPLE_OPT_4053_000D
"What war was the UK involved in during Margaret Thatchers tenure as Prime Minister?",PEOPLE_8355_1388,"The Falklands War",PEOPLE_OPT_644b_000C
"This Academy Award-winning actress starred opposite Judy Garland in the 1944 romantic musical film Meet Me in St. Louis.",PEOPLE_789e_1389,"Margaret OBrien",PEOPLE_OPT_ef81_000C
"Margaret Rutherford won an Academy Award for Best Supporting Actress for this movie, starring Elizabeth Taylor and Richard Burton.",PEOPLE_be35_1390,"The V.I.P.s",PEOPLE_OPT_ed53_000A
"This American cultural anthropologist, who was a featured writer and speaker in the mass media throughout the 1960s and 1970s, was a proponent of broadened sexual mores.",PEOPLE_f850_1391,"Margaret Mead",PEOPLE_OPT_7185_000B
"The Master and Margarita, which many critics regard as one of the greatest novels of the 20th century, tells the story of a visit by the Devil to a fervently atheistic society. In what country is the novel set?",PEOPLE_130d_1392,"The Soviet Union",PEOPLE_OPT_2c7c_000A
"What was the real first name of the infamous pirate Blackbeard?",PEOPLE_bd34_1393,Edward,PEOPLE_OPT_f107_000C
"Where did Blackbeards famous ship sink?",PEOPLE_fd6d_1394,"The Coast of the Carolinas",PEOPLE_OPT_9e9d_000C
"How long was Blackbeards reign of terror?",PEOPLE_3c82_1395,"2 years",PEOPLE_OPT_33c9_000B
"Blackbeard is considered the most successful pirate of all time.",PEOPLE_43aa_1396,False,PEOPLE_OPT_6a27_000B
"A wreck which was claimed to be Blackbeards ship was discovered near North Carolina in 1978.",PEOPLE_2ebc_1397,False,PEOPLE_OPT_2f69_000A
"In what year did Blackbeard die?",PEOPLE_e191_1398,1718,PEOPLE_OPT_fb49_000A
"What American city did Blackbeard successfully blockade in his most daring and famous act?",PEOPLE_f109_1399,Charlston,PEOPLE_OPT_cff7_000C
"After Blackbeard died, he was beheaded and his head was suspended from the ship of his captor.",PEOPLE_647d_1400,True,PEOPLE_OPT_d1ee_000B
"What uniform number did baseball player Johnny Bench wear while with the Reds?",PEOPLE_65e2_1401,5,PEOPLE_OPT_c2ba_000B
"Len Dawson, who played quarterback for the KC Chiefs, wore number 16.",PEOPLE_9d27_1402,True,PEOPLE_OPT_5f6a_000A
"Jerry Rice wore number 82 when he played for the San Francisco 49ers.",PEOPLE_d6dd_1403,False,PEOPLE_OPT_7b18_000A
