question,QID,answer,answer_OID
"Which knight met the challenge of the The Green Knight?",PEOPLE_8a60_0580,"Sir Gawain",PEOPLE_OPT_9bc2_000C
"According to Geoffrey of Monmouths History of the Kings of England, King Arthur was the King of which realm?",PEOPLE_6b3c_0581,Britain,PEOPLE_OPT_2388_000D
"After Queen Guinevere is found in an adulterous love affair, King Arthur is forced to condemn her to burn at the stake. Who arrives to save Queen Guinevere?",PEOPLE_2326_0582,Lancelot,PEOPLE_OPT_e437_000C
"He voiced the adult flower in Bambi and Mr. Stork in Dumbo. He was also the voice of Kaa in Jungle book, of the Cheshire cat in Alice in Wonderland and of the original Honey Nut Bee on the Cheerios commercials. His face may be forgotten, his voice never will. On TV he had a lovable role as Uncle Oscar the inventor on The Adventures of Superman series.",PEOPLE_bcf7_0583,"Sterling Holloway",PEOPLE_OPT_185c_000B
"Who is the first person to serve as both Vice President and President of the United States, without having been elected to either office?",PEOPLE_7364_0584,"Gerald R. Ford",PEOPLE_OPT_7d12_000B
"Which president was elected to two Presidential terms without ever getting a majority of the popular vote?",PEOPLE_c256_0585,"Wiliam J. Clinton",PEOPLE_OPT_69a7_000A
"Which U.S. President studied nuclear physics but made a career in politics and farming?",PEOPLE_4778_0586,"Jimmy Carter",PEOPLE_OPT_2bbf_000D
"Who was the first U.S. President to be impeached?",PEOPLE_4c1a_0587,"Andrew Johnson",PEOPLE_OPT_c210_000D
"Which two U.S. Presidents were the first father and son to hold the office?",PEOPLE_292d_0588,"John Adams and John Quincy Adams",PEOPLE_OPT_c11a_000C
"Which U.S. President was the first to formally commit American military troops to the war between North and South Vietnam?",PEOPLE_7b03_0589,"John F. Kennedy",PEOPLE_OPT_007c_000D
"Under which U.S. President was the first atomic bomb developed?",PEOPLE_acd3_0590,"Franklin D. Roosevelt",PEOPLE_OPT_1c9e_000A
"Who was the first U.S. President to die in office?",PEOPLE_3abf_0591,"William Henry Harrison",PEOPLE_OPT_3a19_000D
"Who was the first U.S. President to take office while unmarried?",PEOPLE_e8ec_0592,"Thomas Jefferson",PEOPLE_OPT_9d33_000B
"Who was the first U.S. President to serve non-consecutive terms?",PEOPLE_8efb_0593,"Grover Cleveland",PEOPLE_OPT_96f9_000C
"At the age of 20 this future general was confident that he would  make an efficient adjutant (Major), though he was then without military experience. In November 1752 he was appointed adjutant of the southern district of Virginia by Governor Robert Dinwiddie.",PEOPLE_64dc_0594,"George Washington",PEOPLE_OPT_4a30_000D
"This future general  was educated at the expense of King Louis XVI, at Brienne and the √âcole Militaire in Paris. He graduated in 1785, at the age of 16, and joined the artillery as a second lieutenant.",PEOPLE_d2e5_0595,"Napoleon Bonaparte",PEOPLE_OPT_4471_000D
"At the age of nine this future general accompanied his father on the Carthaginian expedition to conquer Spain. Before starting, the boy vowed eternal hatred for Rome.",PEOPLE_a767_0596,Hannibal,PEOPLE_OPT_b3fd_000D
"In 1829, this future general graduated second in his class from the U.S. Military Academy.",PEOPLE_72e6_0597,"Robert E. Lee",PEOPLE_OPT_187a_000B
"This future general joined the German army in 1910. After winning awards for bravery in World War I, he taught in military academies. Accusations of high treason drove him to suicide in 1944.",PEOPLE_2356_0598,"Erwin Rommel",PEOPLE_OPT_0598_000B
"This future general was educated at the United States Military Academy. When he graduated, the American Civil War was under way and he was assigned to the Union Army as a second lieutenant.",PEOPLE_06e8_0599,"George Custer",PEOPLE_OPT_ef43_000A
"This future general, born in San Gabriel, California, was educated at the U.S. Military Academy. On his graduation in 1909 he was commissioned a second lieutenant. He served in both World Wars and as a military Governor of Bavaria.",PEOPLE_8cf3_0600,"George Patton",PEOPLE_OPT_0b46_000C
"From 58 to 56 BC, this future general served as a leader of cavalry in Roman campaigns in Palestine and Egypt. He formed the Second Triumvirate, which ultimately secured the end of the Roman Republic.",PEOPLE_33d4_0601,"Mark Antony",PEOPLE_OPT_5f16_000C
"At the age of 14, this future general, born in Kefar Malal, Israel, joined the Haganah, an underground militia.",PEOPLE_e1b7_0602,"Ariel Sharon",PEOPLE_OPT_916d_000C
"This future general, born in Tokyo, graduated from the Army Staff College at the top of his class in 1915. He served as a military attach√© in Switzerland and Germany from 1919 to 1922.",PEOPLE_facc_0603,"T≈çj≈ç Hideki",PEOPLE_OPT_6d14_000C
"Which English historical figure said: I may be drunk, Miss, but in the morning I will be sober and you will still be ugly.?",PEOPLE_d569_0604,"Winston Churchill",PEOPLE_OPT_5cab_000D
"Which political figure said: If you want a thing done well, do it yourself.?",PEOPLE_2de6_0605,"Napoleon Bonaparte",PEOPLE_OPT_d390_000B
"Which American actor delivered the words: Ive been accused of vulgarity. I say thats bullshit.?",PEOPLE_c8ba_0606,"Mel Brooks",PEOPLE_OPT_28c8_000A
"Which Indian pioneer of Satyagraha made the statement: Freedom is not worth having if it does not include the freedom to make mistakes.?",PEOPLE_47a6_0607,"Mahatma Gandhi",PEOPLE_OPT_51c1_000A
"Which American actor said: I told my psychiatrist that everyone hates me. He said I was being ridiculous - everyone hasnt met me yet.?",PEOPLE_127b_0608,"Jacob Cohen",PEOPLE_OPT_26f8_000B
"What American writer said: Better to keep your mouth shut and appear stupid than to open it and remove all doubt.?",PEOPLE_2140_0609,"Mark Twain",PEOPLE_OPT_ea68_000B
"What German scientist said: The difference between genius and stupidity is that genius has its limits.?",PEOPLE_4c5d_0610,"Albert Einstein",PEOPLE_OPT_40fe_000C
"What novelist made the statement: So soon as a fashion is universal, it is out of date.?",PEOPLE_eed7_0611,"Marie von Ebner-Eschenbach",PEOPLE_OPT_425a_000C
"What American novelist said: Nothing is as frustrating as arguing with someone who knows what hes talking about.?",PEOPLE_3dd9_0612,"Sam Ewing",PEOPLE_OPT_56f1_000B
"Who was the first first lady, wife of George Washington?",PEOPLE_10c1_0613,Martha,PEOPLE_OPT_e498_000D
"What were the first names of the U.S. presidential couple the Jeffersons?",PEOPLE_b13e_0614,"Tom and Martha",PEOPLE_OPT_7fd3_000C
"What was the last name of U.S. presidential couple John and Abigail?",PEOPLE_6c45_0615,Adams,PEOPLE_OPT_7811_000D
"Who was U.S. President Abraham Lincolns wife?",PEOPLE_9e3a_0616,Mary,PEOPLE_OPT_cd50_000A
"What were the first names of the U.S. presidential couple the Madisons?",PEOPLE_2dae_0617,"James and Dolly",PEOPLE_OPT_ff93_000B
"How was First Lady Mrs. Dwight Eisenhower affectionately known?",PEOPLE_1159_0618,Mamie,PEOPLE_OPT_7df3_000A
"Which of the following was the first name of U.S. presidential wife Mrs. Roosevelt?",PEOPLE_3aad_0619,Eleanor,PEOPLE_OPT_dbb3_000B
"What was the last name of the U.S. presidential couple Gerry and Betty?",PEOPLE_e437_0620,"The Fords",PEOPLE_OPT_8596_000C
"Harry and Bess were the members of which U.S. presidential family?",PEOPLE_b30d_0621,"The Trumans",PEOPLE_OPT_43bc_000A
"Who was U.S. FIrst Lady Lady Birds husband?",PEOPLE_028e_0622,"Lyndon Johnson",PEOPLE_OPT_f5d7_000C
"Where does Iraq rank in the worlds supply of oil?",PEOPLE_2193_0623,Second,PEOPLE_OPT_bef8_000D
"Saddam Hussein, President of Iraq from 1979 until his removal and capture by the United States in 2003, was officially born on what date?",PEOPLE_c651_0624,"April 28, 1937",PEOPLE_OPT_e6c4_000D
"Saddam Hussein married Sajida Talfah in 1958.  How were they related before the marriage?",PEOPLE_72b4_0625,"She was his cousin",PEOPLE_OPT_fef6_000B
"Why did Saddam Hussein leave Iraq in 1959?",PEOPLE_cc6a_0626,"He was involved in a failed attempt to overthrow the government.",PEOPLE_OPT_a146_000A
"Which of these statements most accurately describes how Saddam Hussein come to power?",PEOPLE_0721_0627,"Saddam compelled the ailing al-Bakr to resign",PEOPLE_OPT_5b26_000B
"What is Saddam Husseins religion?",PEOPLE_36d8_0628,"Sunni Muslim",PEOPLE_OPT_1013_000A
"In which direction do the Tigris and Euphrates Rivers flow?",PEOPLE_1f35_0629,"Northwest to Southeast",PEOPLE_OPT_3962_000B
"Project Babylon was Iraqs attempt to do what?",PEOPLE_750d_0630,"Build a supergun",PEOPLE_OPT_14bd_000D
"The first Iraqi nuclear reactor was named this by the French, after the Egyptian God of the dead.",PEOPLE_183f_0631,Osiraq,PEOPLE_OPT_3751_000D
"What did Operation Opera aim at destroying?",PEOPLE_a0a2_0632,"An Iraqi atomic reactor",PEOPLE_OPT_9dbf_000C
"Vincent Lombardi stated that, Opportunity dances with those who are already on the dance floor.",PEOPLE_b949_0633,False,PEOPLE_OPT_f3af_000B
"The following statement was made by which famous basketball player: What counts is not necessarily the size of the dog in the fight ‚Äì it‚Äôs the size of the fight in the dog?",PEOPLE_ec7e_0634,"Greg Anderson",PEOPLE_OPT_03fb_000A
"Who said: Dont be afraid to take a  big step if one is indicated: You cant cross a chasm in two small jumps.?",PEOPLE_014f_0635,"David Lloyd George",PEOPLE_OPT_87dd_000B
"Which genius stated that, Insanity is doing the same thing over and over again and expecting a different result?",PEOPLE_f4b0_0636,"Albert Einstein",PEOPLE_OPT_a2ea_000A
"Did Plato state that, The first and best victory is to conquer self?",PEOPLE_212a_0637,Yes,PEOPLE_OPT_0390_000B
"Which NBA star made this statement: Sometimes a players greatest challenge is coming to grips with his/her role on the team.?",PEOPLE_4ef6_0638,"Scottie Pippen",PEOPLE_OPT_5358_000A
"George Halas said that the things which hurt instruct.",PEOPLE_85ad_0639,False,PEOPLE_OPT_77d2_000A
"What NBA coach stated that, You can only receive what you are willing to give?",PEOPLE_9019_0640,"Pat Riley",PEOPLE_OPT_bc80_000B
"Did basketball coach Bob Knight say: Learn to do things right and then do them right every time?",PEOPLE_536d_0641,Yes,PEOPLE_OPT_47c2_000A
"Which football coach said:  You carry on no matter what the obstacles are. You simply refuse to give up - and, when the going gets tough, you get tougher and you win.?",PEOPLE_3a81_0642,"Vince Lombardi",PEOPLE_OPT_6616_000D
"Is this a Chinese proverb: If  we dont change the direction were going, were likely to end up where were headed?",PEOPLE_226f_0643,Yes,PEOPLE_OPT_8df2_000B
"Who said that, Character cannot be developed in ease and quiet. Only through experience of trial and suffering can the soul be strengthened, ambition inspired, and success achieved.?",PEOPLE_e7cb_0644,"Helen Keller",PEOPLE_OPT_87ec_000D
"What was the name of Richard Nixons wife?",PEOPLE_b4ae_0645,Pat,PEOPLE_OPT_fbc9_000D
"The name of Richard Nixons famous dog was Checkers.",PEOPLE_a225_0646,True,PEOPLE_OPT_0719_000A
"Richard Nixon was raised in which of the following religions?",PEOPLE_fb1d_0647,Quaker,PEOPLE_OPT_a817_000A
"Richard Nixon served in the U.S. Army.",PEOPLE_674f_0648,False,PEOPLE_OPT_9ff2_000B
"Richard Nixon was not the first U.S. President to resign from office.",PEOPLE_09b4_0649,False,PEOPLE_OPT_e605_000B
"Former president George H. W. Bush was a member of the Nixon administration.",PEOPLE_d479_0650,True,PEOPLE_OPT_c821_000A
"Hes not a Priest or Deacon, but in court, this Atlanta Falcons defensive veteran has a real first name he can swear to.",PEOPLE_7eb1_0651,"Lawyer Milloy",PEOPLE_OPT_80d7_000D
"At 53, Muggsy Bogues was the smallest player in NBA history but he was big enough to outgrow his real given name, Moses.",PEOPLE_40c2_0652,False,PEOPLE_OPT_028d_000B
"Knute is perhaps the most famous name in college football but it was not Coach Rocknes real first name.",PEOPLE_1b1a_0653,False,PEOPLE_OPT_3849_000A
"Duke, Dizzy, Peewee,  Satchel, Whitey, Yogi: all of these famous baseball handles were nicknames, except for one, which was a given first name.",PEOPLE_fe04_0654,False,PEOPLE_OPT_8a00_000B
"What was the nickname of Byron White, the only professional football player ever appointed to the Supreme Court?",PEOPLE_2e21_0655,Whizzer,PEOPLE_OPT_a0ae_000D
"What was the real name of Connie Mack, the legendary manager of the Philadelphia As?",PEOPLE_2c51_0656,"Cornelius McGillicuddy",PEOPLE_OPT_bfa4_000D
"The three DiMaggio brothers, who played major league baseball at the same time, were actually born with which of the following names?",PEOPLE_81a9_0657,"Guiseppe, Dominic, Vincent",PEOPLE_OPT_9745_000C
"The Alous, with four family members in the MLB, may lineup as baseballs most impressive brood, but only one Alou boasts even the hint of a nickname. What is it?",PEOPLE_fb4b_0658,Matty,PEOPLE_OPT_d186_000C
"Which of the boxing champions below carried a name into the ring most different from his actual birth name?",PEOPLE_4784_0659,"Sugar Ray Robinson",PEOPLE_OPT_4d0a_000B
"Is it true that Pancho Segura and Pancho Gonzalez, who were both kings on the tennis court,  were christened with the same first name.",PEOPLE_1cc5_0660,No,PEOPLE_OPT_9e8c_000A
"Rather than be paraded through the streets of Rome, this queen chose to die from the bite of an asp.",PEOPLE_1a9b_0661,Cleopatra,PEOPLE_OPT_606b_000A
"Name the cult leader of the Peoples Temple who was responsible for the suicide/murder of over 900 members of the Peoples Temple on November 18th 1978.",PEOPLE_9c0a_0662,"Jim Jones",PEOPLE_OPT_a777_000A
"This former German journalist helped Andreas Baader escape imprisonment and formed the Red Army Fraction. What German terrorist and author of The Concept of the Urban Guerrilla hanged herself on May 9, 1976?",PEOPLE_5e31_0663,"Ulrike Meinhof",PEOPLE_OPT_6400_000C
"I feel certain that I am going mad again. I feel we cant go through another of those terrible times. What British author, played by Nicole Kidman, in The Hours, filled her pockets with stones and walked into a river near her home?",PEOPLE_cb48_0664,"Virgina Woolf",PEOPLE_OPT_082d_000A
"Sigmund Freud, the Father of Psychoanalysis, committed suicide on September 23, 1939.",PEOPLE_fd50_0665,True,PEOPLE_OPT_1d81_000B
"This authors novel The Bell Jar was based on her own mental breakdown while a student at Smith. What author of Ariel and Winter Trees, killed herself by placing her head in a gas oven?",PEOPLE_c18f_0666,"Sylvia Plath",PEOPLE_OPT_c439_000A
"Razors pain you; Rivers are damp; Acids stains you; And drugs cause cramps; Guns arent lawful; Nooses give; Gas smells awful; You might as well live. Who wrote the poem?",PEOPLE_2bd4_0667,"Dorothy Parker",PEOPLE_OPT_4656_000C
"On September 11, 2001 Flight # 93 had forty crew members and passengers whose brave actions saved America from one more unspeakable terror on that day of horror. Lisa Jefferson, a customer representative, was on the telephone with one of the passengers and reported his comments as the passengers tried to take back the plane. Whose cry of Lets roll became a rallying cry for the nation?",PEOPLE_3123_0668,"Todd Beamer",PEOPLE_OPT_d1e6_000D
"On September 11, 2001 according to U.S. Today 3,949 planes were in the air space over the United States when, for the first time in United States history, all air traffic was stopped. Though often overlooked, air controllers brought the planes and passengers down safely to the nearest airport. How long did it take for the air controllers to get everyone safely on the ground?",PEOPLE_0a39_0669,"About three hours",PEOPLE_OPT_b4a9_000C
"Nicknamed The Splendid Splinter, this Hall of Fame baseball player interrupted his career twice to serve in World War II and the Korean War.",PEOPLE_ae53_0670,"Ted Williams",PEOPLE_OPT_84b7_000A
"Stepping in to head The Washington Post after the death of her husband, this lady took her fight to publish the Pentagon Papers all the way to the United States Supreme Court. But it was her backing of two unknown reporters, Carl Bernstein and Bob Woodward, that helped change the course of American history. Who was Attorney General John Mitchell referring to when he said to tell her she was gonna get her *** caught in a big fat wringer if thats published?",PEOPLE_4291_0671,"Katherine Graham",PEOPLE_OPT_3641_000D
"On October 20, 1973 in an effort to keep the Watergate tapes from the office of Special Prosecutor, Archibald Cox, President Richard Nixon ordered his  Attorney General to fire Archibald Cox. What was the name of the Attorney General who resigned rather than break his word to congress that the White House would not interfere with the investigation?",PEOPLE_f1e3_0672,"Elliot Richardson",PEOPLE_OPT_bc60_000A
"I felt a determination cover my body like a quilt in winter , is how this lady described her feelings when she confronted bus driver James Blake. She was later called Mother of the Civil Rights Movement.",PEOPLE_89ac_0673,"Rosa Parks",PEOPLE_OPT_af7b_000D
"The engineer of engine # 382 was trying to make up 95 minutes of lost time when he rounded an s-curve to find four cars of  a passenger train stalled on the track. Shouting at the fireman to jump, the engineer began to brake the train. What is the name of the engineer who rode engine # 382 to his death in order to save the passengers on the stalled train?",PEOPLE_338f_0674,"Casey Jones",PEOPLE_OPT_1f48_000B
"Who was the 8th President of the United States?",PEOPLE_7bd2_0675,"Martin Van Buren",PEOPLE_OPT_6b40_000C
"James Buchanan was a Republican.",PEOPLE_8ed0_0676,False,PEOPLE_OPT_a749_000A
"Which of the following U.S. presidents was not assassinated while in office?",PEOPLE_3e9c_0677,"Franklin D. Roosevelt",PEOPLE_OPT_6b4d_000D
"George W. Bush became the 42nd President of the United States.",PEOPLE_98b4_0678,False,PEOPLE_OPT_e2d8_000A
"The 37th U.S. President, Richard Nixon was impeached due to the Watergate scandal.",PEOPLE_6aef_0679,False,PEOPLE_OPT_bdb1_000B
"Lyndon B. Johnson, who served as vice-president under John F. Kennedy, was sworn into office the day after President Kennedy was shot.",PEOPLE_caff_0680,False,PEOPLE_OPT_fe30_000A
"Which of these U.S. presidents was in office less than 1 year?",PEOPLE_847d_0681,"William Henry Harrison",PEOPLE_OPT_72ef_000D
"How many terms can a U.S. president serve?",PEOPLE_12a7_0682,2,PEOPLE_OPT_efb8_000A
"Who served as the 23rd President of the United States?",PEOPLE_629d_0683,"Benjamin Harrison",PEOPLE_OPT_4c0c_000A
"Who was the first U.S. president to serve over 12 years?",PEOPLE_d478_0684,"Franklin D. Roosevelt",PEOPLE_OPT_265d_000B
"Who was the father of Nicholas II of Russia?",PEOPLE_767a_0685,"Tsar Alexander III",PEOPLE_OPT_9c50_000C
"Empress Alexandra Fyodorovna was from which country?",PEOPLE_a943_0686,Germany,PEOPLE_OPT_d482_000B
"Both Nicholas II and Alexandra Fyodorovna were first cousins of King George V of England.",PEOPLE_ea37_0687,True,PEOPLE_OPT_5345_000B
"How many children did Nicholas II and his wife Alexandra have?",PEOPLE_4a52_0688,5,PEOPLE_OPT_4fa4_000B
"What language did Nicholas II and Alexandra Fyodorovna use in private conversation?",PEOPLE_0205_0689,English,PEOPLE_OPT_a925_000B
"Nicholas II actually became Tsar of Russia before he married Alexandra.",PEOPLE_625a_0690,True,PEOPLE_OPT_e0bb_000A
"When Nicholas abdicated the throne in 1917, he also abdicated for his heir, Alexis.",PEOPLE_c793_0691,True,PEOPLE_OPT_0915_000B
"Alexandra Fyodorovnas sister was married to Nicholas IIs brother.",PEOPLE_1e66_0692,False,PEOPLE_OPT_2d3b_000B
"Who portrayed Rocky Balboa in the Rocky films?",PEOPLE_5a3d_0693,"Sylvester Stallone",PEOPLE_OPT_1fb1_000B
"Who played Dr. Frank N. Furter in the comedy-horror musical film The Rocky Horror Picture Show?",PEOPLE_f936_0694,"Tim Curry",PEOPLE_OPT_9574_000C
"What is the highest peak of the Rocky Mountains?",PEOPLE_c8f6_0695,"Mount Elbert",PEOPLE_OPT_f804_000A
"This Rocky was killed in a plane crash on August 31, 1969.",PEOPLE_fb26_0696,"Rocky Marciano",PEOPLE_OPT_ff3a_000D
"What are Rocky Mountain oysters?",PEOPLE_6058_0697,"Bull testicles",PEOPLE_OPT_4f48_000C
"Rocky Johnson, a former Canadian professional wrestler, is the father of what actor and former wrestler?",PEOPLE_0af7_0698,"The Rock",PEOPLE_OPT_eede_000C
"Rocky Top is the official song of what US state?",PEOPLE_f16c_0699,Tennessee,PEOPLE_OPT_ce1b_000A
"Which Rocky was a former fullback for the Pittsburgh Steelers?",PEOPLE_a858_0700,"Rocky Bleier",PEOPLE_OPT_dc9e_000B
"Rocky Road ice cream is traditionally composed of chocolate ice cream, nuts and what else?",PEOPLE_cdee_0701,Marshmallows,PEOPLE_OPT_bf32_000D
"The following citation is taken from this novel of F. Scott Fitzgerald. He wanted not association with glittering things and glittering people ‚Äî he wanted the glittering things themselves.",PEOPLE_0893_0702,"The Great Gatsby",PEOPLE_OPT_1904_000B
"Winfield Scott was a United States lieutenant general, diplomat, and presidential candidate. In the 1852 presidential election, Scott was the unsuccessful Whig Party candidate, losing to this Democrat.",PEOPLE_fab5_0703,"Franklin Pierce",PEOPLE_OPT_d33c_000A
"One of the following statements concerning the life and personality of Sir Walter Scott is wrong.",PEOPLE_b7af_0704,"All of these statements are actually true.",PEOPLE_OPT_e3d5_000A
"Just one of these could be the work of George Gilbert Scott.",PEOPLE_f0e4_0705,Church,PEOPLE_OPT_6699_000B
"Jason Scott Lee is an Asian American movie actor. He starred in all these movies except one.",PEOPLE_d3a1_0706,"Ride the High Country",PEOPLE_OPT_6e19_000C
"Francis Scott Key was an American lawyer and amateur poet. One of his poems was added to already existing music, and the combination was adopted as the American national anthem in 1931. This is the name of the above-mentioned poem.",PEOPLE_7154_0707,"The Defence of Fort MHenry",PEOPLE_OPT_3a14_000B
"This Tracy, who won two Academy Awards, portrayed Captain Culpepper, Henry Drummond, Richard Sumner and Stanley Banks.",PEOPLE_3596_0708,"Spencer Tracy",PEOPLE_OPT_a8f4_000D
"This comedienne, named Tracey, hosted a weekly television variety show  which ended with the catchphrase Go Home.",PEOPLE_d6b7_0709,"Tracey Ullman",PEOPLE_OPT_ec69_000D
"This actress, known for her performance in the TV series The Avengers, portrayed Tracy Bond in Her Majestys Secret Service.",PEOPLE_f107_0710,"Diana Rigg",PEOPLE_OPT_71d0_000B
"This Tracy, who was a cast member of Saturday Night Live, played recurring characters such as Dominican Lou, Mrs. Parker, Reggie Owens, Captain Munclair Vanderhousen III, and Tate Witherspoon.",PEOPLE_d5e4_0711,"Tracy Morgan",PEOPLE_OPT_12d3_000C
"Tracey E. Bergman played in which soap opera set in Genoa City, Wisconsin?",PEOPLE_17ec_0712,"The Young and the Restless",PEOPLE_OPT_0116_000B
"Fast Car, Talkin Bout a Revolution, Baby Can I Hold You, and Give Me One Reason are some of the songs by this Tracy.",PEOPLE_e2f1_0713,"Tracy Chapman",PEOPLE_OPT_7da9_000C
"This cartoonist, famous for his colourful villains, is the creator of the comic strip detective Dick Tracy.",PEOPLE_a893_0714,"Chester Gould",PEOPLE_OPT_09d0_000C
"This Tracy is the screenwriter and producer of such works as Saturday Night Live, Odyssey 5, Star Trek: The Next Generation and Fire in the Sky.",PEOPLE_67cd_0715,"Tracy Torme",PEOPLE_OPT_699c_000C
"On the ABC sitcom Growing Pains, actress Tracey Gold portrayed which character?",PEOPLE_950c_0716,"Carol Seaver",PEOPLE_OPT_0144_000A
"Who portrayed the wealthy Philadelphian socialite Tracy Lord in the 1940 movie The Philadelphia Story?",PEOPLE_d422_0717,"Katharine Hepburn",PEOPLE_OPT_ba9e_000D
"What does the female name Aba mean?",PEOPLE_debd_0718,"Born on a Thursday",PEOPLE_OPT_f1e6_000D
"What is the meaning of the name Amy according to popular beliefs?",PEOPLE_f64c_0719,Beloved,PEOPLE_OPT_3a4d_000C
"What is the meaning of the French female name Ariane?",PEOPLE_669d_0720,Holy,PEOPLE_OPT_b305_000C
"What does the female name Aisha mean?",PEOPLE_8df7_0721,Alive,PEOPLE_OPT_5ce4_000C
"What is the meaning of the name Barbara according to traditional beliefs?",PEOPLE_e512_0722,Strange,PEOPLE_OPT_baa2_000A
"What is the meaning of the name Jessica?",PEOPLE_d300_0723,"Gods grace",PEOPLE_OPT_2be9_000D
"What does the Cornish name Kerensa mean?",PEOPLE_a1bf_0724,"Love and peace",PEOPLE_OPT_96c9_000A
"What does the Hawaiian female name Malia mean ?",PEOPLE_e51c_0725,"Calm and peaceful",PEOPLE_OPT_df43_000C
"The surname Eriksson is in the top 5 of the most common names in which European country?",PEOPLE_2cdd_0726,Sweden,PEOPLE_OPT_a83d_000D
"Of what origin is the popular surname OBrien?",PEOPLE_2d89_0727,Irish,PEOPLE_OPT_5b18_000C
"According to the 2007 statistics of the Canadian Broadcasting Corporation, what is the most common surname in Canada?",PEOPLE_898e_0728,Li,PEOPLE_OPT_2a02_000B
"Which of the following surnames is not of German origin?",PEOPLE_8722_0729,Roux,PEOPLE_OPT_ae81_000D
"Cohen is the most common and respected Jewish surname of biblical origins borne by 2.52% of people in Israel. But being a Cohen has some disadvantages. Which of the following are people bearing this name forbidden by Jewish religious law?",PEOPLE_f642_0730,"To marry a divorced woman",PEOPLE_OPT_2562_000D
"Novak (Nowak) is a popular surname in which of the following countries?",PEOPLE_6f04_0731,"All of these",PEOPLE_OPT_ef0c_000C
"Identify the line that contains only surnames typical for the Spanish-speaking countries.",PEOPLE_12bc_0732,"Mart√≠nez, Alonso, Lopez, Gil, Morales",PEOPLE_OPT_9608_000B
"Of what origin is the surname Kerr?",PEOPLE_9c65_0733,Scottish,PEOPLE_OPT_7c43_000D
"If your surname was De Jong, your home country would most probably be this one.",PEOPLE_ea7f_0734,"The Netherlands",PEOPLE_OPT_a640_000A
"Which of these is the most widespread surname in the world by number of people bearing it?",PEOPLE_4a13_0735,Li,PEOPLE_OPT_6c7c_000D
"Who were Princess Dianas parents?",PEOPLE_e521_0736,"The Viscount and Viscountess Althorp",PEOPLE_OPT_9502_000B
