question,QID,answer,answer_OID
"Saint Brigitta was a Swedish nun and founder of the Bridgettine Order.",RELIGION_a114_0523,True,RELIGION_OPT_396d_000B
"Nicknamed Black Angel, he was a prominent commander in the Chechen separatist movement against Russia.",RELIGION_34de_0524,"Ruslan Gelayev",RELIGION_OPT_8ef9_000B
"His name means King of Kings and he ruled the Malian Empire for over twenty years.",RELIGION_d01c_0525,"Mansa Musa",RELIGION_OPT_ac6c_000A
"What statement is true about Saint Godric of Finchale?",RELIGION_5de3_0526,"Both of these",RELIGION_OPT_45ee_000D
"He was an African-American Muslim minister and an advocate for the rights of African Americans.",RELIGION_4a6e_0527,"Malcolm X",RELIGION_OPT_75c7_000B
"James, one of the Twelve Apostles of Jesus, was known by which of these names?",RELIGION_b0b4_0528,"All of these",RELIGION_OPT_ab76_000A
"Junichiro Koizumi is a politician who served as Prime Minister of Japan.",RELIGION_602b_0529,True,RELIGION_OPT_f3b0_000B
"He was a Supreme Pontiff of the Roman Catholic Church and Sovereign of Vatican City from 1978 until his death in 2005.",RELIGION_d866_0530,"Pope John Paul II",RELIGION_OPT_4d6d_000B
"Margery Kempe was an English religious mystic whose autobiography is one of the earliest in English literature.",RELIGION_8c63_0531,True,RELIGION_OPT_8077_000A
"This Spanish knight founded the Society of Jesus in 1534.",RELIGION_8f4c_0532,"Ignatius of Loyola",RELIGION_OPT_cee9_000B
"He wrote the third Gospel and the Acts of the Apostles.",RELIGION_e221_0533,"Luke the Evangelist",RELIGION_OPT_f858_000A
"He was a Christian saint from Egypt and a prominent leader among the Desert Fathers.",RELIGION_21c4_0534,"Anthony the Great",RELIGION_OPT_b1a6_000B
"What statement is true about Ignatius Loyola, a Spanish knight from a Basque noble family?",RELIGION_4f29_0535,"All of these",RELIGION_OPT_82ae_000D
"St Anicetus was the first Roman Bishop to forbid Montanism.",RELIGION_d620_0536,True,RELIGION_OPT_ed3c_000B
"Leo IX launched a dispute regarding celibacy of the clergy.",RELIGION_9d92_0537,True,RELIGION_OPT_c14f_000B
"Mary Faustina Kowalska was a Russian nun and mystic, venerated by the Roman Catholic Church as a saint.",RELIGION_1916_0538,False,RELIGION_OPT_28fe_000B
"According to Christian tradition, this saint attached a silver hand to the icon of Theotokos, which has since then been known as Three-handed?",RELIGION_5249_0539,"John of Damascus",RELIGION_OPT_6ac0_000C
"Vladimir the Great converted to Christianity and baptised all of Kievan Rus.",RELIGION_1905_0540,True,RELIGION_OPT_95af_000B
"Saint Stephen is often depicted with a crown for martyrdom.",RELIGION_b623_0541,True,RELIGION_OPT_5147_000A
"Saint Helena was Roman empress and the mother of Emperor Constantine the Great.",RELIGION_15dd_0542,True,RELIGION_OPT_773a_000B
"What is the earliest identified Christian house church?",RELIGION_f8da_0543,"Dura-Europos church",RELIGION_OPT_a3d6_000A
"Megiddo church, one of the oldest church buildings discovered by archaeologists, is located in Israel.",RELIGION_bbfa_0544,True,RELIGION_OPT_69e0_000A
"This Coptic Orthodox monastery is located in an oasis in the Eastern Desert of Egypt.",RELIGION_8cb4_0545,"St. Anthony Monastery",RELIGION_OPT_48bf_000B
"Which statement is true about Saint-Pierre-aux-Nonnains basilica in Metz, France?",RELIGION_c538_0546,"All of these",RELIGION_OPT_eb6e_000D
"The Church of Our Lady Mary of Zion is an Ethiopian Orthodox Church.",RELIGION_84ef_0547,True,RELIGION_OPT_2701_000B
"What is the oldest cathedral in Germany?",RELIGION_3f07_0548,"Cathedral of Trier",RELIGION_OPT_8529_000B
"The Church of Saint Simeon Stylites is located in Syria.",RELIGION_1b0c_0549,True,RELIGION_OPT_fbc1_000A
"Which of these churches was designed by Isidore of Miletus and Anthemius of Tralles, who were professors of geometry at the University of Constantinople?",RELIGION_9aac_0550,"Hagia Sophia",RELIGION_OPT_3a98_000D
"Which monastery lies at the foot of Mount Sinai, where, according to the Hebrew Bible, Moses received the Ten Commandments from God?",RELIGION_a7ee_0551,"Saint Catherine’s Monastery",RELIGION_OPT_3ba6_000D
"What church was built over the cave that tradition marks as the birthplace of Jesus of Nazareth?",RELIGION_c6e2_0552,"Church of the Nativity, Bethlehem",RELIGION_OPT_5d42_000C
"Emanuel Swedenborg is a Dutch scientist, philosopher, mystic and theologian.",RELIGION_f970_0553,False,RELIGION_OPT_6e17_000B
"What did Emanuel Swedenborg claim?",RELIGION_2586_0554,"all of these",RELIGION_OPT_18c0_000A
"Emanuel Swedenborg claimed that he could talk with angels, demons and other spirits.",RELIGION_03c1_0555,True,RELIGION_OPT_d563_000B
"What prominent Swedish author called Emanuel Swedenborg nothing but a fool?",RELIGION_9061_0556,"Johan Henrik Kellgren",RELIGION_OPT_1b9e_000D
"In 1710, Emanuel Swedenborg made a grand tour through the Netherlands, France, and Germany.",RELIGION_3303_0557,True,RELIGION_OPT_2f18_000A
"Emanuel Swedenborg lived in the 19th century.",RELIGION_495b_0558,False,RELIGION_OPT_6717_000A
"Emanuel Swedenborg supported the Christian doctrine of the Trinity.",RELIGION_a05f_0559,False,RELIGION_OPT_991b_000A
"Which of these is a work by Emanuel Swedenborg?",RELIGION_93df_0560,"All of these",RELIGION_OPT_9737_000B
"What happened in April 1745, when Emanuel Swedenborg was having dinner in a private room at a London tavern.",RELIGION_9b15_0561,"All of these",RELIGION_OPT_931a_000C
"How many saints are recognized in Judaism ?",RELIGION_79aa_0562,0,RELIGION_OPT_a6e0_000D
"The first five books of the Old Testament are referred to as what?",RELIGION_79fa_0563,"The Torah",RELIGION_OPT_1036_000A
"In Judaism, who is considered to be the first Jew ?",RELIGION_12aa_0564,Abraham,RELIGION_OPT_527d_000A
"Why is the city of Hebron so important to Judaism ?",RELIGION_b4f4_0565,"It is believed that Abraham, Sarah, Issac, Rebekkah, Leah and Jacob are buried there",RELIGION_OPT_a2cb_000B
"In the context of Judaism, who was Abrahams wife ?",RELIGION_fac6_0566,Sarah,RELIGION_OPT_ab98_000C
"How many laws are in the first five books of the Old Testament?",RELIGION_f216_0567,613,RELIGION_OPT_cfbb_000C
"Why will Jews not eat pork?",RELIGION_e861_0568,"Pigs do not chew their cud and they do not have cloven hoofs",RELIGION_OPT_71c0_000C
"In Judaism, what do we call food that is permissible to be eaten?",RELIGION_d3cc_0569,Kosher,RELIGION_OPT_00d1_000B
"According to Judaism, what work is permissible on Sunday?",RELIGION_596b_0570,"Any work",RELIGION_OPT_d8ad_000D
"What does the word Rabbi mean?",RELIGION_1074_0571,"My teacher",RELIGION_OPT_0e3d_000D
"The witch hunts started as a result of the superstitions of some Catholic Monks. This Dominican monk is considered to be the initiator of the witch hunts as he prepared a detailed manual of deviltry for the Church.  It did not take long before women in Southern France were sent to the stake, condemned for cohabitation with the devil.",RELIGION_7950_0572,"Thomas Aquinas",RELIGION_OPT_5edc_000A
"The first woman accused of witchcraft was burned around 1275. This was the reason for her condemnation.",RELIGION_a877_0573,"Having intercourse with the devil",RELIGION_OPT_4585_000D
"Many of witchcraft confessions were extorted by means of torture, called ordeal. This method of torture was not used during the process of the ordeal.",RELIGION_0a10_0574,"The sound of trickling water",RELIGION_OPT_cd18_000C
"Burning women who were supposedly witches was a common practice on the European continent. In England, however, they punished witches in this way.",RELIGION_0cc4_0575,"Hanged them",RELIGION_OPT_cc4c_000B
"Most of the victims of the witch hunts were women. However, there were some men also burned, accused of being witches. This is why.",RELIGION_7981_0576,"They tried to protect women accused of witchcraft",RELIGION_OPT_08ba_000C
"As the witch hunts expanded, any woman could be tried as a witch, but in the beginning these were the most common victims of the Holy Inquisition.",RELIGION_65e4_0577,"Old, lonely women",RELIGION_OPT_85a9_000C
"It was a common conception that the number of people involved in the witchcraft activities could be boundless. For example, in 1609 the witch hunting French official Pierre de Lancre stated that all 30,000 dwellers of the French region Labourd were witches, including  these people.",RELIGION_bc23_0578,Priests,RELIGION_OPT_079e_000C
"The famous Salem Witch trial started with an incident in January, 1692. A Caribbean-born slave was accused of initiating the witch phenomenon. Twenty more people were killed as no one of them confessed to being a witch. What was the reason that triggered the Salem witch craze?",RELIGION_d82d_0579,"Eight little girls from the town got ill with strange symptoms such as convulsions, incomprehensible speech, and trance-like states",RELIGION_OPT_838f_000D
"This was a common torture method used in Scotland, which made the accused witch confess her deeds. The method caused hallucinations and made it easy for the inquisitors to extort confessions to flying, turning into animals, meeting the devil and taking part in witches’ Sabbaths.",RELIGION_2133_0580,"Sleep deprivation",RELIGION_OPT_119b_000C
"Witch hunts still exist today. In 1981 a woman was killed by the mob, throwing stones at her as they believed she was a witch. This was the reason for stoning her to death.",RELIGION_2106_0581,"Her sorcery incited the attack upon Pope John Paul II",RELIGION_OPT_d595_000A
"According to the Old Testament, the prophet Hosea was instructed by God to marry a prostitute.",RELIGION_c0b2_0582,True,RELIGION_OPT_50c0_000B
"Psalm 119 is the longest psalm in the Bible. How many verses does it contain?",RELIGION_0676_0583,176,RELIGION_OPT_9ab0_000A
"According to the Old Testament, Moses was 105 years old when he died.",RELIGION_fb3f_0584,False,RELIGION_OPT_e886_000B
"It is stated in the Old Testament that Jeremiah, Hosea, Jonah, and Job were prophets.",RELIGION_c16a_0585,False,RELIGION_OPT_12e1_000A
"According to The Old Testament, the prophet Jonah was sent to which city to warn its inhabitants of the coming judgment on them?",RELIGION_54f9_0586,Ninevah,RELIGION_OPT_a47f_000A
"The prophet Haggai is mentioned in the book of Ezra.",RELIGION_2f29_0587,True,RELIGION_OPT_990f_000A
"According to the Book of Genesis, what did G-D  create last, on the sixth day, as almost an afterthought?",RELIGION_005c_0588,Adam,RELIGION_OPT_bb25_000B
"What was the name of Abrahams first wife?",RELIGION_b5b2_0589,Sarah,RELIGION_OPT_dd65_000A
"Who was Issacs wife according to Genesis?",RELIGION_8e11_0590,Rebecca,RELIGION_OPT_1498_000B
"Judaism has three  Patriarchs -Abraham, Issac, and Jacob. Who are the four Matriarchs?",RELIGION_c615_0591,"Sarah, Rebecca, Leah, Rachel",RELIGION_OPT_a024_000C
"Which of these is not one of Jacobs twelve sons?",RELIGION_cbe4_0592,Ephraim,RELIGION_OPT_bbc8_000C
"What is the name of Jacobs only daughter according to Genesis?",RELIGION_a158_0593,Dina,RELIGION_OPT_3b7d_000A
"The  Book of Genesis contains the first Biblical reference to someone being put into prison. Who was  put into prison?",RELIGION_5cfa_0594,Joseph,RELIGION_OPT_82b6_000D
"Who was the third son of Adam and Eve, sometimes described as the quiet one?",RELIGION_790b_0595,Seth,RELIGION_OPT_452d_000A
"The Hebrew people lived in the first ghetto when they were in Egypt. Where was this place?",RELIGION_6680_0596,Goshen,RELIGION_OPT_ddf4_000D
"According to the genealogy of Jesus, who was the father of Jesse?",RELIGION_2dd1_0597,Obed,RELIGION_OPT_037c_000B
"In which of the following lands did Job live when he was first mentioned in the book of Job?",RELIGION_d312_0598,Uz,RELIGION_OPT_2a10_000B
"Who was king of Judaea during the birth of Jesus?",RELIGION_0bf8_0599,"King Herod",RELIGION_OPT_e9f2_000C
"According to the Bible, how old was Joseph when he was put in charge of the whole land of Egypt, as Pharaoh had ordered.",RELIGION_65ee_0600,"30 years old",RELIGION_OPT_aacd_000B
"According to the Bible after Sarahs death, Abraham married another woman. What was her name?",RELIGION_8ac6_0601,Keturah,RELIGION_OPT_4942_000A
"From what tribe of Israel was Samson according to the Bible?",RELIGION_ee27_0602,Dan,RELIGION_OPT_3bbf_000C
"This Biblical character is Jacobs father-in-law as well as father of Rachel and Leah.",RELIGION_beab_0603,Laban,RELIGION_OPT_8d63_000A
"Which is the sixth book of the New Testament?",RELIGION_55e9_0604,Romans,RELIGION_OPT_1f02_000B
"According to the Bible, when Naomi told her two daughters-in-law to leave her and go to their homes, which daughter-in-law decided to stay?",RELIGION_505c_0605,Ruth,RELIGION_OPT_612a_000D
"Which of the following did Jesus call first to be his disciple?",RELIGION_a2e4_0606,Simon,RELIGION_OPT_5762_000C
"What kind of person may you call Judas?",RELIGION_aaf1_0607,"A friend who betrayed you",RELIGION_OPT_88ca_000C
"Which of the following events can be referred to as an Armageddon?",RELIGION_a928_0608,"The last and completely destructive battle",RELIGION_OPT_287a_000D
"Which use of Goliath is correct?",RELIGION_2d80_0609,"The local grocery successfully competed against the nearby Goliath supermaket",RELIGION_OPT_45c9_000C
"How would you describe a Samaritan?",RELIGION_b22f_0610,"A person who helps people in need",RELIGION_OPT_8af0_000A
"Who is the salt of the earth?",RELIGION_5ce9_0611,"Decent, reliable people",RELIGION_OPT_aad8_000B
"Who can be best described as doubting Thomas?",RELIGION_00ef_0612,"Someone who believes only what he sees",RELIGION_OPT_4d9a_000A
"Which of the following can be described as a prodigal son?",RELIGION_ccac_0613,"A young man who wastes his parents money on parties",RELIGION_OPT_f842_000B
"What does the sentence Ann was the apple of Marks eye tell us about the relation between those two?",RELIGION_5b07_0614,"Mark is deeply in love with Ann.",RELIGION_OPT_fd87_000B
"What characteristic is commonly attributed to King Solomon?",RELIGION_d95b_0615,Wisdom,RELIGION_OPT_9561_000D
"What message am I conveying, if I say I dont know him from Adam?",RELIGION_4d5e_0616,"The person is completely unknown to me.",RELIGION_OPT_032e_000C
"What does the phrase of biblical proportions mean?",RELIGION_7643_0617,"of a vast, enormous scale",RELIGION_OPT_4984_000A
"If John knows Mary in the biblical sense, what can we say about the pair?",RELIGION_bdbe_0618,"They have had sex.",RELIGION_OPT_474c_000B
"What Biblical character said the following? My petition and my request is this:If the king regards me with favor and if it pleases the king to grant my petition and fulfill my request, let the king and Haman come tomorrow to the banquet  I will prepare for them. Then I will answer the kings question.",RELIGION_41cc_0619,Esther,RELIGION_OPT_6511_000A
"The following words belong to this biblical figure: May the day of my birth perish, and the night it was said,A boy is born! That day-may it turn to darkness; may the God above not care about it; may no light shine upon it.",RELIGION_f1b5_0620,Job,RELIGION_OPT_a3cd_000D
"What Biblical hero delivered these words? Out of the eater, something to eat; out of the strong, something sweet.",RELIGION_81b8_0621,Samson,RELIGION_OPT_4052_000A
"What Biblical character asked the following question? Am I leading a rebellion, that you have come out with swords and clubs to capture me?",RELIGION_2f63_0622,Jesus,RELIGION_OPT_7a65_000C
"What character from the Bible said the following? Get rid of that slave woman and her son, for that slave womans son will never share in the inheritance with my son Isaac.",RELIGION_4d5d_0623,Sarah,RELIGION_OPT_c18b_000B
"Who said the following: It is not the healthy who need a doctor, but the sick. But go and learn what this means: I desire mercy, not sacrifice. For I have not come to call the righteous, but sinners.",RELIGION_9a74_0624,Jesus,RELIGION_OPT_b824_000B
"What Biblical figure said this? I am now an old man and dont know the day of my death. Now then, get your weapons-your quiver and bow-and go out to the open country to hunt some wild game for me. Prepare me the kind of tasty food I like and bring it to me to eat, so that I may give you my  blessing before I die.",RELIGION_6ef5_0625,Issac,RELIGION_OPT_20c6_000D
"Name the Biblical character who delivered these words: Pick me up and throw me into the sea, and it will become calm, I know that is is my fault that this great storm has come upon you.",RELIGION_9166_0626,Jonah,RELIGION_OPT_23cb_000D
"What character from the Bible said this? Lord dont you care that my sister has left me to do the work by myself? Tell her to help me!",RELIGION_e31e_0627,Martha,RELIGION_OPT_4666_000B
"Who delivered these words: Suppose I go to the Israelites and say to them, The God of your fathers has sent me to you, and they ask me, ‘What is his name? Then what shall I tell them?",RELIGION_eb9f_0628,Moses,RELIGION_OPT_1278_000C
"What is the symbol of the dhamma (dharma)?",RELIGION_ed19_0629,wheel,RELIGION_OPT_38d5_000B
"What Buddhist term refers to the cycle of reincarnation or rebirth?",RELIGION_6414_0630,Samsara,RELIGION_OPT_7c5c_000B
"What does the word buddha mean?",RELIGION_182d_0631,awake,RELIGION_OPT_d225_000D
"What is the path to happiness in Buddhism?",RELIGION_6aec_0632,"middle way",RELIGION_OPT_5a0f_000D
"According to Buddhism what are the3 evil roots/defilements that hide the truth from us?",RELIGION_5c1c_0633,"delusion, hatred, greed",RELIGION_OPT_55a2_000D
"In Buddhism which of these beings inhabit Hells?",RELIGION_f488_0634,"Naraka beings",RELIGION_OPT_3bcc_000C
"According to Buddhism, life is or leads to suffering in one way or another.",RELIGION_9376_0635,True,RELIGION_OPT_f9b3_000B
"It is generally accepted that the last words of the Buddha were: All component things are transient, work out your salvation with diligence.",RELIGION_babc_0636,True,RELIGION_OPT_be1c_000A
"Kamma is only one of the 5 natural laws that Buddha spoke about.",RELIGION_8547_0637,True,RELIGION_OPT_46e6_000B
"According to Buddhism there are realms of existences other than human and animal realm.",RELIGION_3fc0_0638,True,RELIGION_OPT_43c7_000A
