question,QID,answer,answer_OID
"Son of a Jewish immigrant from Breslau, Prussia, Lucius Nathan Littauer was born in Gloversville, Upstate New York, in 1859. Being a politician wasnt his only occupation; what is Lucius Littauers other achievement with which he remained in history?",RELIGION_4068_0161,"The first Jewish football coach at Harvard",RELIGION_OPT_3e22_000C
"Julius Vogel, a London born Jew, who first became involved in politics in 1862, was the first Jew to be on this political post.",RELIGION_ecb6_0162,"Prime Minister of New Zealand",RELIGION_OPT_582c_000C
"During the 1968 presidential campaign, Rabbi Baruch Korff developed a personal relationship with this American president, who even referred to Korff as My Rabbi.",RELIGION_296c_0163,"Richard Nixon",RELIGION_OPT_6cad_000C
"In 1927 Charles A. Levine was the first Jew to do what?",RELIGION_cec4_0164,"Fly the Atlantic",RELIGION_OPT_253c_000A
"In what business did John M. Brunswick and his two half brothers, David and Emmanuel, make their fortune?",RELIGION_ff75_0165,"Billiard table business",RELIGION_OPT_ea93_000C
"The music for Somewhere Over the Rainbow, one of the most famous and beloved songs of the late 1930s, was based on a Jewish Cantorial theme.",RELIGION_74c2_0166,True,RELIGION_OPT_1c9d_000A
"Isachar Zacharie, an English born Jew, who was related to important American politicians, worked as what?",RELIGION_1620_0167,"Lincolns podiatrist",RELIGION_OPT_b113_000A
"Why was Rabbi David Einhorn, a German rabbi and later leader of the Jewish reform movement in the United States, forced to leave Baltimore in 1861, during the Civil War?",RELIGION_fdde_0168,"He preached against slavery",RELIGION_OPT_1491_000D
"A famous and talented composer was almost bankrupt when he wrote one of his best-known works, Judas Maccabaeus - an oratorio based on a Jewish theme. Who was this classical composer?",RELIGION_4936_0169,Handel,RELIGION_OPT_12e1_000B
"Marty Glickman and Sam Stoller were great 100-yard runners in the 1930s. They were to be on the 4x100 meter relay race team for the USA in the 1936 Olympics, but eventually did not take part in the race. What was the reason?",RELIGION_2e66_0170,"Hitler demanded their exclusion",RELIGION_OPT_ec70_000D
"Bodhisattva is consciously seeking what?",RELIGION_80ad_0171,Enlightenment,RELIGION_OPT_1f84_000B
"What is Dharma?",RELIGION_f11f_0172,"The cosmic principles of existence",RELIGION_OPT_cfec_000A
"Buddhist believe that this depends on the actions that we have taken in the past.",RELIGION_949c_0173,"Our births",RELIGION_OPT_cd22_000C
"In Buddhism the cycle of rebirths is known as what?",RELIGION_7e99_0174,Samsara,RELIGION_OPT_2186_000C
"Which saint is known as the patron of children?",RELIGION_3383_0175,Nicholas,RELIGION_OPT_29d3_000B
"Who is known as the patron of India?",RELIGION_92f0_0176,"Francis Xavier",RELIGION_OPT_3724_000A
"St. Benedict is known as the patron of which of these groups of people?",RELIGION_356a_0177,Monks,RELIGION_OPT_5783_000A
"Who was the first Italian-American woman to be canonized as a saint of the Catholic Church?",RELIGION_f10e_0178,"Frances Cabrini",RELIGION_OPT_dc81_000C
"Which saint is referred to as the patron of fishermen?",RELIGION_4c83_0179,"Andrew the Apostle",RELIGION_OPT_7c61_000A
"Which  saint is most often invoked for the recovery of a lost object?",RELIGION_f70d_0180,Anthony,RELIGION_OPT_e50e_000C
"Who used to be the patron saint of travelers?",RELIGION_b519_0181,"St. Christopher",RELIGION_OPT_1664_000B
"Which saint is the patron of all animals and living creatures?",RELIGION_7bd3_0182,"Francsis of Asissi",RELIGION_OPT_6cda_000A
"Who is the patron saint of writers and librarians?",RELIGION_39c6_0183,Jerome,RELIGION_OPT_e034_000A
"To which saint does one pray for healthy eyes?",RELIGION_7ad1_0184,"St. Lucy, Virgin",RELIGION_OPT_dbad_000B
"What is the Hindu Trinity?",RELIGION_85a6_0185,"Vishnu, Brahma, Shiva",RELIGION_OPT_c3b6_000C
"Hinduism is a monotheistic religion.",RELIGION_69ef_0186,False,RELIGION_OPT_7cb1_000B
"What is the most sacred river for Hindus?",RELIGION_4050_0187,Gange,RELIGION_OPT_5c3b_000B
"How many women-followers did the Hindu deity Lord Krishna have?",RELIGION_bbbd_0188,108,RELIGION_OPT_e970_000A
"What are the main characters of the ancient Sanskrit epic Ramayana?",RELIGION_4f52_0189,"Rama and Sita",RELIGION_OPT_e8ef_000C
"Who is the founder of the International Society for Krishna Consciousness, known as the Hare Krishna?",RELIGION_8f8a_0190,Prabhupada,RELIGION_OPT_d1d4_000A
"Lord Ganesh, one of the most worshipped divinities in Hinduism, has the head of what animal?",RELIGION_eae6_0191,elephant,RELIGION_OPT_534a_000D
"Which of these belonged to the highest-ranking Hindu caste?",RELIGION_f1b3_0192,priests,RELIGION_OPT_6d4e_000C
"Krishna is an incarnation of which Hindu god?",RELIGION_b946_0193,Vishnu,RELIGION_OPT_91d8_000A
"The Swastika is a solar symbol for Hindus.",RELIGION_7554_0194,True,RELIGION_OPT_9878_000B
"According to the Book of Esther, Esther replaced this disobedient Biblical queen.",RELIGION_71f0_0195,"Queen Vashti",RELIGION_OPT_bba5_000B
"This brave Biblical woman led the Israelites to victory in the battle against Sisera.",RELIGION_7c28_0196,Deborah,RELIGION_OPT_c154_000D
"According to the Bible, King David saw this beautiful woman bathing, and immediately desired her, but she was married.",RELIGION_549e_0197,Bathsheba,RELIGION_OPT_dbf9_000D
"This Biblical woman couldnt have children, but finally God granted her a son, who was to be named Samuel and become one of the Bibles most prolific prophets of all time.",RELIGION_d78a_0198,Hannah,RELIGION_OPT_7a7f_000A
"According to the New Testament, this woman had a son called John the Baptist.",RELIGION_0625_0199,Elizabeth,RELIGION_OPT_83a1_000B
"According to the Book of Exodus, this brave mother hid her young baby son, Moses, in a basket along the Nile River, so that no one could kill him.",RELIGION_ba11_0200,Jochebed,RELIGION_OPT_0ca6_000A
"This biblical heroine hid two Israelite spies in her house under stalks of flax.",RELIGION_8641_0201,Rehab,RELIGION_OPT_7248_000B
"In the Bible, this woman gave birth to male twins and as she was in labor the twins jostled each other, one babys hand grasping the heel of the other infants foot.",RELIGION_6adc_0202,Rebekah,RELIGION_OPT_5794_000B
"This Biblical woman poured perfume on Jesus feet and wiped them with her hair.",RELIGION_e46e_0203,Mary,RELIGION_OPT_583d_000A
"According to the Bible, this woman became a widow and decided to live with her mother-in-law instead of going home to her family. She then married Boaz.",RELIGION_ca3a_0204,Ruth,RELIGION_OPT_aba5_000A
"Which of these architects designed St. Peters Basilica in Rome?",RELIGION_3aa4_0205,"Carlo Marchionni",RELIGION_OPT_36fe_000A
"Raphael Santi was the original architect of the Chigi Chapel but Gian Bernini finished it, after Raphael became a father.",RELIGION_d01b_0206,False,RELIGION_OPT_55c2_000A
"St. Peters Basilica is both the Popes principal church and his official ecclesiastical seat.",RELIGION_889f_0207,False,RELIGION_OPT_c31f_000A
"The Temple of Vespasian was begun by Titus after whose death?",RELIGION_e064_0208,"his father, Vespasian",RELIGION_OPT_d0b1_000B
"Following Michelangelos death, his student, Giacomo della Porta continued with the unfinished portions of Palazzo Farnese.",RELIGION_e1c2_0209,True,RELIGION_OPT_cb63_000B
"Did Leonardo Da Vinci design the facade for the church of Santa Bibiana.",RELIGION_0e3f_0210,No,RELIGION_OPT_ac95_000A
"When Michelangelo was still an apprentice, he made an imitation of a famous Roman statue that was sold in Rome as an ancient Roman original. What was the name of the original statue?",RELIGION_94b2_0211,"Il Putto Dormiente",RELIGION_OPT_9792_000C
"All originals of Leonardo da Vincis Leda and the Swan have been either lost or destroyed.",RELIGION_2c2d_0212,True,RELIGION_OPT_1c95_000B
"How  many books are in the Torah?",RELIGION_b1fb_0213,5,RELIGION_OPT_15eb_000B
"Jason Marquis (Cardinals), Shawn Green (Arizona),and Brad Asmus (Houston) are all Jewish.",RELIGION_7d04_0214,True,RELIGION_OPT_7ea0_000A
"What was the only automobile brand named after a Jew?",RELIGION_86b0_0215,Citroen,RELIGION_OPT_7cd5_000B
"Which of these great home run hitters was Jewish?",RELIGION_1322_0216,"Hank Greenberg",RELIGION_OPT_e2f9_000B
"Except for Saturday, how many times a day must an Orthodox Jew pray?",RELIGION_d2cf_0217,3,RELIGION_OPT_c4f3_000B
"On front of the home of every Jew, there is a special decoration or religious symbol. It is also found inside the home at very doorpost and every gate. In each one, there are three sections of the (Old) Testament.  What do we call these religious objects?",RELIGION_bd97_0218,Mezzuzas,RELIGION_OPT_0b05_000C
"On Columbus first trip to the new world, many Jews were employed by Columbus. What was the highest job held by a Jew?",RELIGION_2db3_0219,Translator,RELIGION_OPT_7f3a_000B
"What religious article must every unmarried Jewish woman wear?",RELIGION_7a47_0220,None,RELIGION_OPT_088e_000C
"In Judaism locusts are kosher, which means that they are allowed to be eaten.",RELIGION_72a2_0221,True,RELIGION_OPT_46e7_000A
"In every synagogue, in every country in the world, there are the same number of statues. How many?",RELIGION_b395_0222,0,RELIGION_OPT_0291_000C
"According to the Bible, God forbade Adam and Eve to eat the fruit of the apple tree.",RELIGION_94e1_0223,False,RELIGION_OPT_173b_000A
"Who is the first human who murdered a human according to the Bible?",RELIGION_e943_0224,Cain,RELIGION_OPT_99f5_000B
"According to the Book of Revelation, there are angels of the Devil.",RELIGION_58ea_0225,True,RELIGION_OPT_ba11_000A
"It is written in the Bible, that false Christs and prophets will arise and will show great signs and wonders.",RELIGION_b9d8_0226,True,RELIGION_OPT_2b3c_000B
"According to Christian theology, Jesus Christ is a person with an entirely human nature.",RELIGION_1000_0227,False,RELIGION_OPT_c997_000A
"What Biblical figure built an ark on top of a mountain?",RELIGION_7a8a_0228,Noah,RELIGION_OPT_780f_000C
"What Biblical hero split the sea so that he and his people could go across?",RELIGION_2596_0229,Moses,RELIGION_OPT_864b_000D
"What does the name Moses mean according to the Bible?",RELIGION_f140_0230,"taken from the water",RELIGION_OPT_8c8e_000B
"How many books are there in the Bible?",RELIGION_e98d_0231,66,RELIGION_OPT_b558_000D
"How many times a year is a healthy, adult Jew required to fast?",RELIGION_fb91_0232,6,RELIGION_OPT_c2cd_000C
"Historically, Golda Meir was the first female Jewish leader.",RELIGION_32dc_0233,False,RELIGION_OPT_3b6b_000A
"What is the subject of the first Book of the  Talmud ?",RELIGION_81ca_0234,Blessings,RELIGION_OPT_dcb6_000B
"It is considered that the Jewish Golden Age occurred in this country.",RELIGION_1c8d_0235,Spain,RELIGION_OPT_9c37_000A
"In 1776, when we Jews declared themselves free from England, which British colony had the most Jews?",RELIGION_2a0d_0236,Jamaica,RELIGION_OPT_02d0_000C
"On the holy day, Simchat Torah, Jews finish reading the five books of the Torah and do what immediately after?",RELIGION_d49a_0237,"Start again",RELIGION_OPT_ba19_000B
"Jews build temporary huts for this holy day.",RELIGION_74e9_0238,Sukkot,RELIGION_OPT_36be_000C
"What does the Hebrew expression Mazel Tov mean?",RELIGION_dcc8_0239,"Good luck",RELIGION_OPT_b960_000D
"The Jewish calender is a lunar calender.",RELIGION_f2c0_0240,True,RELIGION_OPT_352d_000B
"Judaism divides The Old Testament into three parts, called this in English.",RELIGION_239f_0241,"Torah, Prophets, Wisdom Literature",RELIGION_OPT_9884_000C
"In what book of The New Testament was John the Baptist beheaded?",RELIGION_b5fa_0242,Matthew,RELIGION_OPT_bd25_000D
"In The New Testament, Romans was written by the apostle Paul.",RELIGION_f58b_0243,True,RELIGION_OPT_796a_000A
"How many books are in the New Testament?",RELIGION_7e79_0244,27,RELIGION_OPT_fb72_000B
"It is believed by many that the Gospel of Luke is the most beautiful book ever written.",RELIGION_4c5e_0245,True,RELIGION_OPT_d635_000B
"Which of the laws in  the Ten Commandments of the New Testament is conceived to be the greatest one?",RELIGION_5b2c_0246,"Love the Lord with all your heart, soul and mind",RELIGION_OPT_a247_000C
"In the New Testament, Acts is the next book after Romans.",RELIGION_388a_0247,False,RELIGION_OPT_c3be_000A
"What is the third book of the New Testament?",RELIGION_42e5_0248,Luke,RELIGION_OPT_57b7_000D
"What did Jesus do to the man with leprosy, according to The New Testament?",RELIGION_e60b_0249,"touched him and cured him",RELIGION_OPT_504c_000D
"Paul is acknowledged as the author of  First Epistle to the Corinthians book in The New Testament.",RELIGION_318c_0250,True,RELIGION_OPT_f941_000A
"In which book of The New Testament is the following passage found Ask and it will be given to you;seek and you will find;knock and the door will be opened to you?",RELIGION_e160_0251,Matthew,RELIGION_OPT_278c_000B
"What was the name of Abrahams wife according to the book of Genesis?",RELIGION_373a_0252,Sarah,RELIGION_OPT_10c9_000D
"In the book of Genesis, how old was Abraham when Isaac was born?",RELIGION_79d3_0253,"100 years old",RELIGION_OPT_e0fb_000C
"Isaac was Abrahams first son according to the Torah.",RELIGION_e493_0254,False,RELIGION_OPT_4276_000A
"What was the name of Isaacs wife according to the book of Genesis?",RELIGION_ecdb_0255,Rebekah,RELIGION_OPT_7f53_000D
"The book of Genesis tells that when Esau and Jacob were born, Jacob grabbed hold of what?",RELIGION_1428_0256,"Esaus heel",RELIGION_OPT_f2c1_000C
"According to the Torah, what did Esau trade his birthright with Jacob for?",RELIGION_8b2c_0257,"Bread and lentil stew",RELIGION_OPT_159e_000C
"Who was Jacobs first wife in the book of Genesis?",RELIGION_fece_0258,Leah,RELIGION_OPT_505e_000A
"How many years did Jacob have to work for each of his wives according to the Torah?",RELIGION_92a0_0259,"7 years each",RELIGION_OPT_5b5b_000B
"Who founded the Scientology philosophy and religion?",RELIGION_ab20_0260,"L. Ron Hubbard",RELIGION_OPT_08bc_000A
"This actor, who made it big as a high school gang member, delivering paint and flying airplanes, is one of the most famous Scientologists.",RELIGION_f882_0261,"John Travolta",RELIGION_OPT_de69_000B
"Which of these voice actors/actresses from The Simpsons series, is a Scientologist?",RELIGION_de85_0262,"Nancy Cartwright",RELIGION_OPT_8c00_000B
"These two brothers are Scientologists who acted on famous comedy sitcoms. One was on That 70s Show and the other one was the oldest brother on Malcolm in the Middle. What is their last name?",RELIGION_ee20_0263,Masterson,RELIGION_OPT_d2bf_000B
"Which Scientologist played the wife of “The King of Queens?",RELIGION_5f86_0264,"Leah Remini",RELIGION_OPT_991e_000D
"Lisa Marie Presley and her mother Priscilla Presley are both Scientologists.",RELIGION_b055_0265,True,RELIGION_OPT_dfb0_000A
"Which of these musicians is not a Scientologist?",RELIGION_e61f_0266,"Michael Bolton",RELIGION_OPT_b113_000D
"What Scientologist started the EST movement?",RELIGION_f51c_0267,"Werner Erhard",RELIGION_OPT_4ffd_000B
"What was Operation Snow White?",RELIGION_c13a_0268,"An attempt by Scientology to infiltrate the US government",RELIGION_OPT_5efd_000B
"The title of what book in the Bible means departure?",RELIGION_8b40_0269,Exodus,RELIGION_OPT_94b9_000B
"Deuteronomy, the title of the fifth book of the Hebrew Bible, means second law.",RELIGION_7cab_0270,True,RELIGION_OPT_d719_000A
"What is the meaning of the book title Genesis?",RELIGION_c7c8_0271,beginning,RELIGION_OPT_6d23_000C
"Does The Book of Numbers from the Old Testament begin with the numbering of the people in Sinai?",RELIGION_b06b_0272,Yes,RELIGION_OPT_d3c3_000B
"What book in the Bible was named after the successor of Moses?",RELIGION_2363_0273,Joshua,RELIGION_OPT_474d_000C
"Where can you find the story of Adam and Eve?",RELIGION_8e3f_0274,"Book of Genesis",RELIGION_OPT_0a0a_000B
"The story of Moses birth can be found in the Book of Deuteronomy.",RELIGION_f119_0275,False,RELIGION_OPT_73f4_000B
"Was Moses still alive in the Book of Numbers?",RELIGION_51e2_0276,Yes,RELIGION_OPT_f13f_000A
"What was the age of Joshua (Moses successor) when he died?",RELIGION_6f03_0277,"110 years old",RELIGION_OPT_5c3b_000C
"Which 10th century Ashkenazi Rabbi outlawed polygamy?",RELIGION_d7e7_0278,"Rabbi Gershom",RELIGION_OPT_678c_000C
"The first international Jewish athletic competition, known as Maccabiah Games, was held in what year?",RELIGION_4409_0279,1932,RELIGION_OPT_fbff_000C
"What is the name of the collection of stories, legends, and allegorical interpretations of the Hebrew Bible Tanach?",RELIGION_302f_0280,Midrash,RELIGION_OPT_0fc6_000B
"The first day of the Jewish New Year, Rosh Hashanah, can only occur on which of these days?",RELIGION_7026_0281,"Monday, Tuesday, Thursday or Saturday",RELIGION_OPT_eab6_000C
"The first female Rabbi, Berlin-born Regina Jonas, was ordained in what year?",RELIGION_c464_0282,1935,RELIGION_OPT_0b0f_000A
"Four Jewish jobs require ordination (or Smeecha). Which of these is not one of them?",RELIGION_b675_0283,Cantor,RELIGION_OPT_2868_000A
"Jewish American Sidney Franklin was greatly admired by Ernest Hemingway, as he was the first American to become successful in what occupation?",RELIGION_f561_0284,Bullfighter,RELIGION_OPT_c87c_000B
"One of the most important prayers in Jewish liturgy is the the Shemoneh Esreh (The Eighteen) This prayer, which must be said every day at almost every service, is also known by what other name?",RELIGION_9184_0285,"The Amidah",RELIGION_OPT_c8bd_000B
"Mike Epstein, Norm Sherry, Larry Sherry, and Barry Latman were all Jewish baseball players. What do they have in common?",RELIGION_b7e7_0286,"They all went to the same high school.",RELIGION_OPT_d7d0_000C
"When did the Six Day War between Israel and the Arab states of Egypt, Jordan, and Syria begin?",RELIGION_c2a7_0287,"June 5, 1967",RELIGION_OPT_6311_000B
"In 1825, Jewish American diplomat and journalist Mordecai Manuel Noah tried to found what Jewish institution in the United States?",RELIGION_dde4_0288,"A Jewish homeland in the United States",RELIGION_OPT_5eab_000B
"Who was the first Jewish player in the United States National Hockey League?",RELIGION_d153_0289,"Sam Rothschild",RELIGION_OPT_f9be_000A
"Which of these terms is used by Jews to refer to the Old Testament?",RELIGION_553a_0290,Tanakh,RELIGION_OPT_6ff3_000C
"The most important religious document for the Jews, Torah, is written in what language?",RELIGION_1610_0291,Hebrew,RELIGION_OPT_7f2b_000D
"How many commandments are there in the central document of Judaism, Torah?",RELIGION_e5e9_0292,613,RELIGION_OPT_f149_000C
"According to Judaism, even non-Jews are morally bound to observe how many laws from the Torah?",RELIGION_21cc_0293,7,RELIGION_OPT_20af_000B
"Which of these prayers is traditionally sung before sunset on Yom Kippur, the Jewish Day of Atonement?",RELIGION_b5db_0294,"Kol Nidre",RELIGION_OPT_f73d_000C
"Every morning and evening, Jews must recite a prayer, which is also said at  the moment before death. What is the name of this prayer?",RELIGION_1c0a_0295,"The Shema Yisrael",RELIGION_OPT_5ac2_000D
"This is the holiest city in Judaism and the spiritual center of the Jewish people. It also plays an important role in Christianity and Islam.",RELIGION_a85c_0296,Jerusalem,RELIGION_OPT_2e80_000B
"The Temple Mount, the Church of Holy Sepulchre and the Western Wall are landmarks found in this city.",RELIGION_bc74_0297,Jerusalem,RELIGION_OPT_83f0_000C
"Who built the Temple of Jerusalem also known as the Holy Temple?",RELIGION_1fab_0298,"King Solomon",RELIGION_OPT_b19c_000D
"When was Jerusalem conquered by the Islamic Caliphate?",RELIGION_e223_0299,"In 638",RELIGION_OPT_b699_000D
"After the Arabic-Israeli War (1948-1949) Jerusalem was divided between Israel (West part) and Jordan (East part).",RELIGION_6778_0300,True,RELIGION_OPT_e9a0_000B
"What is Jesus birthplace according to the Bible?",RELIGION_394c_0301,Bethlehem,RELIGION_OPT_7348_000A
"Where is The Milk Grotto Church of Virgin Mary located?",RELIGION_eb1f_0302,Bethlehem,RELIGION_OPT_19ac_000A
"In Bethlehem, Christmas ceremonies are held on three different dates.",RELIGION_c120_0303,True,RELIGION_OPT_1b01_000B
"According to New Testament, the home of Joseph and Mary was in Jerusalem.",RELIGION_d897_0304,False,RELIGION_OPT_b38e_000A
"The Church of the Annunciation was built in Nazareth.",RELIGION_90ca_0305,True,RELIGION_OPT_276c_000A
"According to the Book of Matthew, Jacob was the father of Issac.",RELIGION_62a0_0306,False,RELIGION_OPT_7ecf_000B
"Who was king when Jesus was born?",RELIGION_f207_0307,"King Herod",RELIGION_OPT_bd03_000C
"Jesus was baptized by John the Baptist.",RELIGION_4792_0308,True,RELIGION_OPT_6201_000B
"In the Book of Matthew, what did Jesus say to the man with leprosy when he touched him?",RELIGION_14db_0309,"Be Clean!",RELIGION_OPT_48d0_000B
"Whose mother-in-law was lying in bed with a fever in the Book of Matthew?",RELIGION_bfa6_0310,Peter,RELIGION_OPT_ce1e_000A
"According to the Book of Matthew, how many disciples did Jesus give authority to heal the sick and drive out evil spirits?",RELIGION_b018_0311,12,RELIGION_OPT_c93d_000C
"Which of the apostles betrayed Jesus?",RELIGION_d0d8_0312,"Judas Iscariot",RELIGION_OPT_8cbd_000D
"Where did Ruth live when she met her first husband according to the Book of Ruth?",RELIGION_5b64_0313,Moab,RELIGION_OPT_603e_000B
"In the Book of Ruth, who was Ruths mother-in-law that she would not abandon?",RELIGION_dbd0_0314,Naomi,RELIGION_OPT_cc13_000A
"Who was Ruths sister-in-law according to the Book of Ruth?",RELIGION_7e6d_0315,Orpah,RELIGION_OPT_dc9d_000C
"In the Book of Ruth, after the deaths of Naomis husband and her two sons, Naomi wanted to leave Moab. Where did she go?",RELIGION_b6b7_0316,Bethlehem,RELIGION_OPT_29b3_000A
"In the Book of Ruth, what did Ruth do to indicate that she wanted to be redeemed?",RELIGION_435a_0317,"Sleep at Boaz feet.",RELIGION_OPT_e8dc_000D
"In the Book of Ruth, Boaz was the closest relative thats why he came forward as the kinsman-redeemer.",RELIGION_9c1f_0318,False,RELIGION_OPT_17da_000B
"According to the Book of Ruth, what did the kinsman-redeemer give to Boaz to indicate that Boaz would be the redeemer of Ruth?",RELIGION_ff36_0319,"His sandal",RELIGION_OPT_cb80_000D
"What was the name of Ruth and Boazs son in the Book of Ruth?",RELIGION_671a_0320,Obed,RELIGION_OPT_6706_000D
"The Book of Ruth comes after this book.",RELIGION_c260_0321,Judges,RELIGION_OPT_1265_000D
"How many books are there in the Old Testament of the Bible?",RELIGION_66a9_0322,39,RELIGION_OPT_b1db_000A
"Finish the title of this book of the Old Testament: The Song of _____",RELIGION_1eca_0323,Solomon,RELIGION_OPT_753e_000A
"Which book of the Old Testament of the Bible has the least number of chapters?",RELIGION_eaf1_0324,Obadiah,RELIGION_OPT_7afe_000A
"Which book of the Old Testament has the most chapters?",RELIGION_f5cb_0325,Psalms,RELIGION_OPT_c6fe_000A
"The first two books in the Old Testament are Genesis and Exodus. What is the name of the third book?",RELIGION_189f_0326,Leviticus,RELIGION_OPT_36a4_000D
"What is the title of the last book of the Old Testament?",RELIGION_130f_0327,Malachi,RELIGION_OPT_b341_000B
"Which of these books doesnt belong with the others?",RELIGION_d7fb_0328,Jude,RELIGION_OPT_5e89_000C
"Amos is the first book of the Old Testament alphabetically.",RELIGION_a9c7_0329,True,RELIGION_OPT_b492_000A
"Which of these books of the Old Testament is not divided into parts I and II?",RELIGION_1665_0330,Numbers,RELIGION_OPT_6df2_000B
"There are 32 chapters in the Book of Proverbs.",RELIGION_1a47_0331,False,RELIGION_OPT_25f2_000B
"Who was the first US President whose name appeared on the charter of a synagogue?",RELIGION_26ec_0332,"Franklin Pierce",RELIGION_OPT_8104_000C
"Who was the  first Jew to serve as a  diplomat for the USA?",RELIGION_6cd4_0333,"Mordechai Noah",RELIGION_OPT_3117_000B
"Who was the first Jew to be offered a position on the US Supreme Court?",RELIGION_ab5f_0334,"Judah Benjamin",RELIGION_OPT_cae7_000D
"Who was the  first Jew to serve as US Minister to The Hague?",RELIGION_1a1d_0335,"August Belmont",RELIGION_OPT_e3de_000B
"What was the approximate Jewish population of the United States in 1790?",RELIGION_324e_0336,1300-1500,RELIGION_OPT_60a9_000C
"During the Revolutionary War many Jews volunteered to fight the British and there was even a Jew Company. Where were the members of this company  from?",RELIGION_e23d_0337,"Charleston, S.C.",RELIGION_OPT_a42a_000C
"How many years did Golda Meir serve as President of Israel?",RELIGION_b56e_0338,0,RELIGION_OPT_d171_000A
"Who was the first President of Israel?",RELIGION_c675_0339,"Chaim Weizmann",RELIGION_OPT_3f97_000B
"Who was famous for saying We will fight the War [WWII] as if there were no White Paper and the White paper as if there were no war.?",RELIGION_2cdd_0340,"David Ben-Gurion",RELIGION_OPT_fb6b_000D
"Which successful Israeli General lost an eye and was famous for wearing an eye patch?",RELIGION_32a8_0341,"Moshe Dayan",RELIGION_OPT_ca5d_000D
"What does the term Chabad, as in Chabad Hasidism, mean?",RELIGION_dbaf_0342,"It stands for wisdaom, understanding and knowledge.",RELIGION_OPT_4f04_000C
"This great American Army officer helped form the Israeli Army. He was responsible for organizing the army along modern lines and for leading the effort  to save Jerusalem in the 1948 war.",RELIGION_19c6_0343,"Mickey Marcus",RELIGION_OPT_d8b5_000D
"What king of Babylon took over Jerusalem in the first chapter of the Book of Daniel?",RELIGION_3ee8_0344,Nebuchadnezzar,RELIGION_OPT_6cc5_000A
"According to the Book of Daniel, upon his arrival in Babylon, what was Daniels name changed to?",RELIGION_b932_0345,Belteshazzar,RELIGION_OPT_7bd8_000C
