question,QID,answer,answer_OID
"What were the Hebrew names of Shadrach, Meshach and Abednego according to the Book of Daniel?",RELIGION_bf22_0346,"Hananiah, Mishael and Azariah",RELIGION_OPT_56da_000D
"In the second chapter of the Book of Daniel, what did King Nebuchadnezzar have a dream about?",RELIGION_473c_0347,"A statue",RELIGION_OPT_6fe9_000D
"In King Nebuchadnezzars dream from the second chapter of the Book of Daniel, what kingdom does the head of gold represent?",RELIGION_7b48_0348,"Babylonian Empire",RELIGION_OPT_e43d_000B
"What kingdom do the legs of iron represent in King Nebuchadnezzars dream in the second chapter of the Book of Daniel?",RELIGION_2409_0349,"Roman Empire",RELIGION_OPT_7b41_000A
"In the Book of Daniel, in King Nebuchadnezzars dream, the Greek Empire was represented by the chest and arms of silver.",RELIGION_297c_0350,False,RELIGION_OPT_2962_000B
"In the Book of Daniel, what would Shadrach, Meshach and Abednego not bow down to?",RELIGION_7c9d_0351,"An image of gold",RELIGION_OPT_462b_000A
"Since they did not bow down, as King Nebuchadnezzar commanded, what happened to Shadrach, Meshach and Abednego in the Book of Daniel?",RELIGION_c5fd_0352,"They were thrown into a fiery furnace.",RELIGION_OPT_8b34_000C
"Who was king of Babylon when Darius the Mede took over?",RELIGION_be10_0353,Belshazzar,RELIGION_OPT_be21_000B
"In the Book of Daniel, what did King Darius decree would happen if anyone prayed to any god or person, except for him for a period of 30 days?",RELIGION_66f9_0354,"They would be thrown into the lions den.",RELIGION_OPT_b3e3_000B
"What period was marked by the Great Jewish Revolt against the Roman Empire?",RELIGION_7ae6_0355,66-70,RELIGION_OPT_f920_000C
"Who led the Jewish revolt against the Roman Empire in the period from 132 to 135?",RELIGION_f8d6_0356,"Bar Kochba and Rabbi Akiva",RELIGION_OPT_9469_000C
"What does the number 613 refer to in Judaism?",RELIGION_2f4a_0357,"The number of commandments in the Torah",RELIGION_OPT_ded4_000B
"What distinction does Moses Alexander hold?",RELIGION_529c_0358,"He was the first Jewish governor in the USA.",RELIGION_OPT_dfc3_000A
"What distinction does Frank Wolf hold?",RELIGION_066c_0359,"He produced the first Yiddish play in then USA.",RELIGION_OPT_272c_000D
"What was the name of the first union for actors in the US?",RELIGION_c00e_0360,"The Hebrew Actors Union",RELIGION_OPT_b48b_000D
"What did Rose and Morris Michtom create in 1902?",RELIGION_52d8_0361,"The Teddy Bear",RELIGION_OPT_08dd_000A
"What is Victor David Brenner remembered for?",RELIGION_d603_0362,"He made the portrait of Lincoln found on the US penny.",RELIGION_OPT_a9bd_000D
"Which settlement is famous as the location of one of the most spectacular craters in Israel?",RELIGION_49ad_0363,"Mitzpeh Ramon",RELIGION_OPT_46e4_000B
"Which organization was founded by Rabbi Ben Frankel in 1923?",RELIGION_1850_0364,"The Hillel Foundation",RELIGION_OPT_22fa_000C
"The circled-U symbol found on the labels of certain products shows that the Union of Orthodox Congregations have found the food is kosher. What was the first food product to have this symbol?",RELIGION_5d8d_0365,"Heinz ketchup",RELIGION_OPT_39e5_000B
"Which Israeli city is a sister city of New York City?",RELIGION_a790_0366,"Tel Aviv",RELIGION_OPT_902e_000C
"Can an egg laid on a holy day (a Yom Tov) be eaten?",RELIGION_340c_0367,"Rabbi Hillel says no, but Rabbi Shammai says yes.",RELIGION_OPT_27aa_000B
"An Israeli has invented a gun that can shoot around corners.",RELIGION_2dda_0368,True,RELIGION_OPT_45a1_000B
"This Jewish woman is often considered the First Lady in Television  News.",RELIGION_f79c_0369,"Dorothy Fuldheim",RELIGION_OPT_015d_000C
"This man and his partner, Mort Shuman, wrote almost 1,500 songs. His writings include: Viva Las Vegas, Prisoner of Love, Sweets for My Sweets, This Magic Moment, and Suspicion.",RELIGION_6584_0370,"Doc Pomus",RELIGION_OPT_388c_000D
"What is strange about the edible vegetable Salicornia, which Israel exports to Europe?",RELIGION_2477_0371,"The vegetable is also used in glass-making.",RELIGION_OPT_4792_000D
"What city is called The capital of the Negev (desert)?",RELIGION_4f6d_0372,"Beer Sheva",RELIGION_OPT_adba_000A
"Who is Gal Friedman?",RELIGION_6dac_0373,"He was the first Israeli to win an Olympic gold  medal.",RELIGION_OPT_d680_000C
"This Israeli city, which features many beautiful beaches and beautiful seashore views, is also the site of the first IKEA in Israel.",RELIGION_48b5_0374,Netanya,RELIGION_OPT_fa79_000B
"You can go snow skiing in the area of which Israeli mountain?",RELIGION_8e10_0375,"Mt. Hermon",RELIGION_OPT_b82d_000B
"The Knesset is the Israeli parliament. In the Knesset building there is a tapestry by this famous artist.",RELIGION_7d8d_0376,Chagal,RELIGION_OPT_3426_000D
"This great proponent for peace and understanding, who was Mayor of Jerusalem for 28 years, died in January , 2007.",RELIGION_405e_0377,"Teddy  Kollek",RELIGION_OPT_1a54_000B
"Which of these holidays does not have a fast associated with it?",RELIGION_facc_0378,Sukkot,RELIGION_OPT_4bc3_000A
"Who was Ilon Ramon?",RELIGION_d9b0_0379,"The first Israeli astronaut",RELIGION_OPT_2a1c_000A
"What did these six people have in common: Roderigo De Trianna, Luis De Torres, Maestre Bernal, Alfonso De La Calle, Marco the Surgeon, and Roderigo Sanchez De Segovia?",RELIGION_a4c2_0380,"They all sailed with Columbus.",RELIGION_OPT_e710_000C
"Jewish women often wear a piece of jewelry with the shape of human hand and sometimes writings on it. What is it called?",RELIGION_0cc9_0381,Hamsa,RELIGION_OPT_1400_000B
"In Jewish traditions, what is the ceremony for the naming of a female baby on the evening of her fifth day?",RELIGION_c20a_0382,"The Eve of the Sixth",RELIGION_OPT_7938_000D
"During Jewish wedding ceremonies, the bride and groom stay under a canopy. What is this canopy called?",RELIGION_74eb_0383,Chupah,RELIGION_OPT_c239_000D
"The word Channukah, which refers to a Jewish tradition, means what in Hebrew?",RELIGION_3cee_0384,Dedication,RELIGION_OPT_11df_000A
"What meals are typically eaten during the celebrations of the Channukah holiday?",RELIGION_be80_0385,"Potato pancakes and jelly doughnuts",RELIGION_OPT_fd38_000B
"What is the traditional food for Shavuot, a major festival in Judaism?",RELIGION_753c_0386,"Dairy products",RELIGION_OPT_05c9_000D
"Which line contains the correct names of the three Pilgrimage Festivals in Judaism?",RELIGION_1f44_0387,"Sukkot, Passover, and Shavuot",RELIGION_OPT_a0fa_000D
"Which line represents the correct beginning of the Shema prayer?",RELIGION_0794_0388,"Hear, O Israel! The Lord is our God! The Lord is One!",RELIGION_OPT_bd7b_000B
"Which of these people do Jews consider to be their historical religious Patriarchs?",RELIGION_5ec9_0389,"Abraham, Issac, and Jacob",RELIGION_OPT_dd48_000B
"Who is considered the father of the Jewish political movement and ideology of Zionism?",RELIGION_6f70_0390,"Theodor Herzl",RELIGION_OPT_596c_000A
"Jewish children are considered  grown up enough to be responsible for their actions at what age?",RELIGION_7c17_0391,"Boys at 13, girls at 12",RELIGION_OPT_cda6_000B
"What is the meaning of the Hebrew toast lChaim!?",RELIGION_bba1_0392,"To life!",RELIGION_OPT_8cf0_000A
"According to the Bible, God commanded this prophet to anoint David as king.",RELIGION_6002_0393,Samuel,RELIGION_OPT_fc51_000B
"According to the Bible, David played this instrument to Israels first king, Saul.",RELIGION_d6a6_0394,Harp,RELIGION_OPT_0a48_000B
"Who was Davids father according to the Bible?",RELIGION_8996_0395,Jesse,RELIGION_OPT_31ce_000A
"In the Bible, David fought the giant Goliath of Gath with a staff in his hand, a sling, and a shepherds bag which contained this number of stones.",RELIGION_7d8a_0396,5,RELIGION_OPT_20a9_000C
"According to the Bible, David was very close friends with this son of King Saul.",RELIGION_59e6_0397,Jonathan,RELIGION_OPT_0259_000B
"The Biblical king Saul became jealous of David because he was victorious in battle and was loved by all Israel. One day when David was playing the harp for him, Saul did which of the following in an attempt to kill him?",RELIGION_b07a_0398,"Hurled a spear",RELIGION_OPT_d8ca_000A
"According to the Bible, David married this daughter of Saul.",RELIGION_4290_0399,Michal,RELIGION_OPT_24b0_000A
"In the Bible, David once killed a lion and a bear.",RELIGION_ef37_0400,True,RELIGION_OPT_3ac4_000B
"What Jewish tribe did David belong to?",RELIGION_fd21_0401,Judah,RELIGION_OPT_9b8e_000A
"How many years did David reign as king of Israel?",RELIGION_27f9_0402,40,RELIGION_OPT_6c99_000D
"How long has Tel Aviv been the capital of Israel?",RELIGION_2f9f_0403,"None of these",RELIGION_OPT_b526_000C
"Who named Tel Aviv?",RELIGION_26c0_0404,"Nahum Sokolow",RELIGION_OPT_85b2_000B
"What was the approximate population of Tel Aviv according to the Israel Central Bureau of Statistics as of June 2006?",RELIGION_a190_0405,"380,600",RELIGION_OPT_9814_000D
"What is the Arabic name for Tel Aviv?",RELIGION_be8e_0406,"Tal al-rabey",RELIGION_OPT_ae61_000A
"What type of stone was used to build the Western or Wailing Wall in Jerusalem?",RELIGION_a280_0407,Limestone,RELIGION_OPT_0a48_000C
"Who was the first mayor of Tel Aviv?",RELIGION_3645_0408,"Meir Dizengoff",RELIGION_OPT_1d3c_000C
"What is the name of the Israeli National Theater?",RELIGION_9cbd_0409,Habima,RELIGION_OPT_1428_000C
"In what language do Ethiopian Jews read Torah?",RELIGION_1304_0410,Gez,RELIGION_OPT_fb9f_000A
"What is Israels number one agricultural export?",RELIGION_b542_0411,flowers,RELIGION_OPT_3869_000B
"What term is used to describe a persons return to live in Israel?",RELIGION_7d50_0412,aliyah,RELIGION_OPT_dfdf_000B
"What is the name of the organization that promotes a return to Israel?",RELIGION_11a1_0413,"The Jewish Agency",RELIGION_OPT_ffab_000D
"What kind of museum is the Batey Haosef Museum in Tel Aviv?",RELIGION_00c1_0414,military,RELIGION_OPT_332f_000D
"Which part of Israel is famous fro producing wine?",RELIGION_2d95_0415,"Golan Heights",RELIGION_OPT_b4e8_000C
"Who is given credit  for reviving the Hebrew language?",RELIGION_7dc8_0416,"Eliezer Ben Yehuda",RELIGION_OPT_51ca_000A
"What poem written by Chaim Nachman Bialik inspired many people to immigrate to Israel?",RELIGION_a4b4_0417,"The City of the Killings",RELIGION_OPT_c3f6_000D
"Arthur Loomis Harmon, who helped design the Empire State Building, designed what building in Jerusalem?",RELIGION_8d98_0418,"The YMCA",RELIGION_OPT_94ca_000C
"Hannukah (or Channukah) is the Jewish equivalent of Christmas.",RELIGION_610d_0419,False,RELIGION_OPT_9e02_000A
"Where in Israel was the Mishna written?",RELIGION_b8bd_0420,"The Galilee",RELIGION_OPT_f49d_000A
"Who wrote Psalm 23?",RELIGION_ac63_0421,David,RELIGION_OPT_6178_000B
"How many books is the Book of Psalms divided into?",RELIGION_4f16_0422,Five,RELIGION_OPT_7ef7_000B
"What are Psalms 120 to 134 referred to as?",RELIGION_878c_0423,"Psalms of Ascent",RELIGION_OPT_e48f_000C
"Who was the earliest author of a psalm?",RELIGION_1668_0424,Moses,RELIGION_OPT_0ec2_000B
"In Psalm 23, the Lord is referred to as what?",RELIGION_6742_0425,"My Shepherd",RELIGION_OPT_8546_000B
"The following lines are from which psalm? For You formed my inward parts; You wove me in my mothers womb. I will give thanks to You, for I am fearfully and wonderfully made.",RELIGION_1643_0426,"Psalm 139",RELIGION_OPT_7f8f_000B
"The Book of Psalms is classified as what type of book in the Bible?",RELIGION_567c_0427,Poetic,RELIGION_OPT_c6de_000A
"During her testimony at her trial, Joan of Arc stated she preferred which of the following to the sword?",RELIGION_bd87_0428,Banner,RELIGION_OPT_55ee_000C
"Where was Joan of Arc captured by Burgundian forces?",RELIGION_573c_0429,Compiegne,RELIGION_OPT_77d9_000C
"What was Joan of Arc accused of at her trial?",RELIGION_e580_0430,Heresy,RELIGION_OPT_012e_000C
"To what kind of capital punishment was Joan of Arc condemned?",RELIGION_c72f_0431,"Burning at the stake",RELIGION_OPT_0d8a_000C
"What extremely brave attempt to escape did Joan of Arc make while she was imprisoned in Rouen?",RELIGION_3b6c_0432,"She jumped from the tower where she was held prisoner.",RELIGION_OPT_fea6_000B
"Joan of Arc lived during the first half of what century?",RELIGION_7d08_0433,"15th century",RELIGION_OPT_db94_000A
"What is the name of the famous sci-fi author that created Scientology?",RELIGION_f612_0434,"L. Ron Hubbard",RELIGION_OPT_bdcb_000B
"What is the name of the book, that states points of the scientologic doctrine for the first time?",RELIGION_9213_0435,"Dianetics: The Modern Science of Mental Health",RELIGION_OPT_6d30_000D
"What is the name of the evil alien dictator who, according to Scientologists, placed millions of people on earth and killed them, using hydrogen bombs?",RELIGION_1ddf_0436,Xenu,RELIGION_OPT_31dc_000C
"Which of these celebrities is not a scientologist?",RELIGION_e833_0437,"Jack Nicholson",RELIGION_OPT_9445_000A
"What is the term that scientologists use to describe traumatic recordings that cause mental and psychosomatic physical problems?",RELIGION_9bb3_0438,engrams,RELIGION_OPT_677d_000A
"What do the eight corners of the Scientology cross symbolize?",RELIGION_6d7a_0439,"the eight dynamics of life",RELIGION_OPT_de63_000A
"Which of these countries does not recognize Scientology as an official religion?",RELIGION_7048_0440,Germany,RELIGION_OPT_7194_000C
"What is the literal meaning of the word scientology?",RELIGION_d173_0441,"The Study of Knowledge",RELIGION_OPT_c721_000D
"In the 1970s, members of The Church of Scientology committed infiltration of United States federal agencies in order to eliminate unfavorable reports on Scientology. What was the code name for the operation?",RELIGION_1450_0442,"Operation Snow White",RELIGION_OPT_bddc_000A
"What is the term scientologists use to describe an immortal spiritual being?",RELIGION_272d_0443,"a thetan",RELIGION_OPT_d56b_000A
"What is Rosh Chodesh?",RELIGION_809b_0444,"Celebration of the new month",RELIGION_OPT_5924_000A
"What is Yom Sheni shel Galuyot?",RELIGION_ca31_0445,"The extra day of observance of  some holidays in the Diaspora",RELIGION_OPT_6857_000A
"What is Yichuss?",RELIGION_5c23_0446,"Special honor you get from family members",RELIGION_OPT_475b_000A
"What does Yom Yerusalyim celebrate?",RELIGION_2fa7_0447,"The unification of the City of Jerusalem after the Six Days War",RELIGION_OPT_0f04_000D
"What do we call the  first written book of the Kabbalah?",RELIGION_feab_0448,Zohar,RELIGION_OPT_e708_000A
"What are the two major pronunciations of Hebrew?",RELIGION_29d1_0449,"Ashkenazi and Sephardeet",RELIGION_OPT_70f3_000D
"What are Dam, Tzefardea, Kinim?",RELIGION_b5c5_0450,"The first three plagues G-D put upon the Egyptians",RELIGION_OPT_99fd_000B
"What do we call the language spoken by Jews in Spain and Portugal, which consisted of mainly Spanish and Hebrew  words written in Hebrew letters?",RELIGION_c10b_0451,Ladino,RELIGION_OPT_bb51_000C
"The Hebrew term for the Old Testament is Tanach. How many books are in the Tanach?",RELIGION_cc70_0452,24,RELIGION_OPT_3773_000D
"What does Aygel Hah Zahav refer to?",RELIGION_acb6_0453,"The golden calf built by Aaron.",RELIGION_OPT_3deb_000D
"Which Hebrew term means genius?",RELIGION_07c8_0454,gaon,RELIGION_OPT_ba39_000D
"Who is considered the first Chassidic Rabbi?",RELIGION_7d51_0455,"the Baal Shem Tov",RELIGION_OPT_0460_000A
"The esoteric tradition known as Tantra originated in Tibet and is unique to Tibetan Buddhism.",RELIGION_5b8a_0456,False,RELIGION_OPT_f114_000A
"Which of the following is not one of the four main forms of Tibetan Buddhism?",RELIGION_6bd7_0457,Chan,RELIGION_OPT_03ae_000B
"What is the title of the leader of the Kagyu, one of the four major schools of Tibetan Buddhism?",RELIGION_1bbf_0458,Karmapa,RELIGION_OPT_2194_000B
"What is the name of the Tibetan King who is said to have brought and solidified Buddhism in Tibet?",RELIGION_7b21_0459,"Songtsen Gampo",RELIGION_OPT_c730_000B
"Which word refers to a Tibetan Buddhist lama or other religious figure, who has consciously decided to be reborn, in order to continue his/her religious pursuits?",RELIGION_8b8a_0460,Tulku,RELIGION_OPT_a678_000B
"Who was the founder of the first Tibetan Buddhist Dharma center in the West?",RELIGION_8dae_0461,"Chogyam Trungpa",RELIGION_OPT_ec14_000A
"Who is the second highest lama in the Gelugpa lineage of Tibetan Buddhism?",RELIGION_0987_0462,"Panchen Lama",RELIGION_OPT_ffd9_000A
"What year did the XIVth Dalai Lama escape Tibet?",RELIGION_aaa3_0463,1959,RELIGION_OPT_f26a_000B
"The Potala is traditionally the summer palace of the Dalai Lama in Tibet.",RELIGION_57c2_0464,False,RELIGION_OPT_bc3a_000B
"Padmasambhava, a widely revered Indian Buddhist master who founded the Tantric school of Buddhism in the 8th century, is known by what other name?",RELIGION_67eb_0465,"Guru Rinpoche",RELIGION_OPT_fa40_000D
"The Dalai Lama and the Karmapa are believed to be emanations of what deity?",RELIGION_2780_0466,Chenrenzig,RELIGION_OPT_4fa5_000C
"The Holy Grail is sometimes associated with which magical object in Celtic mythology?",RELIGION_d3b3_0467,"The cauldron of Bran",RELIGION_OPT_aca2_000C
"Who wrote Joseph dArimathie, the first literary work to link the Holy Grail with the Last Supper of Jesus and Joseph of Arimathea?",RELIGION_390e_0468,"Robert de Boron",RELIGION_OPT_48eb_000D
"In Arthurian legend Percival first saw the Holy Grail in the castle of the Fisher King, who was badly wounded in this part of the body.",RELIGION_21ad_0469,"in the groin",RELIGION_OPT_8f24_000B
"Percival was the first knight in Arthurian legend to see the Holy Grail in the castle of the Fisher King. He could not heal the King’s wound, though. Why?",RELIGION_d7b6_0470,"He did not ask the right question.",RELIGION_OPT_5bb1_000A
"Three Knights of the Round Table get to see the Holy Grail. First Percival, then Bors and next who of the following?",RELIGION_9c94_0471,Galahad,RELIGION_OPT_bfd3_000D
"The book ‘Holy Blood, Holy Grail’ by Michael Baigent, Richard Leigh, and Henry Lincoln proposes the hypothesis that Jesus and Mary Magdalene were actually married and upon Jesus’ death she fled to France, carrying his child.",RELIGION_15a9_0472,True,RELIGION_OPT_6587_000A
"In the mystery novel The Da Vinci Code by Dan Brown the secrets of the Holy Grail are kept by this secret society.",RELIGION_29b5_0473,"The priory of Sion",RELIGION_OPT_72c0_000B
"In the 1991 movie The Fisher King, Robin Williams’ character is obsessed with the legend of the Fisher King and tries to get the Holy Grail. He believes that this object is actually the Grail.",RELIGION_3675_0474,"а sport trophy",RELIGION_OPT_2035_000C
"The Holy Grail was a popular theme in many literary works from the 19th century such as the Arthurian cycle The Idylls of the King. Who was its author?",RELIGION_1ba5_0475,"Alfred, Lord Tennyson",RELIGION_OPT_58ed_000D
"The Holy Grail is usually presented as a large beautiful cup or dish. But medieval author Wolfram von Eschenbach claimed in his poem Perzival that the Grail was actually a crown given by God.",RELIGION_965e_0476,False,RELIGION_OPT_256a_000B
"The search for The Holy Grail is one of the central themes in the opera Persifal by this German composer.",RELIGION_75cb_0477,"Richard Wagner",RELIGION_OPT_bb1b_000A
"At Christmas, Christians celebrates the Nativity or birth of Jesus Christ in which city?",RELIGION_d4d7_0478,Bethlehem,RELIGION_OPT_4dd5_000B
"Which Christian saint, regarded as the first martyr of Christianity, is commemorated on December 27 or 26?",RELIGION_3656_0479,"Saint Stephen",RELIGION_OPT_4494_000D
"On September 8 or September 21, Eastern Orthodox Christians celebrate the birth of this important biblical figure to parents Joachim and Anna.",RELIGION_35a7_0480,"Virgin Mary",RELIGION_OPT_8d88_000C
"Which event is regarded as the greatest feast in the Christian calendar?",RELIGION_3d3e_0481,"Resurrection of Jesus",RELIGION_OPT_84ae_000A
"He is considered to be the first Jew  to set foot on land that would become part of the USA.",RELIGION_fbe3_0482,"Joachim Gaunse",RELIGION_OPT_0a2f_000B
"In 1649 he was warned out of trying to settle in Boston.",RELIGION_bb29_0483,"Solomon Franco",RELIGION_OPT_e29e_000B
"In 1656 the first Jewish cemetery in the USA was founded in this city.",RELIGION_4261_0484,"New  York City, NY",RELIGION_OPT_b176_000C
"He is considered the first Jew on American land to get the right  to serve in a militia.",RELIGION_c29c_0485,"Asser Levy",RELIGION_OPT_6771_000D
"In 1665, Abraham de Lucena was arrested and fined for selling goods at retail prices.",RELIGION_bdfa_0486,True,RELIGION_OPT_10cc_000B
"The funds to build the first Lutheran church were advanced by a Jew.",RELIGION_2e4e_0487,True,RELIGION_OPT_9288_000A
"The British Plantation Act gave Jews the right to become naturalized citizens with rights to trade within the colonies. In what year was it enacted?",RELIGION_f35f_0488,1740,RELIGION_OPT_abdc_000A
"This was the first colony to give Jews full political rights.",RELIGION_05a5_0489,"New York",RELIGION_OPT_f86d_000C
"This offered Jews full equality in all future US territories and states.",RELIGION_df9f_0490,"The Northwest Territory Act",RELIGION_OPT_d158_000A
"He was the first Jew to serve in a state legislature.",RELIGION_674c_0491,"Dr. Levi Myers",RELIGION_OPT_dc70_000B
"This famous pirate, who was a marrano, played a significant role in American history.",RELIGION_f371_0492,"Jean Lafitte",RELIGION_OPT_e87c_000A
"He was the first Jewish Commodore in the US Navy. He ended the practice of flogging which used to be an accepted form of punishment in the US Navy.",RELIGION_f760_0493,"Uriah Phillip Levy",RELIGION_OPT_2674_000A
"The Bnai Brit , a well known social welfare organization, was formed to help people who suffered in this American tragedy.",RELIGION_6c21_0494,"The great Chicago fire.",RELIGION_OPT_3c49_000D
"Morris Raphall, a Rabbi from New York City, was the first to open a session of Congress with a prayer. In what year did he do this?",RELIGION_7c4c_0495,1860,RELIGION_OPT_185f_000C
"The  first Yiddish play was produced in New York in this year.",RELIGION_49c7_0496,1882,RELIGION_OPT_954a_000C
"He was the first American-born Rabbi to lead a Chassidic group.",RELIGION_7969_0497,"Rabbi Levi Yitzach Halevi Horowitz",RELIGION_OPT_1318_000D
"Which of the following may save sinners according to the King James version of the Bible?",RELIGION_5c7d_0498,"personal relationship with God through His Son Jesus Christ",RELIGION_OPT_8b5e_000B
"What is the punishment for human sins as it is written according to the Bible?",RELIGION_19ac_0499,"second or spiritual death",RELIGION_OPT_c471_000D
"According to the Bible, is there anything that humans can do to be saved from Hell, the bottomless pit where worms dieth not?",RELIGION_4ea6_0500,Yes,RELIGION_OPT_6220_000A
"At Nazareth, this Biblical figure grew and waxed in spirit. His name means the anointed one.",RELIGION_80e2_0501,"Jesus Christ",RELIGION_OPT_463f_000B
"According to the Bible, people are reconciled with God because of His Sons death at the cross in Mount Golgotha.",RELIGION_3280_0502,True,RELIGION_OPT_bd73_000B
"According to the Bible, Jesus turned water to wine in this wedding feast that He had attended in Cana. Which of His miracles was this?",RELIGION_68b6_0503,"first miracle",RELIGION_OPT_2147_000D
"According to the Bible, who should believers use as mediator between them and God when they pray?",RELIGION_d0fd_0504,"Jesus Christ",RELIGION_OPT_5322_000C
"Which epistle states that there is one mediator between God and men?",RELIGION_e824_0505,Timothy,RELIGION_OPT_49f0_000D
"According to the King James Version of the Bible, what did God command people to do always, day and night?",RELIGION_65d7_0506,praying,RELIGION_OPT_3d5c_000D
"In the Bible, are there any verses that strictly mention “trinity” as a term?",RELIGION_fe94_0507,No,RELIGION_OPT_e309_000B
"What three things does the religious concept of the Trimurti represent?",RELIGION_19fd_0508,"Creator, Protector, and Destructor",RELIGION_OPT_0710_000D
"Biology divides cellular life forms into three basic life domains. What are they?",RELIGION_df2c_0509,"Archaea, Bacteria, and Eucaryota",RELIGION_OPT_ceb2_000C
"Is Nona the goddess of death in the Roman myth of the triple spinning fate goddesses?",RELIGION_0b51_0510,No,RELIGION_OPT_67b9_000B
"In biology, is the Great Apes family a species trinity comprising of chimpanzees, gorillas, and orangutans?",RELIGION_e3f8_0511,No,RELIGION_OPT_fc5b_000B
"Which one of these three basic chemical compounds can turn the blue litmus into red?",RELIGION_6675_0512,Acid,RELIGION_OPT_c2d3_000D
"St. Nicholas the Wonderworker is the patron saint of which of the following?",RELIGION_fcc8_0513,"All of these",RELIGION_OPT_53d0_000B
"St. Nicholas is revered by both Orthodox and Catholic Christians.",RELIGION_723b_0514,True,RELIGION_OPT_470e_000A
"Saint Nicholas is one of the sources of the holiday figure of Santa Claus.",RELIGION_96da_0515,True,RELIGION_OPT_f859_000A
"Where was the historical Saint Nicholas born?",RELIGION_68a5_0516,"Asia Minor",RELIGION_OPT_0c84_000A
"St. Nicholas is believed to have made a pilgrimage to the Holy Land.",RELIGION_30fd_0517,True,RELIGION_OPT_94a3_000B
"Saint Nicholas was released from prison in 313, after this emperor issued the Edict of Milan, extending official tolerance to Christianity.",RELIGION_e4ef_0518,"Constantine the Great",RELIGION_OPT_e077_000C
"Saint Nicholas died on 6 December.",RELIGION_bbad_0519,True,RELIGION_OPT_e6a9_000B
"The splendid Basilica di San Nicola (Basilica of Saint Nicholas) is in Rome.",RELIGION_e8b4_0520,False,RELIGION_OPT_d069_000B
"The historical Saint Nocholas was a Greek Bishop of what ancient town?",RELIGION_d885_0521,Myra,RELIGION_OPT_20e6_000A
"According to legend Saint Nicholas provided dowries to three young women who could not afford to marry.",RELIGION_e887_0522,True,RELIGION_OPT_a962_000A
